PT,AU,BA,BE,GP,AF,BF,CA,TI,SO,SE,BS,LA,DT,CT,CY,CL,SP,HO,DE,ID,AB,C1,RP,EM,RI,OI,FU,FX,CR,NR,TC,Z9,U1,U2,PU,PI,PA,SN,EI,BN,J9,JI,PD,PY,VL,IS,PN,SU,SI,MA,BP,EP,AR,DI,D2,PG,WC,SC,GA,UT,PM,OA,HC,HP,DA
J,"Falck, J; Coates, J; Jackson, SP",,,,"Falck, J; Coates, J; Jackson, SP",,,"Conserved modes of recruitment of ATM, ATR and DNA-PKcs to sites of DNA damage",NATURE,,,English,Article,,,,,,,DEPENDENT PROTEIN-KINASE; DOUBLE-STRAND BREAKS; CATALYTIC SUBUNIT; S-PHASE; IONIZING-RADIATION; MRE11 COMPLEX; IN-VITRO; CHECKPOINT; ACTIVATION; REPAIR,"Ataxia-telangiectasia mutated (ATM), ataxia-telangiectasia and Rad3-related (ATR) and DNA-dependent protein kinase catalytic subunit (DNA-PKcs) are members of the phosphoinositide-3-kinase-related protein kinase (PIKK) family, and are rapidly activated in response to DNA damage. ATM and DNA-PKcs respond mainly to DNA double-strand breaks, whereas ATR is activated by single-stranded DNA and stalled DNA replication forks. In all cases, activation involves their recruitment to the sites of damage. Here we identify related, conserved carboxy-terminal motifs in human Nbs1, ATRIP and Ku80 proteins that are required for their interaction with ATM, ATR and DNA-PKcs, respectively. These motifs are essential not only for efficient recruitment of ATM, ATR and DNA-PKcs to sites of damage, but are also critical for ATM-, ATR- and DNA-PKcs-mediated signalling events that trigger cell cycle checkpoints and DNA repair. Our findings reveal that recruitment of these PIKKs to DNA lesions occurs by common mechanisms through an evolutionarily conserved motif, and provide direct evidence that PIKK recruitment is required for PIKK-dependent DNA-damage signalling.","Univ Cambridge, Wellcome Trust & Canc Res UK Gurdon Inst, Cambridge CB2 1QN, England; Univ Cambridge, Dept Zool, Cambridge CB2 1QN, England","Jackson, SP (reprint author), Univ Cambridge, Wellcome Trust & Canc Res UK Gurdon Inst, Tennis Court Rd, Cambridge CB2 1QN, England.",s.jackson@gurdon.cam.ac.uk,"Dry, Kate/I-2328-2014","Jackson, Stephen Philip/0000-0001-9317-7937",,,,42,729,769,2,42,NATURE PUBLISHING GROUP,LONDON,"MACMILLAN BUILDING, 4 CRINAN ST, LONDON N1 9XW, ENGLAND",0028-0836,,,NATURE,Nature,31-Mar,2005,434,7033,,,,,605,611,,10.1038/nature03442,,7,Multidisciplinary Sciences,Science & Technology - Other Topics,911NN,WOS:000228011000036,15758953,No,,,11/20/17
J,"Banerjee, A; Yang, W; Karplus, M; Verdine, GL",,,,"Banerjee, A; Yang, W; Karplus, M; Verdine, GL",,,Structure of a repair enzyme interrogating undamaged DNA elucidates recognition of damaged DNA,NATURE,,,English,Article,,,,,,,FREE-ENERGY SIMULATIONS; CRYSTAL-STRUCTURE; SUBSTRATE RECOGNITION; REVERSE-TRANSCRIPTASE; PROTEIN; GLYCOSYLASE; 8-OXOGUANINE; CATALYSIS; COMPLEX; BASES,"How DNA repair proteins distinguish between the rare sites of damage and the vast expanse of normal DNA is poorly understood. Recognizing the mutagenic lesion 8-oxoguanine (oxoG) represents an especially formidable challenge, because this oxidized nucleobase differs by only two atoms from its normal counterpart, guanine (G). Here we report the use of a covalent trapping strategy to capture a human oxoG repair protein, 8-oxogunanine DNA glycosylase I (hOGG1), in the act of interrogating normal DNA. The X-ray structure of the trapped complex features a target G nucleobase extruded from the DNA helix but denied insertion into the lesion recognition pocket of the enzyme. Free energy difference calculations show that both attractive and repulsive interactions have an important role in the preferential binding of oxoG compared with G to the active site. The structure reveals a remarkably effective gate-keeping strategy for lesion discrimination and suggests a mechanism for oxoG insertion into the hOGG1 active site.","Harvard Univ, Dept Chem & Biol Chem, Cambridge, MA 02138 USA; Harvard Univ, Dept Mol & Cellular Biol, Cambridge, MA 02138 USA; Univ Strasbourg 1, ISIS, F-67000 Strasbourg, France","Karplus, M (reprint author), Harvard Univ, Dept Chem & Biol Chem, 12 Oxford St, Cambridge, MA 02138 USA.",marci@tammy.harvard.edu; verdine@chemistry.harvard.edu,"Yang, Wei/H-5428-2011",,NCI NIH HHS [R01 CA100742]; NIGMS NIH HHS [R01 GM044853],,,31,212,220,3,38,NATURE PUBLISHING GROUP,LONDON,"MACMILLAN BUILDING, 4 CRINAN ST, LONDON N1 9XW, ENGLAND",0028-0836,,,NATURE,Nature,31-Mar,2005,434,7033,,,,,612,618,,10.1038/nature03458,,7,Multidisciplinary Sciences,Science & Technology - Other Topics,911NN,WOS:000228011000037,15800616,No,,,11/20/17
J,"Hashizume, K; Chaussidon, M",,,,"Hashizume, K; Chaussidon, M",,,A non-terrestrial (16)O-rich isotopic composition for the protosolar nebula,NATURE,,,English,Article,,,,,,,EARLY SOLAR-SYSTEM; OXYGEN ISOTOPES; METEORITES; HETEROGENEITY; INCLUSIONS; RESERVOIR; NITROGEN; SAMPLES; GRAINS; ORIGIN,"The discovery in primitive components of meteorites(1,2) of large oxygen isotopic variations that could not be attributed to mass-dependent fractionation effects has raised a fundamental question: what is the composition of the protosolar gas from which the host grains formed? This composition is probably preserved in the outer layers of the Sun, but the resolution of astronomical spectroscopic measurements is still too poor to be useful for comparison with planetary material(3,4). Here we report a precise determination of the oxygen isotopic composition of the solar wind from particles implanted in the outer hundreds of nanometres of metallic grains in the lunar regolith. These layers of the grains are enriched in (16)O by >20 +/- 4 parts per thousand relative to the Earth, Mars and bulk meteorites, which implies the existence in the solar accretion disk of reactions-as yet unknown-that were able to change the (17)O/(16)O and (18)O/(16)O ratios in a way that was not dependent strictly on the mass of the isotope. Photochemical self-shielding of the CO gas irradiated by ultraviolet light(5-7) may be one of these key processes, because it depends on the abundance of the isotopes, rather than their masses.","Osaka Univ, Grad Sch Sci, Dept Earth & Space Sci, Osaka 5600043, Japan; CNRS, CRPG, F-54501 Vandoeuvre Les Nancy, France","Hashizume, K (reprint author), Osaka Univ, Grad Sch Sci, Dept Earth & Space Sci, Osaka 5600043, Japan.",kohash@ess.sci.osaka-u.ac.jp,"Chaussidon, Marc/E-7067-2017",,,,,30,76,77,1,12,NATURE PUBLISHING GROUP,LONDON,"MACMILLAN BUILDING, 4 CRINAN ST, LONDON N1 9XW, ENGLAND",0028-0836,,,NATURE,Nature,31-Mar,2005,434,7033,,,,,619,622,,10.1038/nature03432,,4,Multidisciplinary Sciences,Science & Technology - Other Topics,911NN,WOS:000228011000038,15800617,No,,,11/20/17
J,"Curro, NJ; Caldwell, T; Bauer, ED; Morales, LA; Graf, MJ; Bang, Y; Balatsky, AV; Thompson, JD; Sarrao, JL",,,,"Curro, NJ; Caldwell, T; Bauer, ED; Morales, LA; Graf, MJ; Bang, Y; Balatsky, AV; Thompson, JD; Sarrao, JL",,,Unconventional superconductivity in PuCoGa5,NATURE,,,English,Article,,,,,,,HIGH-TEMPERATURE SUPERCONDUCTIVITY; KNIGHT-SHIFT; NUCLEAR-RELAXATION; SPIN FLUCTUATION; CONSEQUENCES; NMR,"In the Bardeen-Cooper-Schrieffer theory of superconductivity, electrons form ( Cooper) pairs through an interaction mediated by vibrations in the underlying crystal structure. Like lattice vibrations, antiferromagnetic fluctuations can also produce an attractive interaction creating Cooper pairs, though with spin and angular momentum properties different from those of conventional superconductors. Such interactions have been implicated for two disparate classes of materials-the copper oxides(1,2) and a set of Ce- and U-based compounds(3). But because their transition temperatures differ by nearly two orders of magnitude, this raises the question of whether a common pairing mechanism applies. PuCoGa5 has a transition temperature intermediate between those classes and therefore may bridge these extremes(4). Here we report measurements of the nuclear spin-lattice relaxation rate and Knight shift in PuCoGa5, which demonstrate that it is an unconventional superconductor with properties as expected for antiferromagnetically mediated superconductivity. Scaling of the relaxation rates among all of these materials ( a feature not exhibited by their Knight shifts) establishes antiferromagnetic fluctuations as a likely mechanism for their unconventional superconductivity and suggests that related classes of exotic superconductors may yet be discovered.","Los Alamos Natl Lab, Los Alamos, NM 87545 USA; Chonnam Natl Univ, Dept Phys, Kwangju 500757, South Korea","Curro, NJ (reprint author), Los Alamos Natl Lab, POB 1663, Los Alamos, NM 87545 USA.",curro@lanl.gov,"Bauer, Eric/D-7212-2011","Curro, Nicholas/0000-0001-7829-0237",,,,27,227,228,1,41,NATURE PUBLISHING GROUP,LONDON,"MACMILLAN BUILDING, 4 CRINAN ST, LONDON N1 9XW, ENGLAND",0028-0836,,,NATURE,Nature,31-Mar,2005,434,7033,,,,,622,625,,10.1038/nature03428,,4,Multidisciplinary Sciences,Science & Technology - Other Topics,911NN,WOS:000228011000039,15800618,No,,,11/20/17
J,"Brixner, T; Stenger, J; Vaswani, HM; Cho, M; Blankenship, RE; Fleming, GR",,,,"Brixner, T; Stenger, J; Vaswani, HM; Cho, M; Blankenship, RE; Fleming, GR",,,Two-dimensional spectroscopy of electronic couplings in photosynthesis,NATURE,,,English,Article,,,,,,,PHOTON-ECHOES; FEMTOSECOND SPECTROSCOPY; INFRARED-SPECTROSCOPY; CHLOROBIUM-TEPIDUM; DIFFRACTIVE OPTICS; ANTENNA COMPLEXES; LINE-SHAPES; FMO COMPLEX; DYNAMICS; PROTEIN,"Time-resolved optical spectroscopy is widely used to study vibrational and electronic dynamics by monitoring transient changes in excited state populations on a femtosecond timescale(1). Yet the fundamental cause of electronic and vibrational dynamics-the coupling between the different energy levels involved-is usually inferred only indirectly. Two-dimensional femtosecond infrared spectroscopy based on the heterodyne detection of three-pulse photon echoes(2-7) has recently allowed the direct mapping of vibrational couplings, yielding transient structural information. Here we extend the approach to the visible range(3,8) and directly measure electronic couplings in a molecular complex, the Fenna-Matthews-Olson photosynthetic light-harvesting protein(9,10). As in all photosynthetic systems, the conversion of light into chemical energy is driven by electronic couplings that ensure the efficient transport of energy from light-capturing antenna pigments to the reaction centre(11). We monitor this process as a function of time and frequency and show that excitation energy does not simply cascade stepwise down the energy ladder. We find instead distinct energy transport pathways that depend sensitively on the detailed spatial properties of the delocalized excited-state wavefunctions of the whole pigment-protein complex.","Univ Calif Berkeley, Dept Chem, Berkeley, CA 94720 USA; Univ Calif Berkeley, Inst Quantitat Biomed Res QB3, Berkeley, CA 94720 USA; Univ Calif Berkeley, Lawrence Berkeley Lab, Phys Biosci Div, Berkeley, CA 94720 USA; Korea Univ, Dept Chem, Seoul 136701, South Korea; Korea Univ, Div Chem & Mol Engn, Ctr Multidimens Spect, Seoul 136701, South Korea; Arizona State Univ, Dept Chem & Biochem, Tempe, AZ 85287 USA","Fleming, GR (reprint author), Univ Calif Berkeley, Dept Chem, Berkeley, CA 94720 USA.",grfleming@lbl.gov,"Brixner, Tobias/S-1451-2016","Brixner, Tobias/0000-0002-6529-704X",,,,30,727,738,14,269,NATURE PUBLISHING GROUP,LONDON,"MACMILLAN BUILDING, 4 CRINAN ST, LONDON N1 9XW, ENGLAND",0028-0836,,,NATURE,Nature,31-Mar,2005,434,7033,,,,,625,628,,10.1038/nature03429,,4,Multidisciplinary Sciences,Science & Technology - Other Topics,911NN,WOS:000228011000040,15800619,No,,,11/20/17
J,"Schmittner, A",,,,"Schmittner, A",,,Decline of the marine ecosystem caused by a reduction in the Atlantic overturning circulation,NATURE,,,English,Article,,,,,,,OCEAN GENERAL-CIRCULATION; CLIMATE-CHANGE; THERMOHALINE CIRCULATION; NORTH-ATLANTIC; PRODUCTIVITY; MODEL; SYSTEM; SCALE; CO2,"Reorganizations of the Atlantic meridional overturning circulation were associated with large and abrupt climatic changes in the North Atlantic region during the last glacial period(1-4). Projections with climate models suggest that similar reorganizations may also occur in response to anthropogenic global warming(5-7). Here I use ensemble simulations with a coupled climate-ecosytem model of intermediate complexity to investigate the possible consequences of such disturbances to the marine ecosystem. In the simulations, a disruption of the Atlantic meridional overturning circulation leads to a collapse of the North Atlantic plankton stocks to less than half of their initial biomass, owing to rapid shoaling of winter mixed layers and their associated separation from the deep ocean nutrient reservoir. Globally integrated export production declines by more than 20 per cent owing to reduced upwelling of nutrient-rich deep water and gradual depletion of upper ocean nutrient concentrations. These model results are consistent with the available high-resolution palaeorecord, and suggest that global ocean productivity is sensitive to changes in the Atlantic meridional overturning circulation.","Oregon State Univ, Coll Ocean & Atmospher Sci, Corvallis, OR 97331 USA","Schmittner, A (reprint author), Oregon State Univ, Coll Ocean & Atmospher Sci, 104 COAS Adm Bldg, Corvallis, OR 97331 USA.",aschmittner@coas.oregonstae.edu,"Schmittner, Andreas/A-3101-2008; Schmittner, Andreas/O-9647-2015","Schmittner, Andreas/0000-0002-8376-0843",,,,28,165,168,3,34,NATURE PUBLISHING GROUP,LONDON,"MACMILLAN BUILDING, 4 CRINAN ST, LONDON N1 9XW, ENGLAND",0028-0836,,,NATURE,Nature,31-Mar,2005,434,7033,,,,,628,633,,10.1038/nature03476,,6,Multidisciplinary Sciences,Science & Technology - Other Topics,911NN,WOS:000228011000041,15800620,No,,,11/20/17
J,"Singer, BS; Hoffman, KA; Coe, RS; Brown, LL; Jicha, BR; Pringle, MS; Chauvin, A",,,,"Singer, BS; Hoffman, KA; Coe, RS; Brown, LL; Jicha, BR; Pringle, MS; Chauvin, A",,,Structural and temporal requirements for geomagnetic field reversal deduced from lava flows,NATURE,,,English,Article,,,,,,,MATUYAMA-BRUNHES BOUNDARY; ASTRONOMICAL CALIBRATION; POLARITY REVERSALS; RECORDS; AGES; TIMESCALE; DURATION; MANTLE; CORE,"Reversals of the Earth's magnetic field reflect changes in the geodynamo-flow within the outer core-that generates the field. Constraining core processes or mantle properties that induce or modulate reversals requires knowing the timing and morphology of field changes that precede and accompany these reversals(1-4). But the short duration of transitional field states and fragmentary nature of even the best palaeomagnetic records make it difficult to provide a timeline for the reversal process(1,5). Ar-40/Ar-39 dating of lavas on Tahiti, long thought to record the primary part of the most recent 'Matuyama-Brunhes' reversal, gives an age of 795 +/- 7 kyr, indistinguishable from that of lavas in Chile and La Palma that record a transition in the Earth's magnetic field, but older than the accepted age for the reversal. Only the 'transitional' lavas on Maui and one from La Palma (dated at 776 +/- 2 kyr), agree with the astronomical age for the reversal. Here we propose that the older lavas record the onset of a geodynamo process, which only on occasion would result in polarity change. This initial instability, associated with the first of two decreases in field intensity, began similar to 18 kyr before the actual polarity switch. These data support the claim(6) that complete reversals require a significant period for magnetic flux to escape from the solid inner core and sufficiently weaken its stabilizing effect(7).","Univ Wisconsin, Dept Geol & Geophys, Madison, WI 53706 USA; Calif Polytech State Univ San Luis Obispo, Dept Phys, San Luis Obispo, CA 93407 USA; Univ Calif Santa Cruz, Dept Earth Sci, Santa Cruz, CA 95064 USA; Univ Massachusetts, Dept Geosci, Amherst, MA 01003 USA; MIT, Dept Earth Atmospher & Planetary Sci, Cambridge, MA 02139 USA; Geosci Rennes UMR CNRS, F-35042 Rennes, France","Singer, BS (reprint author), Univ Wisconsin, Dept Geol & Geophys, 1215 W Dayton St, Madison, WI 53706 USA.",bsinger@geology.wisc.edu,"Singer, Bradley/F-4991-2012","Singer, Bradley/0000-0003-3595-5168",,,,28,71,75,2,11,NATURE PUBLISHING GROUP,LONDON,"MACMILLAN BUILDING, 4 CRINAN ST, LONDON N1 9XW, ENGLAND",0028-0836,,,NATURE,Nature,31-Mar,2005,434,7033,,,,,633,636,,10.1038/nature03431,,4,Multidisciplinary Sciences,Science & Technology - Other Topics,911NN,WOS:000228011000042,15800621,No,,,11/20/17
J,"Goddard, MR; Godfray, HCJ; Burt, A",,,,"Goddard, MR; Godfray, HCJ; Burt, A",,,Sex increases the efficacy of natural selection in experimental yeast populations,NATURE,,,English,Article,,,,,,,SACCHAROMYCES-CEREVISIAE; MEIOSIS-I; RECOMBINATION; FITNESS; EVOLUTION; GENE; CHLAMYDOMONAS; PERSPECTIVE; ADAPTATION; MUTATIONS,"Why sex evolved and persists is a problem for evolutionary biology, because sex disrupts favourable gene combinations and requires an expenditure of time and energy(1). Further, in organisms with unequal-sized gametes, the female transmits her genes at only half the rate of an asexual equivalent ( the twofold cost of sex)(2). Many modern theories that provide an explanation for the advantage of sex incorporate an idea originally proposed by Weismann more than 100 years ago: sex allows natural selection to proceed more effectively because it increases genetic variation(3-5). Here we test this hypothesis, which still lacks robust empirical support, with the use of experiments on yeast populations. Capitalizing on recent advances in the molecular biology of recombination in yeast, we produced by genetic manipulation strains that differed only in their capacity for sexual reproduction. We show that, as predicted by the theory, sex increases the rate of adaptation to a new harsh environment but has no measurable effect on fitness in a new benign environment where there is little selection.","Univ London Imperial Coll Sci Technol & Med, NERC, Ctr Populat Biol, Ascot SL5 7PY, Berks, England; Univ London Imperial Coll Sci Technol & Med, Dept Biol Sci, Ascot SL5 7PY, Berks, England","Goddard, MR (reprint author), Univ Auckland, Sch Biol Sci, Private Bag 92019, Auckland 1, New Zealand.",m.goddard@auckland.ac.nz,,,,,,29,243,248,9,241,NATURE PUBLISHING GROUP,LONDON,"MACMILLAN BUILDING, 4 CRINAN ST, LONDON N1 9XW, ENGLAND",0028-0836,,,NATURE,Nature,31-Mar,2005,434,7033,,,,,636,640,,10.1038/nature03405,,5,Multidisciplinary Sciences,Science & Technology - Other Topics,911NN,WOS:000228011000043,15800622,No,,,11/20/17
J,"Xu, Y; Padiath, QS; Shapiro, RE; Jones, CR; Wu, SC; Saigoh, N; Saigoh, K; Ptacek, LJ; Fu, YH",,,,"Xu, Y; Padiath, QS; Shapiro, RE; Jones, CR; Wu, SC; Saigoh, N; Saigoh, K; Ptacek, LJ; Fu, YH",,,Functional consequences of a CKI delta mutation causing familial advanced sleep phase syndrome,NATURE,,,English,Article,,,,,,,CASEIN KINASE-I; DROSOPHILA CIRCADIAN CLOCK; PERIOD PROTEIN; DOUBLE-TIME; GENE; DOUBLETIME; EPSILON; PHOSPHORYLATION; EXPRESSION; RHYTHMS,"Familial advanced sleep phase syndrome (FASPS) is a human behavioural phenotype characterized by early sleep times and early-morning awakening(1). It was the first human, mendelian circadian rhythm variant to be well-characterized, and was shown to result from a mutation in a phosphorylation site within the casein kinase I (CKI)-binding domain of the human PER2 gene. To gain a deeper understanding of the mechanisms of circadian rhythm regulation in humans, we set out to identify mutations in human subjects leading to FASPS. We report here the identification of a missense mutation (T44A) in the human CKI delta gene, which results in FASPS. This mutant kinase has decreased enzymatic activity in vitro. Transgenic Drosophila carrying the human CKI delta-T44A gene showed a phenotype with lengthened circadian period. In contrast, transgenic mice carrying the same mutation have a shorter circadian period, a phenotype mimicking human FASPS. These results show that CKI delta is a central component in the mammalian clock, and suggest that mammalian and fly clocks might have different regulatory mechanisms despite the highly conserved nature of their individual components.","Univ Calif San Francisco, Dept Neurol, San Francisco, CA 94143 USA; Univ Vermont, Coll Med, Dept Neurol, Burlington, VT 05405 USA; Univ Utah, Dept Neurol, Salt Lake City, UT 84132 USA; Univ Calif San Francisco, Howard Hughes Med Inst, San Francisco, CA 94143 USA","Fu, YH (reprint author), Univ Calif San Francisco, Dept Neurol, San Francisco, CA 94143 USA.",yinghui@itsa.ucsf.edu,"Xu, Ying/A-3009-2013","Xu, Ying/0000-0002-6689-7768",,,,30,400,412,3,26,NATURE PUBLISHING GROUP,LONDON,"MACMILLAN BUILDING, 4 CRINAN ST, LONDON N1 9XW, ENGLAND",0028-0836,,,NATURE,Nature,31-Mar,2005,434,7033,,,,,640,644,,10.1038/nature03453,,5,Multidisciplinary Sciences,Science & Technology - Other Topics,911NN,WOS:000228011000044,15800623,No,,,11/20/17
J,"Glasson, SS; Askew, R; Sheppard, B; Carito, B; Blanchet, T; Ma, HL; Flannery, CR; Peluso, D; Kanki, K; Yang, ZY; Majumdar, MK; Morris, EA",,,,"Glasson, SS; Askew, R; Sheppard, B; Carito, B; Blanchet, T; Ma, HL; Flannery, CR; Peluso, D; Kanki, K; Yang, ZY; Majumdar, MK; Morris, EA",,,Deletion of active ADAMTS5 prevents cartilage degradation in a murine model of osteoarthritis,NATURE,,,English,Article,,,,,,,HUMAN SYNOVIAL-FLUID; INTERGLOBULAR DOMAIN; AGGRECAN FRAGMENTS; MICE; EXPLANTS; CLONING; CLEAVES; FAMILY,"Human osteoarthritis is a progressive disease of the joints characterized by degradation of articular cartilage. Although disease initiation may be multifactorial, the cartilage destruction appears to be a result of uncontrolled proteolytic extracellular matrix destruction. A major component of the cartilage extracellular matrix is aggrecan, a proteoglycan that imparts compressive resistance to the tissue. Aggrecan is cleaved at a specific 'aggrecanase' site in human osteoarthritic cartilage(1-2); this cleavage can be performed by several members of ADAMTS family of metalloproteases(3-9). The relative contribution of individual ADAMTS proteases to cartilage destruction during osteoarthritis has not been resolved. Here we describe experiments with a genetically modified mouse in which the catalytic domain of ADAMTS5 (aggrecanase-2) was deleted. After surgically induced joint instability, there was significant reduction in the severity of cartilage destruction in the ADAMTS5 knockout mice compared with wild-type mice. This is the first report of a single gene deletion capable of abrogating the course of cartilage destruction in an animal model of osteoarthritis. These results demonstrate that ADAMTS5 is the primary 'aggrecanase' responsible for aggrecan degradation in a murine model of osteoarthritis, and suggest rational strategies for therapeutic intervention in osteoarthritis.","Wyeth Res, Dept Womens Hlth & Bone, Cambridge, MA 02140 USA; Wyeth Res, Genom, Cambridge, MA 02140 USA; Wyeth Res, Drug Safety & Metab, Cambridge, MA 02140 USA","Morris, EA (reprint author), Wyeth Res, Dept Womens Hlth & Bone, 200 CambridgePk Dr, Cambridge, MA 02140 USA.",Emorris@Wyeth.com,,,,,,16,662,700,1,53,NATURE PUBLISHING GROUP,LONDON,"MACMILLAN BUILDING, 4 CRINAN ST, LONDON N1 9XW, ENGLAND",0028-0836,,,NATURE,Nature,31-Mar,2005,434,7033,,,,,644,648,,10.1038/nature03369,,5,Multidisciplinary Sciences,Science & Technology - Other Topics,911NN,WOS:000228011000045,15800624,No,,,11/20/17
