PT,AU,BA,BE,GP,AF,BF,CA,TI,SO,SE,BS,LA,DT,CT,CY,CL,SP,HO,DE,ID,AB,C1,RP,EM,RI,OI,FU,FX,CR,NR,TC,Z9,U1,U2,PU,PI,PA,SN,EI,BN,J9,JI,PD,PY,VL,IS,PN,SU,SI,MA,BP,EP,AR,DI,D2,PG,WC,SC,GA,UT,PM,OA,HC,HP,DA
J,"Mueller, KL; Hoon, MA; Erlenbach, I; Chandrashekar, J; Zuker, CS; Ryba, NJP",,,,"Mueller, KL; Hoon, MA; Erlenbach, I; Chandrashekar, J; Zuker, CS; Ryba, NJP",,,The receptors and coding logic for bitter taste,NATURE,,,English,Article,,,,,,,MAMMALIAN SWEET; MICE; SACCHARIN; RESPONSES; PATHWAYS; STIMULI; FAMILY; MOUSE; CELLS,"The sense of taste provides animals with valuable information about the nature and quality of food. Bitter taste detection functions as an important sensory input to warn against the ingestion of toxic and noxious substances. T2Rs are a family of approximately 30 highly divergent G-protein-coupled receptors (GPCRs)(1,2) that are selectively expressed in the tongue and palate epithelium(1) and are implicated in bitter taste sensing(1-8). Here we demonstrate, using a combination of genetic, behavioural and physiological studies, that T2R receptors are necessary and sufficient for the detection and perception of bitter compounds, and show that differences in T2Rs between species ( human and mouse) can determine the selectivity of bitter taste responses. In addition, we show that mice engineered to express a bitter taste receptor in 'sweet cells'(9) become strongly attracted to its cognate bitter tastants, whereas expression of the same receptor ( or even a novel GPCR) in T2R-expressing cells resulted in mice that are averse to the respective compounds. Together these results illustrate the fundamental principle of bitter taste coding at the periphery: dedicated cells act as broadly tuned bitter sensors that are wired to mediate behavioural aversion.","Univ Calif San Diego, Howard Hughes Med Inst, La Jolla, CA 92093 USA; Univ Calif San Diego, Dept Biol, La Jolla, CA 92093 USA; Univ Calif San Diego, Dept Neurosci, La Jolla, CA 92093 USA; Natl Inst Dent & Craniofacial Res, NIH, Bethesda, MD 20892 USA","Zuker, CS (reprint author), Univ Calif San Diego, Howard Hughes Med Inst, La Jolla, CA 92093 USA.",charles@flyeye.ucsd.edu; nick.ryba@nih.gov,,,,,,21,277,291,9,77,NATURE PUBLISHING GROUP,LONDON,"MACMILLAN BUILDING, 4 CRINAN ST, LONDON N1 9XW, ENGLAND",0028-0836,,,NATURE,Nature,10-Mar,2005,434,7030,,,,,225,229,,10.1038/nature03352,,5,Multidisciplinary Sciences,Science & Technology - Other Topics,904JU,WOS:000227494500048,15759003,No,,,11/20/17
J,"Wang, YC; Ferguson, EL",,,,"Wang, YC; Ferguson, EL",,,Spatial bistability of Dpp-receptor interactions during Drosophila dorsal-ventral patterning,NATURE,,,English,Article,,,,,,,TWISTED GASTRULATION; SIGNAL-TRANSDUCTION; ACTIVITY GRADIENT; BMP ACTIVITY; I RECEPTORS; EMBRYO; GENE; SOG; IDENTIFICATION; ACTIVATION,"In many developmental contexts, a locally produced morphogen specifies positional information by forming a concentration gradient over a field of cells(1). However, during embryonic dorsal - ventral patterning in Drosophila, two members of the bone morphogenetic protein (BMP) family, Decapentaplegic (Dpp) and Screw (Scw), are broadly transcribed but promote receptor-mediated signalling in a restricted subset of expressing cells(2-4). Here we use a novel immunostaining protocol to visualize receptor-bound BMPs and show that both proteins become localized to a sharp stripe of dorsal cells. We demonstrate that proper BMP localization involves two distinct processes. First, Dpp undergoes directed, long-range extracellular transport. Scw also undergoes long-range movement, but can do so independently of Dpp transport. Second, an intracellular positive feedback circuit promotes future ligand binding as a function of previous signalling strength. These data elicit a model in which extracellular Dpp transport initially creates a shallow gradient of BMP binding that is acted on by positive intracellular feedback to produce two stable states of BMP - receptor interactions, a spatial bistability in which BMP binding and signalling capabilities are high in dorsal-most cells and low in lateral cells.","Univ Chicago, Dept Organismal Biol & Anat, Chicago, IL 60637 USA; Univ Chicago, Dept Mol Genet & Cell Biol, Chicago, IL 60637 USA","Ferguson, EL (reprint author), Univ Chicago, Dept Organismal Biol & Anat, Chicago, IL 60637 USA.",elfergus@midway.uchicago.edu,,"Ferguson, Edwin/0000-0003-4125-4253",,,,31,135,139,0,18,NATURE PUBLISHING GROUP,LONDON,"MACMILLAN BUILDING, 4 CRINAN ST, LONDON N1 9XW, ENGLAND",0028-0836,,,NATURE,Nature,10-Mar,2005,434,7030,,,,,229,234,,10.1038/nature03318,,6,Multidisciplinary Sciences,Science & Technology - Other Topics,904JU,WOS:000227494500049,15759004,No,,,11/20/17
J,"Inoue, N; Ikawa, M; Isotani, A; Okabe, M",,,,"Inoue, N; Ikawa, M; Isotani, A; Okabe, M",,,The immunoglobulin superfamily protein Izumo is required for sperm to fuse with eggs,NATURE,,,English,Article,,,,,,,PLASMA-MEMBRANE; CD9-DEFICIENT MICE; ACROSOME REACTION; HUMAN-SPERMATOZOA; GAMETE FUSION; FERTILIN-BETA; MOUSE; BINDING; RECEPTORS; CALMEGIN,"Representing the 60 trillion cells that build a human body, a sperm and an egg meet, recognize each other, and fuse to form a new generation of life. The factors involved in this important membrane fusion event, fertilization, have been sought for a long time(1). Recently, CD9 on the egg membrane was found to be essential for fusion(2-4), but sperm-related fusion factors remain unknown. Here, by using a fusion-inhibiting monoclonal antibody(5) and gene cloning, we identify a mouse sperm fusion-related antigen and show that the antigen is a novel immunoglobulin superfamily protein. We have termed the gene Izumo and produced a gene-disrupted mouse line. Izumo(-/-) mice were healthy but males were sterile. They produced normal-looking sperm that bound to and penetrated the zona pellucida but were incapable of fusing with eggs. Human sperm also contain Izumo and addition of the antibody against human Izumo left the sperm unable to fuse with zona-free hamster eggs.","Osaka Univ, Genome Informat Res Ctr, Suita, Osaka 5650871, Japan; Osaka Univ, Res Inst Microbial Dis, Suita, Osaka 5650871, Japan; Osaka Univ, Fac Pharmaceut Sci, Suita, Osaka 5650871, Japan","Okabe, M (reprint author), Osaka Univ, Genome Informat Res Ctr, Yamadaoka 3-1, Suita, Osaka 5650871, Japan.",okabe@gen-info.osaka-u.ac.jp,"ikawa, masahito/A-5315-2009; Inoue, Naokazu/A-9911-2009; Isotani, Ayako/A-9929-2009; Okabe, Masaru/B-6917-2015; Isotani, Ayako/D-4564-2017","ikawa, masahito/0000-0001-9859-6217; Isotani, Ayako/0000-0002-4720-2318; Okabe, Masaru/0000-0002-0803-9044; Isotani, Ayako/0000-0002-4720-2318",,,,31,346,380,3,44,NATURE PUBLISHING GROUP,LONDON,"MACMILLAN BUILDING, 4 CRINAN ST, LONDON N1 9XW, ENGLAND",0028-0836,,,NATURE,Nature,10-Mar,2005,434,7030,,,,,234,238,,10.1038/nature03362,,5,Multidisciplinary Sciences,Science & Technology - Other Topics,904JU,WOS:000227494500050,15759005,No,,,11/20/17
J,"Krogsgaard, M; Li, QJ; Sumen, C; Huppa, JB; Huse, M; Davis, MM",,,,"Krogsgaard, M; Li, QJ; Sumen, C; Huppa, JB; Huse, M; Davis, MM",,,Agonist/endogenous peptide-MHC heterodimers drive T cell activation and sensitivity,NATURE,,,English,Article,,,,,,,IMMUNOLOGICAL SYNAPSE FORMATION; HLA-DR MOLECULES; CLASS-II; LIGAND RECOGNITION; FOREIGN ANTIGEN; BINDING-SITE; CD8; PROLIFERATION; EXPRESSION; CONTRIBUTE,"alphabeta T lymphocytes are able to detect even a single peptide - major histocompatibility complex (MHC) on the surface of an antigen-presenting cell(1,2). This is despite clear evidence, at least with CD4(+) T cells, that monomeric ligands are not stimulatory(3,4). In an effort to understand how this remarkable sensitivity is achieved, we constructed soluble peptide - MHC heterodimers in which one peptide is an agonist and the other is one of the large number of endogenous peptide - MHCs displayed by presenting cells. We found that some specific combinations of these heterodimers can stimulate specific T cells in a CD4-dependent manner. This activation is severely impaired if the CD4-binding site on the agonist ligand is ablated, but the same mutation on an endogenous ligand has no effect. These data correlate well with analyses of lipid bilayers and cells presenting these ligands, and indicate that the basic unit of helper T cell activation is a heterodimer of agonist peptide - and endogenous peptide MHC complexes, stabilized by CD4.","Stanford Univ, Sch Med, Dept Microbiol & Immunol, Stanford, CA 94305 USA; Stanford Univ, Sch Med, Howard Hughes Med Inst, Stanford, CA 94305 USA","Davis, MM (reprint author), Stanford Univ, Sch Med, Dept Microbiol & Immunol, Stanford, CA 94305 USA.",mdavis@cmgm.stanford.edu,,,,,,30,222,226,0,7,NATURE PUBLISHING GROUP,LONDON,"MACMILLAN BUILDING, 4 CRINAN ST, LONDON N1 9XW, ENGLAND",0028-0836,,,NATURE,Nature,10-Mar,2005,434,7030,,,,,238,243,,10.1038/nature03391,,6,Multidisciplinary Sciences,Science & Technology - Other Topics,904JU,WOS:000227494500051,15724150,No,,,11/20/17
J,"Takaoka, A; Yanai, H; Kondo, S; Duncan, G; Negishi, H; Mizutani, T; Kano, S; Honda, K; Ohba, Y; Mak, TW; Taniguchi, T",,,,"Takaoka, A; Yanai, H; Kondo, S; Duncan, G; Negishi, H; Mizutani, T; Kano, S; Honda, K; Ohba, Y; Mak, TW; Taniguchi, T",,,Integral role of IRF-5 in the gene induction programme activated by Toll-like receptors,NATURE,,,English,Article,,,,,,,PLASMACYTOID DENDRITIC CELLS; DIFFERENTIAL REGULATION; HOST-DEFENSE; STRANDED-RNA; CPG MOTIFS; KAPPA-B; MYD88; DNA; IMMUNITY; INNATE,"The activation of Toll-like receptors (TLRs) is central to innate and adaptive immunity(1-3). All TLRs use the adaptor MyD88 for signalling(4), but the mechanisms underlying the MyD88-mediated gene induction programme are as yet not fully understood. Here, we demonstrate that the transcription factor IRF-5 is generally involved downstream of the TLR-MyD88 signalling pathway for gene induction of proinflammatory cytokines, such as interleukin-6 (IL-6), IL-12 and tumour-necrosis factor-alpha. In haematopoietic cells from mice deficient in the Irf5 gene (Irf5(-/-) mice), the induction of these cytokines by various TLR ligands is severely impaired, whereas interferon-alpha induction is normal. We also provide evidence that IRF-5 interacts with and is activated by MyD88 and TRAF6, and that TLR activation results in the nuclear translocation of IRF-5 to activate cytokine gene transcription. Consistently, Irf5(-/-) mice show resistance to lethal shock induced by either unmethylated DNA or lipopolysaccharide, which correlates with a marked decrease in the serum levels of proinflammatory cytokines. Thus, our study identifies IRF-5 as a new, principal downstream regulator of the TLR-MyD88 signalling pathway and a potential target of therapeutic intervention to control harmful immune responses.","Univ Toronto, Campbell Family Inst Breast Canc Res, Toronto, ON M5G 2M9, Canada; Univ Tokyo, Grad Sch Med, Dept Immunol, Bunkyo Ku, Tokyo 1130033, Japan; Univ Tokyo, Fac Med, Bunkyo Ku, Tokyo 1130033, Japan; JST, PRESTO, Informat & Cell Funct, Kawaguchi, Saitama 3320012, Japan","Mak, TW (reprint author), Univ Toronto, Campbell Family Inst Breast Canc Res, 610 Univ Ave,Room 7-411, Toronto, ON M5G 2M9, Canada.",tmak@uhnres.utroronto.ca; tada@m.u-tokyo.ac.jp,"Ohba, Yusuke/E-7944-2011; Honda, Kenya/N-5297-2015; Tang, Amy/L-3226-2016; Kano, Shin-ichi/F-4144-2015","Tang, Amy/0000-0002-5772-2878; Kano, Shin-ichi/0000-0002-5171-3436",,,,30,544,577,2,28,NATURE PUBLISHING GROUP,LONDON,"MACMILLAN BUILDING, 4 CRINAN ST, LONDON N1 9XW, ENGLAND",0028-0836,,,NATURE,Nature,10-Mar,2005,434,7030,,,,,243,249,,10.1038/nature03308,,7,Multidisciplinary Sciences,Science & Technology - Other Topics,904JU,WOS:000227494500052,15665823,No,,,11/20/17
J,"Beeli, G; Esslen, M; Jancke, L",,,,"Beeli, G; Esslen, M; Jancke, L",,,Synaesthesia - When coloured sounds taste sweet,NATURE,,,English,Article,,,,,,,,,"Univ Zurich, Inst Neuropsychol, CH-8032 Zurich, Switzerland","Beeli, G (reprint author), Univ Zurich, Inst Neuropsychol, CH-8032 Zurich, Switzerland.",l.jaencke@psychologie.unizh.ch,"Jancke, Lutz/C-3792-2009; Jancke, Lutz/D-2910-2013","Jancke, Lutz/0000-0002-8115-4890; Jancke, Lutz/0000-0003-2110-9067",,,,5,68,68,5,40,NATURE PUBLISHING GROUP,LONDON,"MACMILLAN BUILDING, 4 CRINAN ST, LONDON N1 9XW, ENGLAND",0028-0836,,,NATURE,Nature,3-Mar,2005,434,7029,,,,,38,38,,10.1038/434038a,,1,Multidisciplinary Sciences,Science & Technology - Other Topics,902ED,WOS:000227334600035,15744291,No,,,11/20/17
J,"Knill, E",,,,"Knill, E",,,Quantum computing with realistically noisy devices,NATURE,,,English,Article,,,,,,,COMPUTATION; CHANNELS; TELEPORTATION; ALGORITHMS; TIME; GATE,"In theory, quantum computers offer a means of solving problems that would be intractable on conventional computers. Assuming that a quantum computer could be constructed, it would in practice be required to function with noisy devices called 'gates'. These gates cause decoherence of the fragile quantum states that are central to the computer's operation. The goal of so-called 'fault-tolerant quantum computing' is therefore to compute accurately even when the error probability per gate (EPG) is high. Here we report a simple architecture for fault-tolerant quantum computing, providing evidence that accurate quantum computing is possible for EPGs as high as three per cent. Such EPGs have been experimentally demonstrated, but to avoid excessive resource overheads required by the necessary architecture, lower EPGs are needed. Assuming the availability of quantum resources comparable to the digital resources available in today's computers, we show that non-trivial quantum computations at EPGs of as high as one per cent could be implemented.","Natl Inst Stand & Technol, Math & Computat Sci Div, Boulder, CO 80305 USA","Knill, E (reprint author), Natl Inst Stand & Technol, Math & Computat Sci Div, Boulder, CO 80305 USA.",knill@boulder.nist.gov,,,,,,34,424,427,1,26,NATURE PUBLISHING GROUP,LONDON,"MACMILLAN BUILDING, 4 CRINAN ST, LONDON N1 9XW, ENGLAND",0028-0836,1476-4687,,NATURE,Nature,3-Mar,2005,434,7029,,,,,39,44,,10.1038/nature03350,,6,Multidisciplinary Sciences,Science & Technology - Other Topics,902ED,WOS:000227334600036,15744292,No,,,11/20/17
J,"Scholes, RJ; Biggs, R",,,,"Scholes, RJ; Biggs, R",,,A biodiversity intactness index,NATURE,,,English,Article,,,,,,,SOUTH-AFRICA; PINUS-RADIATA; LAND-USE; ASSEMBLAGES; AFFORESTATION; STELLENBOSCH; REPTILES; SAVANNA; LOWVELD,"The nations of the world have set themselves a target of reducing the rate of biodiversity loss by 2010. Here, we propose a biodiversity intactness index (BII) for assessing progress towards this target that is simple and practical - but sensitive to important factors that influence biodiversity status - and which satisfies the criteria for policy relevance set by the Convention on Biological Diversity. Application of the BII is demonstrated on a large region ( 4 3 10 6 km 2) of southern Africa. The BII score in the year 2000 is about 84%: in other words, averaged across all plant and vertebrate species in the region, populations have declined to 84% of their presumed pre-modern levels. The taxonomic group with the greatest loss is mammals, at 71% of pre-modern levels, and the ecosystem type with the greatest loss is grassland, with 74% of its former populations remaining. During the 1990s, a population decline of 0.8% is estimated to have occurred.","CSIR Environmentek, ZA-0001 Pretoria, South Africa","Scholes, RJ (reprint author), CSIR Environmentek, POB 395, ZA-0001 Pretoria, South Africa.",bscholes@csir.co.za,"Biggs, Reinette/A-5155-2010","Scholes, Robert/0000-0001-5537-6935",,,,38,183,197,7,94,NATURE PUBLISHING GROUP,LONDON,"MACMILLAN BUILDING, 4 CRINAN ST, LONDON N1 9XW, ENGLAND",0028-0836,,,NATURE,Nature,3-Mar,2005,434,7029,,,,,45,49,,10.1038/nature03289,,5,Multidisciplinary Sciences,Science & Technology - Other Topics,902ED,WOS:000227334600037,15744293,No,,,11/20/17
J,"Hyman, SD; Lazio, JW; Kassim, NE; Ray, PS; Markwardt, CB; Yusef-Zadeh, F",,,,"Hyman, SD; Lazio, JW; Kassim, NE; Ray, PS; Markwardt, CB; Yusef-Zadeh, F",,,A powerful bursting radio source towards the Galactic Centre,NATURE,,,English,Article,,,,,,,EXTRASOLAR PLANETS; EMISSION; TRANSIENTS; SPECTRA; DWARFS; PULSAR; GALAXY,"Transient astronomical sources are typically powered by compact objects and usually signify highly explosive or dynamic events(1). Although high-time-resolution observations are often possible in radio astronomy(2), they are usually limited to quite narrow fields of view. The dynamic radio sky is therefore poorly sampled, in contrast to the situation in the X-ray and gamma-ray bands in which wide-field instruments routinely detect transient sources(3). Here we report a transient radio source, GCRT J1745 - 3009, which was detected during a moderately wide-field monitoring programme of the Galactic Centre region(4,5) at 0.33 GHz. The characteristics of its bursts are unlike those known for any other class of radio transient. If located in or near the Galactic Centre, its brightness temperature (, 10 16 K) and the implied energy density within GCRT J1745 - 3009 vastly exceed those observed in most other classes of radio astronomical sources(6), and are consistent with coherent emission processes(7) that are rarely observed. We conclude that it represents a hitherto unknown class of transient radio sources, the first of possibly many new classes that may be discovered by emerging wide-field radio telescopes(8).","Sweet Briar Coll, Dept Phys & Engn, Sweet Briar, VA 24595 USA; USN, EO Hulburt Ctr Space Res, Res Lab, Washington, DC 20375 USA; NASA, High Energy Astrophys Lab, Goddard Space Flight Ctr, Greenbelt, MD 20771 USA; Northwestern Univ, Dept Phys & Astron, Evanston, IL 60208 USA","Hyman, SD (reprint author), Sweet Briar Coll, Dept Phys & Engn, Sweet Briar, VA 24595 USA.",shyman@sbc.edu,,"Ray, Paul/0000-0002-5297-5278",,,,30,75,76,0,1,NATURE PUBLISHING GROUP,LONDON,"MACMILLAN BUILDING, 4 CRINAN ST, LONDON N1 9XW, ENGLAND",0028-0836,,,NATURE,Nature,3-Mar,2005,434,7029,,,,,50,52,,10.1038/nature03400,,3,Multidisciplinary Sciences,Science & Technology - Other Topics,902ED,WOS:000227334600038,15744294,No,,,11/20/17
J,"Flannigan, DJ; Suslick, KS",,,,"Flannigan, DJ; Suslick, KS",,,Plasma formation and temperature measurement during single-bubble cavitation,NATURE,,,English,Article,,,,,,,SONOLUMINESCING BUBBLE; EMISSION; ARGON,"Single-bubble sonoluminescence (SBSL1-5) results from the extreme temperatures and pressures achieved during bubble compression; calculations have predicted(6,7) the existence of a hot, optically opaque plasma core(8) with consequent bremsstrahlung radiation(9,10). Recent controversial reports(11,12) claim the observation of neutrons from deuterium - deuterium fusion during acoustic cavitation(11,12.) However, there has been previously no strong experimental evidence for the existence of a plasma during single- or multi-bubble sonoluminescence. SBSL typically produces featureless emission spectra(13) that reveal little about the intra-cavity physical conditions or chemical processes. Here we report observations of atomic (Ar) emission and extensive molecular (SO) and ionic (O-2(+)) progressions in SBSL spectra from concentrated aqueous H2SO4 solutions. Both the Ar and SO emission permit spectroscopic temperature determinations, as accomplished for multi-bubble sonoluminescence with other emitters(14-16). The emissive excited states observed from both Ar and O-2(+) are inconsistent with any thermal process. The Ar excited states involved are extremely high in energy (> 13 eV) and cannot be thermally populated at the measured Ar emission temperatures (4,000 - 15,000 K); the ionization energy of O-2 is more than twice its bond dissociation energy, so O-2(+) likewise cannot be thermally produced. We therefore conclude that these emitting species must originate from collisions with high-energy electrons, ions or particles from a hot plasma core.","Univ Illinois, Dept Chem, Urbana, IL 61801 USA","Suslick, KS (reprint author), Univ Illinois, Dept Chem, 1209 W Calif St, Urbana, IL 61801 USA.",ksuslick@uiuc.edu,"Flannigan, David/E-4449-2014; Suslick, Kenneth/C-3281-2011","Flannigan, David/0000-0002-1829-1868; Suslick, Kenneth/0000-0001-5422-0701",,,,30,322,334,6,111,NATURE PUBLISHING GROUP,LONDON,"MACMILLAN BUILDING, 4 CRINAN ST, LONDON N1 9XW, ENGLAND",0028-0836,1476-4687,,NATURE,Nature,3-Mar,2005,434,7029,,,,,52,55,,10.1038/nature03361,,4,Multidisciplinary Sciences,Science & Technology - Other Topics,902ED,WOS:000227334600039,15744295,No,,,11/20/17
J,"Lin, Y; Boker, A; He, JB; Sill, K; Xiang, HQ; Abetz, C; Li, XF; Wang, J; Emrick, T; Long, S; Wang, Q; Balazs, A; Russell, TP",,,,"Lin, Y; Boker, A; He, JB; Sill, K; Xiang, HQ; Abetz, C; Li, XF; Wang, J; Emrick, T; Long, S; Wang, Q; Balazs, A; Russell, TP",,,Self-directed self-assembly of nanoparticle/copolymer mixtures,NATURE,,,English,Article,,,,,,,BLOCK-COPOLYMERS; TEMPLATES; FILMS; NANOSTRUCTURES; NANOCOMPOSITES; SUPERLATTICES; NANOCRYSTALS; ORGANIZATION; SOLVENT; ARRAYS,"The organization of inorganic nanostructures within self-assembled organic or biological templates(1-11) is receiving the attention of scientists interested in developing functional hybrid materials. Previous efforts have concentrated on using such scaffolds(7,9,12) to spatially arrange nanoscopic elements as a strategy for tailoring the electrical, magnetic or photonic properties(8) (- 11,13 - 16) of the material. Recent theoretical arguments(16 - 18) have suggested that synergistic interactions between self-organizing particles and a self-assembling matrix material can lead to hierarchically ordered structures. Here we show that mixtures of diblock copolymers and either cadmium selenide- or ferritin-based nanoparticles exhibit cooperative, coupled self-assembly on the nanoscale. In thin films, the copolymers assemble into cylindrical domains, which dictate the spatial distribution of the nanoparticles; segregation of the particles to the interfaces mediates interfacial interactions and orients the copolymer domains normal to the surface, even when one of the blocks is strongly attracted to the substrate. Organization of both the polymeric and particulate entities is thus achieved without the use of external fields(10,19), opening a simple and general route for fabrication of nanostructured materials with hierarchical order.","Univ Massachusetts, Dept Polymer Sci & Engn, Amherst, MA 01003 USA; Univ Bayreuth, Bayreuther Inst Makromol Forsch, D-95440 Bayreuth, Germany; Argonne Natl Lab, Adv Photon Source, Argonne, IL 60439 USA; Univ S Carolina, Dept Chem, Columbia, SC 29208 USA; Univ Pittsburgh, Dept Chem & Petr Engn, Pittsburgh, PA 15261 USA","Russell, TP (reprint author), Univ Massachusetts, Dept Polymer Sci & Engn, Amherst, MA 01003 USA.",russell@mail.pse.umass.edu,"Boker, Alexander/C-2055-2009; He, Jinbo/B-1445-2010; Lin, Yao/E-5527-2011","Boker, Alexander/0000-0002-5760-6631; Lin, Yao/0000-0001-5227-2663; Sill, Kevin/0000-0001-9797-7392",,,,30,716,726,38,668,NATURE PUBLISHING GROUP,LONDON,"MACMILLAN BUILDING, 4 CRINAN ST, LONDON N1 9XW, ENGLAND",0028-0836,1476-4687,,NATURE,Nature,3-Mar,2005,434,7029,,,,,55,59,,10.1038/nature03310,,5,Multidisciplinary Sciences,Science & Technology - Other Topics,902ED,WOS:000227334600040,15744296,No,,,11/20/17
