PT,AU,BA,BE,GP,AF,BF,CA,TI,SO,SE,BS,LA,DT,CT,CY,CL,SP,HO,DE,ID,AB,C1,RP,EM,RI,OI,FU,FX,CR,NR,TC,Z9,U1,U2,PU,PI,PA,SN,EI,BN,J9,JI,PD,PY,VL,IS,PN,SU,SI,MA,BP,EP,AR,DI,D2,PG,WC,SC,GA,UT,PM,OA,HC,HP,DA
J,"Klironomos, JN; Allen, MF; Rillig, MC; Piotrowski, J; Makvandi-Nejad, S; Wolfe, BE; Powell, JR",,,,"Klironomos, JN; Allen, MF; Rillig, MC; Piotrowski, J; Makvandi-Nejad, S; Wolfe, BE; Powell, JR",,,Abrupt rise in atmospheric CO2 overestimates community response in a model plant-soil system,NATURE,,,English,Article,,,,,,,ARBUSCULAR MYCORRHIZAL FUNGI; CARBON-DIOXIDE; NATURAL ECOSYSTEMS; ELEVATED CO2; COLONIZATION; FIELD,"Attempts to understand the ecological effect of increasing atmospheric CO2 concentration, [CO2], usually involve exposing today's ecosystems to expected future [CO2] levels(1,2). However, a major assumption of these approaches has not been tested that exposing ecosystems to a single- step increase in [ CO2] will yield similar responses to those of a gradual increase over several decades(3). We tested this assumption on a mycorrhizal fungal community over a period of six years. [ CO2] was either increased abruptly, as is typical of most [ CO2] experiments, or more gradually over 21 generations. The two approaches resulted in different structural and functional community responses to increased [ CO2]. Some fungi were sensitive to the carbon pulse of the abrupt [ CO2] treatment. This resulted in an immediate decline in fungal species richness and a significant change in mycorrhizal functioning. The magnitude of changes in fungal diversity and functioning in response to gradually increasing [ CO2] was smaller, and not significantly different to those with ambient [ CO2]. Our results suggest that studies may overestimate some community responses to increasing [ CO2] because biota may be sensitive to ecosystem changes that occur as a result of abrupt increases.","Univ Guelph, Dept Integrat Biol, Guelph, ON N1G 2W1, Canada; Univ Calif Riverside, Ctr Conservat Biol, Riverside, CA 92521 USA; Univ Montana, Div Biol Sci, Missoula, MT 59812 USA","Klironomos, JN (reprint author), Univ Guelph, Dept Integrat Biol, Guelph, ON N1G 2W1, Canada.",jklirono@uoguelph.ca,"Powell, Jeff/A-5076-2010; Rillig, Matthias/B-3675-2009","Powell, Jeff/0000-0003-1091-2452; Rillig, Matthias/0000-0003-3541-7853",,,,28,99,113,7,66,NATURE PUBLISHING GROUP,LONDON,"MACMILLAN BUILDING, 4 CRINAN ST, LONDON N1 9XW, ENGLAND",0028-0836,,,NATURE,Nature,10-Feb,2005,433,7026,,,,,621,624,,10.1038/nature03268,,4,Multidisciplinary Sciences,Science & Technology - Other Topics,895KX,WOS:000226862000041,15703744,No,,,11/20/17
J,"Yanoviak, SP; Dudley, R; Kaspari, M",,,,"Yanoviak, SP; Dudley, R; Kaspari, M",,,Directed aerial descent in canopy ants,NATURE,,,English,Article,,,,,,,BEHAVIOR; FOREST; FLIGHT; RAIN,"Numerous non- flying arboreal vertebrates use controlled descent ( either parachuting or gliding sensu stricto(1,2)) to avoid predation or to locate resources(3 - 7), and directional control during a jump or fall is thought to be an important stage in the evolution of flight(3,8,9). Here we show that workers of the neotropical ant Cephalotes atratus L. ( Hymenoptera: Formicidae) use directed aerial descent to return to their home tree trunk with > 80% success during a fall. Videotaped falls reveal that C. atratus workers descend abdomen- first through steep glide trajectories at relatively high velocities; a field experiment shows that falling ants use visual cues to locate tree trunks before they hit the forest floor. Smaller workers of C. atratus, and smaller species of Cephalotes more generally, regain contact with their associated tree trunk over shorter vertical distances than do larger workers. Surveys of common arboreal ants suggest that directed descent occurs in most species of the tribe Cephalotini and arboreal Pseudomyrmecinae, but not in arboreal ponerimorphs or Dolichoderinae. This is the first study to document the mechanics and ecological relevance of this form of locomotion in the Earth's most diverse lineage, the insects.","Smithsonian Trop Res Inst, Balboa, Panama; Univ Texas, Med Branch, Galveston, TX 77555 USA; Univ Florida, Florida Med Entomol Lab, Vero Beach, FL 32962 USA; Univ Calif Berkeley, Dept Integrat Biol, Berkeley, CA 94720 USA; Univ Oklahoma, Dept Zool, Norman, OK 73019 USA","Kaspari, M (reprint author), Smithsonian Trop Res Inst, POB 2072, Balboa, Panama.",mkaspari@ou.edu,,"Kaspari, Michael/0000-0002-9717-5768",,,,25,71,71,2,25,NATURE PUBLISHING GROUP,LONDON,"MACMILLAN BUILDING, 4 CRINAN ST, LONDON N1 9XW, ENGLAND",0028-0836,,,NATURE,Nature,10-Feb,2005,433,7026,,,,,624,626,,10.1038/nature03254,,3,Multidisciplinary Sciences,Science & Technology - Other Topics,895KX,WOS:000226862000042,15703745,No,,,11/20/17
J,"Borchert, R; Renner, SS; Calle, Z; Navarrete, D; Tye, A; Gautier, L; Spichiger, R; von Hildebrand, P",,,,"Borchert, R; Renner, SS; Calle, Z; Navarrete, D; Tye, A; Gautier, L; Spichiger, R; von Hildebrand, P",,,Photoperiodic induction of synchronous flowering near the Equator,NATURE,,,English,Article,,,,,,,DRY FORESTS; TREES; LENGTH,"In tropical rainforests, 30 - 65% of tree species grow at densities of less than one individual per hectare(1). At these low population densities, successful cross- pollination relies on synchronous flowering. In rainforests with low climatic seasonality, photoperiodic control is the only reliable mechanism for inducing synchronous flowering(2,3). This poses a problem because there is no variation in day length at the Equator. Here we propose a new mechanism of photoperiodic timekeeping based on the perception of variation in sunrise or sunset time, which explains and predicts the annually repeated, staggered, synchronous and bimodal flowering of many tree species in Amazonian rainforests near the Equator.","Univ Kansas, Div Biol, Lawrence, KS 66045 USA; Univ Munich, Dept Biol, D-80638 Munich, Germany; CIPAV, Ctr Res Sustainable Agr, Cali AA 20591, Colombia; Fdn Puerto Rastrojo, Bogota AA 241438, Colombia; Charles Darwin Res Stn, Dept Bot, Quito, Ecuador; Conservatoire & Jardin Bot Ville Geneve, CH-1292 Chambesy, GE, Switzerland","Borchert, R (reprint author), Univ Kansas, Div Biol, Lawrence, KS 66045 USA.",borchert@ku.edu,,,,,,17,101,112,3,24,NATURE PUBLISHING GROUP,LONDON,"MACMILLAN BUILDING, 4 CRINAN ST, LONDON N1 9XW, ENGLAND",0028-0836,,,NATURE,Nature,10-Feb,2005,433,7026,,,,,627,629,,10.1038/nature03259,,3,Multidisciplinary Sciences,Science & Technology - Other Topics,895KX,WOS:000226862000043,15703746,No,,,11/20/17
J,"Broothaerts, W; Mitchell, HJ; Weir, B; Kaines, S; Smith, LMA; Yang, W; Mayer, JE; Roa-Rodriguez, C; Jefferson, RA",,,,"Broothaerts, W; Mitchell, HJ; Weir, B; Kaines, S; Smith, LMA; Yang, W; Mayer, JE; Roa-Rodriguez, C; Jefferson, RA",,,Gene transfer to plants by diverse species of bacteria,NATURE,,,English,Article,,,,,,,AGROBACTERIUM-TUMEFACIENS C58/; TI-PLASMID; RHIZOBIUM; GENOME; TRANSFORMATION; IDENTIFICATION; ARABIDOPSIS; VIRULENCE; MELILOTI; SEQUENCE,,"Charles Sturt Univ, Affiliated Res Ctr, CAMBIA, Canberra, ACT 2601, Australia","Jefferson, RA (reprint author), Charles Sturt Univ, Affiliated Res Ctr, CAMBIA, GPO Box 3200, Canberra, ACT 2601, Australia.",r.jefferson@cambia.org,,"Jefferson, Richard/0000-0001-5352-4498",,,,29,137,162,1,36,NATURE PUBLISHING GROUP,LONDON,"MACMILLAN BUILDING, 4 CRINAN ST, LONDON N1 9XW, ENGLAND",0028-0836,,,NATURE,Nature,10-Feb,2005,433,7026,,,,,629,633,,10.1038/nature03309,,5,Multidisciplinary Sciences,Science & Technology - Other Topics,895KX,WOS:000226862000044,15703747,No,,,11/20/17
J,"Jordan, IK; Kondrashov, FA; Adzhubei, IA; Wolf, YI; Koonin, EV; Kondrashov, AS; Sunyaev, S",,,,"Jordan, IK; Kondrashov, FA; Adzhubei, IA; Wolf, YI; Koonin, EV; Kondrashov, AS; Sunyaev, S",,,A universal trend of amino acid gain and loss in protein evolution,NATURE,,,English,Article,,,,,,,SEQUENCE EVOLUTION; BASE COMPOSITION; FREQUENCIES; DROSOPHILA; ALIGNMENT; BACTERIA; GENOME; GENE; CODE,"Amino acid composition of proteins varies substantially between taxa and, thus, can evolve. For example, proteins from organisms with ( G+C)- rich ( or ( A+T)- rich) genomes contain more ( or fewer) amino acids encoded by ( G+C)- rich codons(1 - 4). However, no universal trends in ongoing changes of amino acid frequencies have been reported. We compared sets of orthologous proteins encoded by triplets of closely related genomes from 15 taxa representing all three domains of life ( Bacteria, Archaea and Eukaryota), and used phylogenies to polarize amino acid substitutions. Cys, Met, His, Ser and Phe accrue in at least 14 taxa, whereas Pro, Ala, Glu and Gly are consistently lost. The same nine amino acids are currently accrued or lost in human proteins, as shown by analysis of non- synonymous single-nucleotide polymorphisms. All amino acids with declining frequencies are thought to be among the first incorporated into the genetic code; conversely, all amino acids with increasing frequencies, except Ser, were probably recruited late(5 - 7). Thus, expansion of initially under- represented amino acids, which began over 3,400 million years ago(8,9), apparently continues to this day.","Natl Lib Med, Natl Ctr Biotechnol Informat, NIH, Bethesda, MD 20894 USA; Univ Calif Davis, Sect Evolut & Ecol, Davis, CA 95616 USA; Harvard Univ, Brigham & Womens Hosp, Sch Med, Dept Med,Div Genet, Boston, MA 02115 USA","Kondrashov, AS (reprint author), Natl Lib Med, Natl Ctr Biotechnol Informat, NIH, Bethesda, MD 20894 USA.",kondrashov@ncbi.nlm.nih.gov; ssunyaev@rics.bwh.harvard.edu,"Kondrashov, Fyodor Alexeevich/H-6331-2015","Kondrashov, Fyodor Alexeevich/0000-0001-8243-4694",,,,30,152,157,3,20,NATURE PUBLISHING GROUP,LONDON,"MACMILLAN BUILDING, 4 CRINAN ST, LONDON N1 9XW, ENGLAND",0028-0836,,,NATURE,Nature,10-Feb,2005,433,7026,,,,,633,638,,10.1038/nature03306,,6,Multidisciplinary Sciences,Science & Technology - Other Topics,895KX,WOS:000226862000045,15660107,No,,,11/20/17
J,"Kao, MH; Doupe, AJ; Brainard, MS",,,,"Kao, MH; Doupe, AJ; Brainard, MS",,,Contributions of an avian basal ganglia-forebrain circuit to real-time modulation of song,NATURE,,,English,Article,,,,,,,PURSUIT EYE-MOVEMENTS; ZEBRA FINCH; NEURAL ACTIVITY; NUCLEUS; MECHANISMS; LESIONS; STIMULATION; BIRDSONG; NEURONS; PATHWAY,"Cortical - basal ganglia circuits have a critical role in motor control and motor learning(1). In songbirds, the anterior forebrain pathway ( AFP) is a basal ganglia - forebrain circuit required for song learning and adult vocal plasticity but not for production of learned song(2 - 5). Here, we investigate functional contributions of this circuit to the control of song, a complex, learned motor skill. We test the hypothesis that neural activity in the AFP of adult birds can direct moment- by- moment changes in the primary motor areas responsible for generating song. We show that song- triggered microstimulation in the output nucleus of the AFP induces acute and specific changes in learned parameters of song(6,7). Moreover, under both natural and experimental conditions, variability in the pattern of AFP activity is associated with variability in song structure. Finally, lesions of the output nucleus of the AFP prevent naturally occurring modulation of song variability. These findings demonstrate a previously unappreciated capacity of the AFP to direct real- time changes in song. More generally, they suggest that frontal cortical and basal ganglia areas may contribute to motor learning by biasing motor output towards desired targets or by introducing stochastic variability required for reinforcement learning.","Univ Calif San Francisco, Keck Ctr Integrat Neurosci, Dept Physiol, San Francisco, CA 94143 USA; Univ Calif San Francisco, Keck Ctr Integrat Neurosci, Dept Psychiat, San Francisco, CA 94143 USA","Kao, MH (reprint author), Univ Calif San Francisco, Keck Ctr Integrat Neurosci, Dept Physiol, San Francisco, CA 94143 USA.",mimi@phy.ucsf.edu,,,,,,30,276,279,0,26,NATURE PUBLISHING GROUP,LONDON,"MACMILLAN BUILDING, 4 CRINAN ST, LONDON N1 9XW, ENGLAND",0028-0836,,,NATURE,Nature,10-Feb,2005,433,7026,,,,,638,643,,10.1038/nature03127,,6,Multidisciplinary Sciences,Science & Technology - Other Topics,895KX,WOS:000226862000046,15703748,No,,,11/20/17
J,"Tomoyasu, Y; Wheeler, SR; Denell, RE",,,,"Tomoyasu, Y; Wheeler, SR; Denell, RE",,,Ultrabithorax is required for membranous wing identity in the beetle Tribolium castaneum,NATURE,,,English,Article,,,,,,,GENE-COMPLEX; DROSOPHILA-MELANOGASTER; HOMEOTIC COMPLEX; EVOLUTION; EXPRESSION; SPECIFICATION; MORPHOGENESIS; ORTHOLOG; SEQUENCE; DPP,"The two pairs of wings that are characteristic of ancestral pterygotes ( winged insects) have often undergone evolutionary modification. In the fruitfly, Drosophila melanogaster, differences between the membranous forewings and the modified hindwings ( halteres) depend on the Hox gene Ultrabithorax ( Ubx). The Drosophila forewings develop without Hox input, while Ubx represses genes that are important for wing development, promoting haltere identity(1,2). However, the idea that Hox input is important to the morphologically specialized wing derivatives such as halteres, and not the more ancestral wings, requires examination in other insect orders. In beetles, such as Tribolium castaneum, it is the forewings that are modified ( to form elytra), while the hindwings retain a morphologically more ancestral identity. Here we show that in this beetle Ubx ' despecializes' the hindwings, which are transformed to elytra when the gene is knocked down. We also show evidence that elytra result from a Hox- free state, despite their diverged morphology. Ubx function in the hindwing seems necessary for a change in the expression of spalt, iroquois and achaete- scute homologues from elytron- like to more typical wing- like patterns. This counteracting effect of Ubx in beetle hindwings represents a previously unknown mode of wing diversification in insects.","Kansas State Univ, Div Biol, Manhattan, KS 66506 USA; Washington Univ, Sch Med, Dept Genet, St Louis, MO 63110 USA","Tomoyasu, Y (reprint author), Kansas State Univ, Div Biol, Chalmers Hall, Manhattan, KS 66506 USA.",tomoyasu@ksu.edu,"Tomoyasu, Yoshinori/D-3061-2017","Tomoyasu, Yoshinori/0000-0001-9824-3454",,,,28,98,102,0,25,NATURE PUBLISHING GROUP,LONDON,"MACMILLAN BUILDING, 4 CRINAN ST, LONDON N1 9XW, ENGLAND",0028-0836,,,NATURE,Nature,10-Feb,2005,433,7026,,,,,643,647,,10.1038/nature03272,,5,Multidisciplinary Sciences,Science & Technology - Other Topics,895KX,WOS:000226862000047,15703749,No,,,11/20/17
J,"Laugwitz, KL; Moretti, A; Lam, J; Gruber, P; Chen, YH; Woodard, S; Lin, LZ; Cai, CL; Lu, MM; Reth, M; Platoshyn, O; Yuan, JXJ; Evans, S; Chien, KR",,,,"Laugwitz, KL; Moretti, A; Lam, J; Gruber, P; Chen, YH; Woodard, S; Lin, LZ; Cai, CL; Lu, MM; Reth, M; Platoshyn, O; Yuan, JXJ; Evans, S; Chien, KR",,,Postnatal isl1+cardioblasts enter fully differentiated cardiomyocyte lineages,NATURE,,,English,Article,,,,,,,TAMOXIFEN-INDUCIBLE FORM; HEMATOPOIETIC STEM-CELLS; CARDIAC MYOCYTES; HEART; CRE; MYOCARDIUM; EXPRESSION; PATHWAYS; DISEASE; FUSION,"The purification, renewal and differentiation of native cardiac progenitors would form a mechanistic underpinning for unravelling steps for cardiac cell lineage formation, and their links to forms of congenital and adult cardiac diseases(1 - 3). Until now there has been little evidence for native cardiac precursor cells in the postnatal heart(4). Herein, we report the identification of isl1(+) cardiac progenitors in postnatal rat, mouse and human myocardium. A cardiac mesenchymal feeder layer allows renewal of the isolated progenitor cells with maintenance of their capability to adopt a fully differentiated cardiomyocyte phenotype. Tamoxifen- inducible Cre/ lox technology enables selective marking of this progenitor cell population including its progeny, at a defined time, and purification to relative homogeneity. Coculture studies with neonatal myocytes indicate that isl1(+) cells represent authentic, endogenous cardiac progenitors ( cardioblasts) that display highly efficient conversion to a mature cardiac phenotype with stable expression of myocytic markers ( 25%) in the absence of cell fusion, intact Ca2+- cycling, and the generation of action potentials. The discovery of native cardioblasts represents a genetically based system to identify steps in cardiac cell lineage formation and maturation in development and disease.","Univ Calif San Diego, Sch Med, Inst Mol Med, La Jolla, CA 92093 USA; Univ Calif San Diego, Sch Med, Dept Med, La Jolla, CA 92093 USA; Childrens Hosp Philadelphia, Cardiac Ctr, Philadelphia, PA 19104 USA; Univ Penn, Dept Med, Div Cardiovasc, Philadelphia, PA 19104 USA; Univ Freiburg, Max Planck Inst Immunbiol, D-79108 Freiburg, Germany","Chien, KR (reprint author), Univ Calif San Diego, Sch Med, Inst Mol Med, La Jolla, CA 92093 USA.",syevans@ucsd.edu; kchien@partners.org,"Evans, Sylvia/G-1980-2015; Moretti, Alessandra/O-9271-2015","Moretti, Alessandra/0000-0001-5782-7832","NHLBI NIH HHS [R01 HL070867, DP1 HL117649]; NIH HHS [DP1 OD006428]",,,25,832,886,1,46,NATURE PUBLISHING GROUP,LONDON,"MACMILLAN BUILDING, 4 CRINAN ST, LONDON N1 9XW, ENGLAND",0028-0836,,,NATURE,Nature,10-Feb,2005,433,7026,,,,,647,653,,10.1038/nature03215,,7,Multidisciplinary Sciences,Science & Technology - Other Topics,895KX,WOS:000226862000048,15703750,No,,,11/20/17
J,"Yang, HJ; Li, QB; Fan, J; Holloman, WK; Pavletich, NP",,,,"Yang, HJ; Li, QB; Fan, J; Holloman, WK; Pavletich, NP",,,The BRCA2 homologue Brh2 nucleates RAD51 filament formation at a dsDNA-ssDNA junction,NATURE,,,English,Article,,,,,,,REPLICATION PROTEIN-A; DNA STRAND EXCHANGE; PRESYNAPTIC COMPLEX-FORMATION; BREAST-CANCER SUSCEPTIBILITY; RAD51-MEDIATED RECOMBINATION; SACCHAROMYCES-CEREVISIAE; GENOME STABILITY; DIRECTED REPAIR; USTILAGO-MAYDIS; BINDING PROTEIN,"The BRCA2 tumour suppressor(1) is essential for the error- free repair of double- strand breaks ( DSBs) in DNA by homologous recombination(2,3). This is mediated by RAD51, which forms a nucleoprotein filament with the 30 overhanging single- stranded DNA ( ssDNA) of the resected DSB, searches for a homologous donor sequence, and catalyses strand exchange with the donor DNA(4). The 3,418- amino- acid BRCA2 contains eight similar to 30- amino-acid BRC repeats that bind RAD51 ( refs 5, 6) and a similar to 700- amino-acid DBD domain that binds ssDNA(7). The isolated BRC and DBD domains have the opposing effects of inhibiting(8,9) and stimulating recombination(7), respectively, and the role of BRCA2 in repair has been unclear. Here we show that a full- length BRCA2 homologue ( Brh2) stimulates Rad51- mediated recombination at substoichiometric concentrations relative to Rad51. Brh2 recruits Rad51 to DNA and facilitates the nucleation of the filament, which is then elongated by the pool of free Rad51. Brh2 acts preferentially at a junction between double- stranded DNA ( dsDNA) and ssDNA, with strict specificity for the 30 overhang polarity of a resected DSB. These results establish a BRCA2 function in RAD51- mediated DSB repair and explain the loss of this repair capacity in BRCA2- associated cancers.","Mem Sloan Kettering Canc Ctr, Struct Biol Program, New York, NY 10021 USA; Cornell Univ, Weill Med Coll, Hearst Microbiol Res Ctr, Dept Microbiol & Immunol, New York, NY 10021 USA; Mem Sloan Kettering Canc Ctr, Howard Hughes Med Inst, New York, NY 10021 USA","Pavletich, NP (reprint author), Mem Sloan Kettering Canc Ctr, Struct Biol Program, 1275 York Ave, New York, NY 10021 USA.",nikola@xray2.mskcc.org,"fan, jie/A-3922-2012",,,,,30,205,209,0,9,NATURE PUBLISHING GROUP,LONDON,"MACMILLAN BUILDING, 4 CRINAN ST, LONDON N1 9XW, ENGLAND",0028-0836,,,NATURE,Nature,10-Feb,2005,433,7026,,,,,653,657,,10.1038/nature03234,,5,Multidisciplinary Sciences,Science & Technology - Other Topics,895KX,WOS:000226862000049,15703751,No,,,11/20/17
J,"de la Sierra-Gallay, IL; Pellegrini, O; Condon, C",,,,"de la Sierra-Gallay, IL; Pellegrini, O; Condon, C",,,"Structural basis for substrate binding, cleavage and allostery in the tRNA maturase RNase Z",NATURE,,,English,Article,,,,,,,PROCESSING ENDORIBONUCLEASE; PROTEIN CRYSTALS; BETA-LACTAMASE; END MATURATION; PRECURSOR; CCA; CRYSTALLOGRAPHY; MOLECULES; INVITRO; ENZYME,"Transfer RNAs ( tRNAs) are synthesized as part of longer primary transcripts that require processing of both their 30 and 50 extremities in every living organism known. The 50 side is processed ( matured) by the ubiquitously conserved endonucleolytic ribozyme, RNase P-1, whereas removal of the 30 tails can be either exonucleolytic(2,3) or endonucleolytic(4). The endonucleolytic pathway is catalysed by an enzyme known as RNase Z, or 3' tRNase(5,6). RNase Z cleaves precursor tRNAs immediately after the discriminator base ( the unpaired nucleotide 30 to the last base pair of the acceptor stem, used as an identity determinant by many aminoacyl- tRNA synthetases) in most cases(6 - 8), yielding a tRNA primed for addition of the CCA motif by nucleotidyl transferase. Here we report the crystal structure of Bacillus subtilis RNase Z at 2.1 Angstrom resolution, and propose a mechanism for tRNA recognition and cleavage. The structure explains the allosteric properties of the enzyme, and also sheds light on the mechanisms of inhibition by the CCA motif and long 50 extensions. Finally, it highlights the extraordinary adaptability of the metallo- hydrolase domain of the beta- lactamase family for the hydrolysis of covalent bonds.","Univ Paris 07, CNRS, UPR 9073, F-75221 Paris 05, France; Inst Biol Physicochim, F-75005 Paris, France","Condon, C (reprint author), Univ Paris 07, CNRS, UPR 9073, F-75221 Paris 05, France.",condon@ibpc.fr,"Condon, Ciaran/F-6798-2011; FIP, BM30A/I-5166-2015","Condon, Ciaran/0000-0002-2199-9621; Li de la Sierra-Gallay, Ines/0000-0003-2770-7439",,,,29,102,105,0,15,NATURE PUBLISHING GROUP,LONDON,"MACMILLAN BUILDING, 4 CRINAN ST, LONDON N1 9XW, ENGLAND",0028-0836,,,NATURE,Nature,10-Feb,2005,433,7026,,,,,657,661,,10.1038/nature03284,,5,Multidisciplinary Sciences,Science & Technology - Other Topics,895KX,WOS:000226862000050,15654328,No,,,11/20/17
J,"Richter, JD; Sonenberg, N",,,,"Richter, JD; Sonenberg, N",,,Regulation of cap-dependent translation by eIF4E inhibitory proteins,NATURE,,,English,Article,,,,,,,MESSENGER-RNA TRANSLATION; TERM SYNAPTIC PLASTICITY; BINDING-PROTEIN; CYTOPLASMIC POLYADENYLATION; DROSOPHILA CUP; INITIATION; EIF-4E; PHOSPHORYLATION; SYNAPSES; COMPLEX,"Eukaryotic messenger RNAs contain a modified guanosine, termed a cap, at their 50 ends. Translation of mRNAs requires the binding of an initiation factor, eIF4E, to the cap structure. Here, we describe a family of proteins that through a shared sequence regulate cap-dependent translation. The biological importance of this translational regulation is immense, and affects such processes as cell growth, development, oncogenic transformation and perhaps even axon pathfinding and memory consolidation.","Univ Massachusetts, Sch Med, Program Mol Med, Worcester, MA 01605 USA; McGill Univ, Dept Biochem, Montreal, PQ H3G 1Y6, Canada; McGill Univ, McGill Canc Ctr, Montreal, PQ H3G 1Y6, Canada","Richter, JD (reprint author), Univ Massachusetts, Sch Med, Program Mol Med, Worcester, MA 01605 USA.",joel.richter@umassmed.edu,,,,,,39,562,572,3,46,NATURE PUBLISHING GROUP,LONDON,"MACMILLAN BUILDING, 4 CRINAN ST, LONDON N1 9XW, ENGLAND",0028-0836,,,NATURE,Nature,3-Feb,2005,433,7025,,,,,477,480,,10.1038/nature03205,,4,Multidisciplinary Sciences,Science & Technology - Other Topics,893NT,WOS:000226727200037,15690031,No,,,11/20/17
J,"Gompel, N; Prud'homme, B; Wittkopp, PJ; Kassner, VA; Carroll, SB",,,,"Gompel, N; Prud'homme, B; Wittkopp, PJ; Kassner, VA; Carroll, SB",,,Chance caught on the wing: cis-regulatory evolution and the origin of pigment patterns in Drosophila,NATURE,,,English,Article,,,,,,,MELANOGASTER SPECIES-GROUP; GROUP DIPTERA; YELLOW LOCUS; PHYLOGENY; EXPRESSION; GENE; DIVERGENCE; MORPHOLOGY; ELEMENTS; LINEAGE,"The gain, loss or modification of morphological traits is generally associated with changes in gene regulation during development. However, the molecular bases underlying these evolutionary changes have remained elusive. Here we identify one of the molecular mechanisms that contributes to the evolutionary gain of a male-specific wing pigmentation spot in Drosophila biarmipes, a species closely related to Drosophila melanogaster. We show that the evolution of this spot involved modifications of an ancestral cis-regulatory element of the yellow pigmentation gene. This element has gained multiple binding sites for transcription factors that are deeply conserved components of the regulatory landscape controlling wing development, including the selector protein Engrailed. The evolutionary stability of components of regulatory landscapes, which can be co-opted by chance mutations in cis-regulatory elements, might explain the repeated evolution of similar morphological patterns, such as wing pigmentation patterns in flies.","Univ Wisconsin, Howard Hughes Med Inst, Madison, WI 53706 USA; Univ Wisconsin, Mol Biol Lab, Madison, WI 53706 USA","Carroll, SB (reprint author), Univ Wisconsin, Howard Hughes Med Inst, 1525 Linden Dr, Madison, WI 53706 USA.",sbcarrol@wisc.edu,"Phelps, Steve/H-2263-2011",,,,,47,356,373,2,68,NATURE PUBLISHING GROUP,LONDON,"MACMILLAN BUILDING, 4 CRINAN ST, LONDON N1 9XW, ENGLAND",0028-0836,1476-4687,,NATURE,Nature,3-Feb,2005,433,7025,,,,,481,487,,10.1038/nature03235,,7,Multidisciplinary Sciences,Science & Technology - Other Topics,893NT,WOS:000226727200038,15690032,No,,,11/20/17
