,Unnamed: 0.1,Unnamed: 0.1.1,AB,AF,AU,BP,C1,CA,CR,DA,DE,DI,DT,EI,EM,EP,FU,FX,GA,HC,HP,ID,IS,J9,JI,LA,NR,OA,OI,PA,PD,PG,PI,PM,PT,PU,PY,RI,RP,SC,SN,SO,TC,TI,U1,U2,UT,Unnamed: 0.1.1.1,VL,WC,Z9,c_fname,c_lname,citedby,count,gender,probability,scholar_id,quantile,range,page_id,has_page,page_id_nature,has_page_nature,page_title,page_title_nature,page_title_match,page_title_match_nature
30,131,212.0,"The location and timing of cellular differentiation must be stringently controlled for proper organ formation. Normally, hepatocytes differentiate from hepatic progenitor cells to form the liver during development(1,2). However, previous studies have shown that the hepatic program can also be activated in non-hepatic lineage cells after exposure to particular stimuli or fusion with hepatocytes(3-9). These unexpected findings suggest that factors critical to hepatocyte differentiation exist and become activated to induce hepatocyte-specific properties in different cell types. Here, by screening the effects of twelve candidate factors, we identify three specific combinations of two transcription factors, comprising Hnf4 alpha plus Foxa1, Foxa2 or Foxa3, that can convert mouse embryonic and adult fibroblasts into cells that closely resemble hepatocytes in vitro. The induced hepatocyte-like (iHep) cells have multiple hepatocyte-specific features and reconstitute damaged hepatic tissues after transplantation. The generation of iHep cells may provide insights into the molecular nature of hepatocyte differentiation and potential therapies for liver diseases.","Sekiya, Sayaka; Suzuki, Atsushi","Sekiya, S; Suzuki, A",390.0,"[Sekiya, Sayaka; Suzuki, Atsushi] Kyushu Univ, Div Organogenesis & Regenerat, Med Inst Bioregulat, Higashi Ku, Fukuoka 8128582, Japan; [Suzuki, Atsushi] Japan Sci & Technol Agcy, Precursory Res Embryon Sci & Technol PRESTO, Kawaguchi, Saitama 3320012, Japan",,,11/20/17,,10.1038/nature10263,Article,,suzukicks@bioreg.kyushu-u.ac.jp,U148,"Ministry of Education, Culture, Sports, Science and Technology (MEXT) of Japan; Japan Science and Technology Agency","We thank A. Iwama, H. Miyoshi and R. M. Tanguay for sharing reagents, F. Costantini for providing the R26R<SUP>YFP</SUP> mice and E. Gunshima, A. Kaneyuki and H. Kuboyama for excellent technical assistance. This work was supported in part by the Program for Improvement of the Research Environment for Young Researchers from the Special Coordination Funds for Promoting Science and Technology commissioned by the Ministry of Education, Culture, Sports, Science and Technology (MEXT) of Japan, a Grant-in-Aid for Scientific Research from the MEXT of Japan and the Precursory Research for Embryonic Science and Technology Program of the Japan Science and Technology Agency.",794PA,Y,N,HEPATIC PROGENITOR CELLS; MESENCHYMAL STEM-CELLS; CLONAL IDENTIFICATION; PANCREATIC-CELLS; IN-VIVO; LIVER; DIFFERENTIATION; FUSION; CARDIOMYOCYTES; NORMALIZATION,7356.0,NATURE,Nature,English,31.0,No,,"MACMILLAN BUILDING, 4 CRINAN ST, LONDON N1 9XW, ENGLAND",21-Jul,6.0,LONDON,21716291.0,J,NATURE PUBLISHING GROUP,2011.0,"U-ID, Kyushu/C-5291-2016","Suzuki, A (reprint author), Kyushu Univ, Div Organogenesis & Regenerat, Med Inst Bioregulat, Higashi Ku, 3-1-1 Maidashi, Fukuoka 8128582, Japan.",Science & Technology - Other Topics,0028-0836,NATURE,368.0,Direct conversion of mouse fibroblasts to hepatocyte-like cells by defined factors,7.0,65.0,WOS:000292911200045,212.0,475,Multidisciplinary Sciences,400,atsushi,suzuki,594.0,13,male,1.0,72oAu0gAAAAJ,1,"[0, 1474]",na,0,na,0,na,na,0,0
31,142,259.0,"The proteasome is the major ATP-dependent protease in eukaryotic cells, but limited structural information restricts a mechanistic understanding of its activities. The proteasome regulatory particle, consisting of the lid and base subcomplexes, recognizes and processes polyubiquitinated substrates. Here we used electron microscopy and a new heterologous expression system for the lid to delineate the complete subunit architecture of the regulatory particle from yeast. Our studies reveal the spatial arrangement of ubiquitin receptors, deubiquitinating enzymes and the protein unfolding machinery at subnanometre resolution, outlining the substrate's path to degradation. Unexpectedly, the ATPase subunits within the base unfoldase are arranged in a spiral staircase, providing insight into potential mechanisms for substrate translocation through the central pore. Large conformational rearrangements of the lid upon holoenzyme formation suggest allosteric regulation of deubiquitination. We provide a structural basis for the ability of the proteasome to degrade a diverse set of substrates and thus regulate vital cellular processes.","Lander, Gabriel C.; Estrin, Eric; Matyskiela, Mary E.; Bashore, Charlene; Nogales, Eva; Martin, Andreas","Lander, GC; Estrin, E; Matyskiela, ME; Bashore, C; Nogales, E; Martin, A",186.0,"[Estrin, Eric; Matyskiela, Mary E.; Bashore, Charlene; Martin, Andreas] Univ Calif Berkeley, Dept Mol & Cell Biol, Berkeley, CA 94720 USA; [Lander, Gabriel C.; Nogales, Eva] Univ Calif Berkeley, Lawrence Berkeley Natl Lab, Div Life Sci, Berkeley, CA 94720 USA; [Nogales, Eva] Univ Calif Berkeley, Howard Hughes Med Inst, Berkeley, CA 94720 USA; [Nogales, Eva; Martin, Andreas] Univ Calif Berkeley, Inst QB3, Berkeley, CA 94720 USA",,,11/20/17,,10.1038/nature10774,Article,,a.martin@berkeley.edu,U75,Damon Runyon Cancer Research Foundation; American Cancer Society [121453-PF-11-178-01-TBE]; NSF; Searle Scholars Program; UC Berkeley MCB Department; NIH [R01-GM094497-01A1]; Lawrence Berkeley National Laboratory; Howard Hughes Medical Institute; NIH through the NCRR [RR017573],"We thank the members of the Martin and Nogales labs for helpful discussions, and G. Cardone for help with local resolution calculations. G. C. L. acknowledges support from Damon Runyon Cancer Research Foundation, M. E. M. acknowledges support by the American Cancer Society grant 121453-PF-11-178-01-TBE, C. B. acknowledges support from the NSF Graduate Research Fellowship. This research was funded in part by the Searle Scholars Program (A. M.), start-up funds from the UC Berkeley MCB Department (A. M.), the NIH grant R01-GM094497-01A1 (A. M.), the Lawrence Berkeley National Laboratory (G. C. L.), and the Howard Hughes Medical Institute (E.N.). Some of the work presented here was conducted at the National Resource for Automated Molecular Microscopy, which is supported by the NIH through the NCRR P41 program (RR017573).",888HI,Y,N,ELECTRON-MICROSCOPY; 26S PROTEASOME; SACCHAROMYCES-CEREVISIAE; UBIQUITIN CHAINS; NEW-GENERATION; CORE PARTICLE; DEGRADATION; TRANSLOCATION; PROTEINS; ATPASES,7384.0,NATURE,Nature,English,56.0,No,"Lander, Gabriel C./0000-0003-4921-1135","MACMILLAN BUILDING, 4 CRINAN ST, LONDON N1 9XW, ENGLAND",9-Feb,8.0,LONDON,22237024.0,J,NATURE PUBLISHING GROUP,2012.0,,"Martin, A (reprint author), Univ Calif Berkeley, Dept Mol & Cell Biol, 229 Stanley Hall, Berkeley, CA 94720 USA.",Science & Technology - Other Topics,0028-0836,NATURE,292.0,Complete subunit architecture of the proteasome regulatory particle,2.0,52.0,WOS:000299994100031,259.0,482,Multidisciplinary Sciences,302,andreas,martin,1783.0,1021,male,1.0,xo5_A9YAAAAJ,2,"(1474, 4126]",na,0,na,0,na,na,0,0
32,151,68.0,"Electrons in a metal are indistinguishable particles that interact strongly with other electrons and their environment. Isolating and detecting a single flying electron after propagation, in a similar manner to quantum optics experiments with single photons(1,2), is therefore a challenging task. So far only a few experiments have been performed in a high-mobility two-dimensional electron gas in which the electron propagates almost ballistically(3-5). In these previous works, flying electrons were detected by means of the current generated by an ensemble of electrons, and electron correlations were encrypted in the current noise. Here we demonstrate the experimental realization of high-efficiency single-electron source and detector for a single electron propagating isolated from the other electrons through a one-dimensional channel. The moving potential is excited by a surface acoustic wave, which carries the single electron along the one-dimensional channel at a speed of 3 mu m ns(-1). When this quantum channel is placed between two quantum dots several micrometres apart, a single electron can be transported from one quantum dot to the other with quantum efficiencies of emission and detection of 96% and 92%, respectively. Furthermore, the transfer of the electron can be triggered on a timescale shorter than the coherence time T-2* of GaAs spin qubits(6). Our work opens new avenues with which to study the teleportation of a single electron spin and the distant interaction between spatially separated qubits in a condensed-matter system.","Hermelin, Sylvain; Takada, Shintaro; Yamamoto, Michihisa; Tarucha, Seigo; Wieck, Andreas D.; Saminadayar, Laurent; Baeuerle, Christopher; Meunier, Tristan","Hermelin, S; Takada, S; Yamamoto, M; Tarucha, S; Wieck, AD; Saminadayar, L; Bauerle, C; Meunier, T",435.0,"[Hermelin, Sylvain; Saminadayar, Laurent; Baeuerle, Christopher; Meunier, Tristan] CNRS, Inst Neel, F-38042 Grenoble, France; [Hermelin, Sylvain; Saminadayar, Laurent; Baeuerle, Christopher; Meunier, Tristan] Univ Grenoble 1, F-38042 Grenoble, France; [Takada, Shintaro; Yamamoto, Michihisa; Tarucha, Seigo] Univ Tokyo, Dept Appl Phys, Tokyo 1138656, Japan; [Yamamoto, Michihisa] ERATO JST, Kawaguchi, Saitama 3310012, Japan; [Tarucha, Seigo] ICORP Int Cooperat Res Project Quantum Spin Infor, Atsugi, Kanagawa 2430198, Japan; [Wieck, Andreas D.] Ruhr Univ Bochum, Lehrstuhl Angew Festkorperphys, D-44780 Bochum, Germany; [Saminadayar, Laurent] Inst Univ France, F-75005 Paris, France",,,11/20/17,,10.1038/nature10416,Article,,bauerle@grenoble.cnrs.fr; tristan.meunier@grenoble.cnrs.fr,438,"ERATO-JST [080300000477]; Special Coordination Funds for Promoting Science and Technology (NanoQuine); Japan Science and Technology Agency Strategic International Cooperative Program; Japanese Ministry of Education, Culture, Sports, Science, and Technology; Harvard University; Deutsche Forschungsgemeinschaft [SPP1285]; Bundesministerium fur Bildung und Forschung [QuaHLRep 01BQ1035]; Centre National de la Recherche Scientifique (DREI) - Japan Society for the Promotion of Science [PRC 424, L08519]; Marie-Curie European Reintegration Grant [224786]; Nanoscience Foundation of Grenoble;  [20684011]","We thank Y. Launay and P. Perrier for technical support. We acknowledge technical support from the 'Poles E'lectroniques' of the 'Department Nano et MCBT' from the Institut Neel. M. Y. acknowledges financial support by Grant-in-Aid for Young Scientists A (no. 20684011) and ERATO-JST (080300000477). S. T. acknowledges financial support from Special Coordination Funds for Promoting Science and Technology (NanoQuine), Japan Science and Technology Agency Strategic International Cooperative Program, Japanese Ministry of Education, Culture, Sports, Science, and Technology KAKENHI 'Quantum Cybernetics', and Intelligence Advanced Research Projects Activity project 'Multi-Qubit Coherent Operations' through Harvard University. A. D. W. acknowledges expert help from D. Reuter and support of the Deutsche Forschungsgemeinschaft (SPP1285) and the Bundesministerium fur Bildung und Forschung (QuaHLRep 01BQ1035). C. B. acknowledges financial support from Centre National de la Recherche Scientifique (DREI) - Japan Society for the Promotion of Science (nos PRC 424 and L08519). T. M. acknowledges financial support from Marie-Curie European Reintegration Grant 224786. We are grateful to the Nanoscience Foundation of Grenoble for partial financial support of this work.",822WH,,,TELEPORTATION; INTERFERENCE; TRANSPORT; SPIN; DOTS,7365.0,NATURE,Nature,English,24.0,No,"Wieck, Andreas Dirk/0000-0001-9776-2922; Bauerle, Christopher/0000-0001-7393-0346; Yamamoto, Michihisa/0000-0001-9113-6461","MACMILLAN BUILDING, 4 CRINAN ST, LONDON N1 9XW, ENGLAND",22-Sep,4.0,LONDON,21938064.0,J,NATURE PUBLISHING GROUP,2011.0,"Bauerle, Christopher/A-3972-2012; TARUCHA, SEIGO/I-7030-2012; Wieck, Andreas Dirk/C-5129-2009; Bauerle, Christopher/S-8973-2016; Yamamoto, Michihisa/E-6850-2017","Bauerle, C (reprint author), CNRS, Inst Neel, F-38042 Grenoble, France.",Science & Technology - Other Topics,0028-0836,NATURE,127.0,Electrons surfing on a sound wave as a platform for quantum optics with flying electrons,6.0,59.0,WOS:000295080500034,68.0,477,Multidisciplinary Sciences,127,tristan,meunier,2864.0,331,male,0.95,RkPVOUsAAAAJ,2,"(1474, 4126]",44570978,1,51722754,1,Grand prix de littrature de l'Acadmie franaise,Grand prix de littrature de l'Acadmie franaise,0,0
33,101,26.0,"The NRT1/PTR family of proton-coupled transporters are responsible for nitrogen assimilation in eukaryotes and bacteria through the uptake of peptides. However, in most plant species members of this family have evolved to transport nitrate as well as additional secondary metabolites and hormones. In response to falling nitrate levels, NRT1.1 is phosphorylated on an intracellular threonine that switches the transporter from a low-affinity to high-affinity state. Here we present both the apo and nitrate-bound crystal structures of Arabidopsis thaliana NRT1.1, which together with in vitro binding and transport data identify a key role for His 356 in nitrate binding. Our data support a model whereby phosphorylation increases structural flexibility and in turn the rate of transport. Comparison with peptide transporters further reveal show the NRT1/PTR family has evolved to recognize diverse nitrogenous ligands, while maintaining elements of a conserved coupling mechanism within this superfamily of nutrient transporters.","Parker, Joanne L.; Newstead, Simon","Parker, JL; Newstead, S",68.0,"[Parker, Joanne L.; Newstead, Simon] Univ Oxford, Dept Biochem, Oxford OX1 3QU, England; [Newstead, Simon] Rutherford Appleton Lab, Didcot OX11 0FA, Oxon, England",,,11/20/17,,10.1038/nature13116,Article,1476-4687,joanne.parker@bioch.ox.ac.uk; simon.newstead@bioch.ox.ac.uk,+,"Medical Research Council (MRC) [G0900399]; Royal Society [RG110211, IE111401]","We thank R. Flaig for help with additional access to beamline IO4 and we thank Diamond Light Source for access to beam lines I02, I03, I04 and I04-1 (MX7345) that contributed to the results presented here. This research was funded through the Medical Research Council (MRC) Career Development Award grant G0900399 and Royal Society grants (RG110211 and IE111401) to S.N.",AC0ZQ,Y,N,PEPTIDE TRANSPORTERS; STREPTOCOCCUS-THERMOPHILUS; OLIGOPEPTIDE TRANSPORTERS; SACCHAROMYCES-CEREVISIAE; CRYSTAL-STRUCTURE; MFS TRANSPORTERS; PROTEIN; MECHANISM; SYSTEM; ARABIDOPSIS,7490.0,NATURE,Nature,English,57.0,No,"Newstead, Simon/0000-0001-7432-2270","MACMILLAN BUILDING, 4 CRINAN ST, LONDON N1 9XW, ENGLAND",6-Mar,19.0,LONDON,24572366.0,J,NATURE PUBLISHING GROUP,2014.0,,"Parker, JL (reprint author), Univ Oxford, Dept Biochem, Oxford OX1 3QU, England.",Science & Technology - Other Topics,0028-0836,NATURE,102.0,Molecular basis of nitrate uptake by the plant nitrate transporter NRT1.1,6.0,146.0,WOS:000332224400043,26.0,507,Multidisciplinary Sciences,109,simon,newstead,2593.0,2443,male,0.99,U8Oggd4AAAAJ,2,"(1474, 4126]",368659,1,2274780,1,Trimontium (Newstead),Trimontium (Newstead),1,1
34,45,312.0,"Radioactive decay of uranium and thorium produces He-4, whereas He-3 in the Earth's mantle is not produced by radioactive decay and was only incorporated during accretion-that is, it is primordial(1). He-3/He-4 ratios in many ocean-island basalts (OIBs) that erupt at hotspot volcanoes, such as Hawaii and Iceland, can be up to sixfold higher than in mid-ocean ridge basalts (MORBs). This is inferred to be the result of outgassing by melt production at mid-ocean ridges in conjunction with radiogenic ingrowth of He-4, which has led to a volatile-depleted upper mantle (MORB source) with low He-3 concentrations and low He-3/He-4 ratios(2-6). Consequently, high He-3/He-4 ratios in OIBs are conventionally viewed as evidence for an undegassed, primitive mantle source, which is sampled by hot, buoyantly upwelling deep-mantle plumes(3,6,7). However, this conventional model provides no viable explanation of why helium concentrations and elemental ratios of He/Ne and He/Ar in OIBs are an order of magnitude lower than in MORBs. This has been described as the 'helium concentration paradox'(8) and has contributed to a long-standing controversy about the structure and dynamics of the Earth's mantle. Here we show that the helium concentration paradox, as well as the full range of noble-gas concentrations observed in MORB and OIB glasses, can self-consistently be explained by disequilibrium open-system degassing of the erupting magma. We show that a higher CO2 content in OIBs than in MORBs leads to more extensive degassing of helium in OIB magmas and that noble gases in OIB lavas can be derived from a largely undegassed primitive mantle source.","Gonnermann, Helge M.; Mukhopadhyay, Sujoy","Gonnermann, HM; Mukhopadhyay, S",1037.0,"Harvard Univ, Dept Earth & Planetary Sci, Cambridge, MA 02138 USA",,,11/20/17,,10.1038/nature06240,Article,,helge@hawaii.edu,1040,,,223TK,,,RARE-GAS SYSTEMATICS; MIDOCEAN RIDGE; UPPER-MANTLE; LOIHI SEAMOUNT; EARTHS MANTLE; POPPING ROCK; NOBLE-GASES; BASALTS; GEOCHEMISTRY; CONSTRAINTS,7165.0,NATURE,Nature,English,33.0,No,,"MACMILLAN BUILDING, 4 CRINAN ST, LONDON N1 9XW, ENGLAND",25-Oct,4.0,LONDON,17960241.0,J,NATURE PUBLISHING GROUP,2007.0,"Gonnermann, Helge/B-1054-2012","Gonnermann, HM (reprint author), Univ Hawaii, SOEST, Dept Geol & Geophys, Honolulu, HI 96822 USA.",Science & Technology - Other Topics,0028-0836,NATURE,38.0,Non-equilibrium degassing and a primordial source for helium in ocean-island volcanism,1.0,19.0,WOS:000250395000049,312.0,449,Multidisciplinary Sciences,39,sujoy,mukhopadhyay,2363.0,8,male,1.0,MXCTBcwAAAAJ,2,"(1474, 4126]",na,0,na,0,na,na,0,0
