,Unnamed: 0.1,Unnamed: 0.1.1,AB,AF,AU,BP,C1,CA,CR,DA,DE,DI,DT,EI,EM,EP,FU,FX,GA,HC,HP,ID,IS,J9,JI,LA,NR,OA,OI,PA,PD,PG,PI,PM,PT,PU,PY,RI,RP,SC,SN,SO,TC,TI,U1,U2,UT,Unnamed: 0.1.1.1,VL,WC,Z9,c_fname,c_lname,citedby,count,gender,probability,scholar_id,quantile,range,page_id,has_page,page_id_nature,has_page_nature,page_title,page_title_nature,page_title_match,page_title_match_nature
0,121,153.0,"Understanding the dynamics of correlated many-body quantum systems is a challenge for modern physics. Owing to the simplicity of theirHamiltonians, He-4 (bosons) and He-3 (fermions) have served as model systems for strongly interacting quantum fluids, with substantial efforts devoted to their understanding. An important milestone was the direct observation of the collective phonon-roton mode in liquid He-4 by neutron scattering, verifying Landau's prediction(1) and his fruitful concept of elementary excitations. In a Fermi system, collective density fluctuations (known as 'zero-sound' in He-3, and 'plasmons' in charged systems) and incoherent particle-hole excitations are observed. At small wavevectors and energies, both types of excitation are described by Landau's theory of Fermi liquids(2,3). At higher wavevectors, the collectivemode enters the particle-hole band, where it is strongly damped. The dynamics of Fermi liquids at high wavevectors was thus believed to be essentially incoherent. Here we report inelastic neutron scattering measurements of a monolayer of liquid He-3, observing a roton-like excitation. We find that the collective density mode reappears as a well defined excitation atmomentum transfers larger than twice the Fermi momentum. We thus observe unexpected collective behaviour of a Fermi many-body system in the regime beyond the scope of Landau's theory. A satisfactory interpretation of the measured spectra is obtained using a dynamic many-body theory(4).","Godfrin, Henri; Meschke, Matthias; Lauter, Hans-Jochen; Sultan, Ahmad; Boehm, Helga M.; Krotscheck, Eckhard; Panholzer, Martin","Godfrin, H; Meschke, M; Lauter, HJ; Sultan, A; Bohm, HM; Krotscheck, E; Panholzer, M",576.0,"[Godfrin, Henri; Meschke, Matthias; Sultan, Ahmad] CNRS, Inst Neel, F-38042 Grenoble 9, France; [Godfrin, Henri; Meschke, Matthias; Sultan, Ahmad] Univ Grenoble 1, F-38042 Grenoble 9, France; [Meschke, Matthias] Aalto Univ, Low Temp Lab, Aalto 00076, Finland; [Lauter, Hans-Jochen] Inst Laue Langevin, F-38042 Grenoble 9, France; [Lauter, Hans-Jochen] Oak Ridge Natl Lab, Oak Ridge, TN 37831 USA; [Boehm, Helga M.; Krotscheck, Eckhard; Panholzer, Martin] Johannes Kepler Univ Linz, Inst Theoret Phys, A-4040 Linz, Austria; [Krotscheck, Eckhard] SUNY Buffalo, Dept Phys, Buffalo, NY 14260 USA",,,11/20/17,,10.1038/nature10919,Article,,henri.godfrin@grenoble.cnrs.fr,579,Austrian Fonds zur Forderung der wissenschaftlichen Forschung (FWF) [P21264]; French Agence Nationale de la Recherche [ANR-2010-INTB-403-01]; EU [228464],"We are grateful to the Austrian-French programme Amadeus for providing initial support; to the Austrian Fonds zur Forderung der wissenschaftlichen Forschung (FWF grant P21264), the French Agence Nationale de la Recherche (project ANR-2010-INTB-403-01) and the EU FRP7 low-temperature infrastructure grant Microkelvin (project number 228464) for funding this research; and to the Institut Laue-Langevin for use of the facility.",915EF,,,ELEMENTARY EXCITATIONS; EFFECTIVE-MASS; NEUTRON-SCATTERING; SPIN FLUCTUATIONS; ZERO SOUND; HE-3; FILMS; PLASMONS; GRAPHITE; DYNAMICS,7391.0,NATURE,Nature,English,31.0,No,,"MACMILLAN BUILDING, 4 CRINAN ST, LONDON N1 9XW, ENGLAND",29-Mar,4.0,LONDON,22460903.0,J,NATURE PUBLISHING GROUP,2012.0,"Meschke, Matthias/G-5166-2012","Godfrin, H (reprint author), CNRS, Inst Neel, BP 166, F-38042 Grenoble 9, France.",Science & Technology - Other Topics,0028-0836,NATURE,17.0,Observation of a roton collective mode in a two-dimensional Fermi liquid,5.0,40.0,WOS:000302006100034,153.0,483,Multidisciplinary Sciences,17,martin,panholzer,118.0,3568,male,1.0,oDRnEUgAAAAJ,1,"[0, 1474]",143848,1,143848,1,List of suicides,List of suicides,0,0
1,106,60.0,"Branching river networks are one of the most widespread and recognizable features of Earth's landscapes and have also been discovered elsewhere in the Solar System(1,2). But the mechanisms that create these patterns and control their spatial scales are poorly understood. Theories based on probability(3-5) or optimality(3,6-8) have proven useful(9), but do not explain how river networks develop over time through erosion and sediment transport. Here we show that branching at the uppermost reaches of river networks is rooted in two coupled instabilities: first, valleys widen at the expense of their smaller neighbours, and second, side slopes of the widening valleys become susceptible to channel incision. Each instability occurs at a critical ratio of the characteristic timescales for soil transport and channel incision. Measurements from two field sites demonstrate that our theory correctly predicts the size of the smallest valleys with tributaries. We also show that the dominant control on the scale of landscape dissection in these sites is the strength of channel incision, which correlates with aridity and rock weakness, rather than the strength of soil transport. These results imply that the fine-scale structure of branching river networks is an organized signature of erosional mechanics, not a consequence of random topology.","Perron, J. Taylor; Richardson, Paul W.; Ferrier, Ken L.; Lapotre, Mathieu","Perron, JT; Richardson, PW; Ferrier, KL; Lapotre, M",100.0,"[Perron, J. Taylor; Richardson, Paul W.; Ferrier, Ken L.] MIT, Dept Earth Atmospher & Planetary Sci, Cambridge, MA 02139 USA; [Lapotre, Mathieu] Univ Strasbourg, Ecole & Observ Sci Terre, F-67084 Strasbourg, France",,,11/20/17,,10.1038/nature11672,Article,,perron@mit.edu,+,US National Science Foundation Geomorphology and Land Use Dynamics programme [EAR-0951672]; US Department of Defense through a National Defense Science and Engineering Graduate Fellowship,"This study was supported by the US National Science Foundation Geomorphology and Land Use Dynamics programme through award EAR-0951672 to J.T.P. and by the US Department of Defense through a National Defense Science and Engineering Graduate Fellowship to P. W. R. J.T.P. is a Scholar in the Canadian Institute for Advanced Research (CIFAR). The authors thank T. Clifton and G. Chmiel for assistance with sample preparation, and the Orradre family of San Ardo, California, and numerous landowners in Greene County, Pennsylvania, for granting access to their land.",048EQ,,,DRAINAGE-BASIN EVOLUTION; TRIPLE JUNCTION REGION; CHANNEL NETWORKS; NORTHERN CALIFORNIA; COSMOGENIC NUCLIDES; EROSION RATES; MODEL; LANDSCAPE; HILLSLOPE; BE-10,7427.0,NATURE,Nature,English,57.0,No,"Perron, J. Taylor/0000-0002-0404-8701; Lapotre, Mathieu/0000-0001-9941-1552","MACMILLAN BUILDING, 4 CRINAN ST, LONDON N1 9XW, ENGLAND",6-Dec,6.0,LONDON,23222614.0,J,NATURE PUBLISHING GROUP,2012.0,"Perron, J. Taylor/D-8983-2012","Perron, JT (reprint author), MIT, Dept Earth Atmospher & Planetary Sci, Cambridge, MA 02139 USA.",Science & Technology - Other Topics,0028-0836,NATURE,27.0,The root of branching river networks,4.0,115.0,WOS:000311893400053,60.0,492,Multidisciplinary Sciences,28,mathieu,lapotre,113.0,545,male,1.0,beQ7vU0AAAAJ,1,"[0, 1474]",na,0,na,0,na,na,0,0
2,64,333.0,"Flat-slab subduction occurs when the descending plate becomes horizontal at some depth before resuming its descent into the mantle. It is often proposed as a mechanism for the uplifting of deep crustal rocks ('thick-skinned' deformation) far from plate boundaries, and for causing unusual patterns of volcanism, as far back as the Proterozoic eon(1). For example, the formation of the expansive Rocky Mountains and the subsequent voluminous volcanism across much of the western USA has been attributed to a broad region of flat-slab subduction beneath North America that occurred during the Laramide orogeny (80-55 million years ago)(2). Here we study the largest modern flat slab, located in Peru, to better understand the processes controlling the formation and extent of flat slabs. We present new data that indicate that the subducting Nazca Ridge is necessary for the development and continued support of the horizontal plate at a depth of about 90 kilometres. By combining constraints from Rayleigh wave phase velocities with improved earthquake locations, we find that the flat slab is shallowest along the ridge, while to the northwest of the ridge, the slab is sagging, tearing, and re-initiating normal subduction. On the basis of our observations, we propose a conceptual model for the temporal evolution of the Peruvian flat slab in which the flat slab forms because of the combined effects of trench retreat along the Peruvian plate boundary, suction, and ridge subduction. We find that while the ridge is necessary but not sufficient for the formation of the flat slab, its removal is sufficient for the flat slab to fail. This provides new constraints on our understanding of the processes controlling the beginning and end of the Laramide orogeny and other putative episodes of flat-slab subduction.","Antonijevic, Sanja Knezevic; Wagner, Lara S.; Kumar, Abhash; Beck, Susan L.; Long, Maureen D.; Zandt, George; Tavera, Hernando; Condori, Cristobal","Antonijevic, SK; Wagner, LS; Kumar, A; Beck, SL; Long, MD; Zandt, G; Tavera, H; Condori, C",212.0,"[Antonijevic, Sanja Knezevic; Kumar, Abhash] Univ N Carolina, Dept Geol Sci, Chapel Hill, NC 27599 USA; [Wagner, Lara S.] Carnegie Inst Sci, Dept Terr Magnetism, Washington, DC 20015 USA; [Beck, Susan L.; Zandt, George] Univ Arizona, Dept Geosci, Tucson, AZ 85721 USA; [Long, Maureen D.] Yale Univ, Dept Geol & Geophys, New Haven, CT 06511 USA; [Tavera, Hernando; Condori, Cristobal] Inst Geofis Peru, Lima 15012, Peru",,,11/19/17,,10.1038/nature14648,Article,1476-4687,sknezevi@live.unc.edu,+,"NSF [EAR-0944184, EAR-0943991, EAR-0943962, EAR-0908777, EAR-0907880]","We thank R. Clayton and P. Davies for providing the records from eight PERUSE stations. The PULSE experiment was supported by NSF grants EAR-0944184 (to L.S.W.), EAR-0943991 (to S.L.B.) and EAR-0943962 (to M.D.L.). The CAUGHT project was supported by NSF grants EAR-0908777 (to L.S.W.) and EAR-0907880 (to S.L.B.).",CO8AM,,,OCEANIC PLATEAU SUBDUCTION; SENSITIVITY KERNELS; LARAMIDE OROGENY; NAZCA PLATE; PERU; TOMOGRAPHY; BENEATH; LITHOSPHERE; VELOCITY; PHASE,7564.0,NATURE,Nature,English,34.0,No,"Long, Maureen/0000-0003-1936-3840; Knezevic Antonijevic, Sanja/0000-0003-4224-5746; Condori Quispe, Cristobal/0000-0003-2657-147X; Wagner, Lara/0000-0001-7130-7761","MACMILLAN BUILDING, 4 CRINAN ST, LONDON N1 9XW, ENGLAND",13-Aug,16.0,LONDON,26268192.0,J,NATURE PUBLISHING GROUP,2015.0,"Long, Maureen/A-1383-2009","Antonijevic, SK (reprint author), Univ N Carolina, Dept Geol Sci, CB 3315, Chapel Hill, NC 27599 USA.",Science & Technology - Other Topics,0028-0836,NATURE,18.0,The role of ridges in the formation and longevity of flat slabs,3.0,20.0,WOS:000359386900030,333.0,524,Multidisciplinary Sciences,18,cristobal,condori,44.0,110,male,1.0,VSlGE4UAAAAJ,1,"[0, 1474]",na,0,na,0,na,na,0,0
3,51,370.0,"The genetic divergence time between two species varies substantially across the genome, conveying important information about the timing and process of speciation. Here we develop a framework for studying this variation and apply it to about 20 million base pairs of aligned sequence from humans, chimpanzees, gorillas and more distantly related primates. Human-chimpanzee genetic divergence varies from less than 84% to more than 147% of the average, a range of more than 4 million years. Our analysis also shows that human-chimpanzee speciation occurred less than 6.3 million years ago and probably more recently, conflicting with some interpretations of ancient fossils. Most strikingly, chromosome X shows an extremely young genetic divergence time, close to the genome minimum along nearly its entire length. These unexpected features would be explained if the human and chimpanzee lineages initially diverged, then later exchanged genes before separating permanently.","Patterson, Nick; Richter, Daniel J.; Gnerre, Sante; Lander, Eric S.; Reich, David","Patterson, N; Richter, DJ; Gnerre, S; Lander, ES; Reich, D",1103.0,"Harvard Univ, Broad Inst, Cambridge, MA 02142 USA; MIT, Broad Inst, Cambridge, MA 02142 USA; MIT, Dept Biol, Cambridge, MA 02142 USA; Harvard Univ, Sch Med, Dept Genet, Boston, MA 02115 USA",,,11/20/17,,10.1038/nature04789,Article,1476-4687,reich@genetics.med.harvard.edu,1108,,,057SM,,,ANCESTRAL POPULATION SIZES; DNA-SEQUENCES; DIVERGENCE TIMES; UPPER MIOCENE; DROSOPHILA-MAURITIANA; MAMMALIAN EVOLUTION; GENOME SEQUENCE; HOMINID; CHAD; PALEONTOLOGY,7097.0,NATURE,Nature,English,43.0,No,"Richter, Daniel/0000-0002-9238-5571","MACMILLAN BUILDING, 4 CRINAN ST, LONDON N1 9XW, ENGLAND",28-Jun,6.0,LONDON,16710306.0,J,NATURE PUBLISHING GROUP,2006.0,,"Reich, D (reprint author), Harvard Univ, Broad Inst, Cambridge, MA 02142 USA.",Science & Technology - Other Topics,0028-0836,NATURE,319.0,Genetic evidence for complex speciation of humans and chimpanzees,4.0,100.0,WOS:000238615500040,370.0,441,Multidisciplinary Sciences,326,david,reich,14.0,12593,male,1.0,rK-2mFQAAAAJ,1,"[0, 1474]",na,0,na,0,na,na,0,0
4,16,366.0,"A powerful way to discover key genes with causal roles in oncogenesis is to identify genomic regions that undergo frequent alteration in human cancers. Here we present high-resolution analyses of somatic copy-number alterations (SCNAs) from 3,131 cancer specimens, belonging largely to 26 histological types. We identify 158 regions of focal SCNA that are altered at significant frequency across several cancer types, of which 122 cannot be explained by the presence of a known cancer target gene located within these regions. Several gene families are enriched among these regions of focal SCNA, including the BCL2 family of apoptosis regulators and the NF-kappa B pathway. We show that cancer cells containing amplifications surrounding the MCL1 and BCL2L1 anti-apoptotic genes depend on the expression of these genes for survival. Finally, we demonstrate that a large majority of SCNAs identified in individual cancer types are present in several cancer types.","Beroukhim, Rameen; Mermel, Craig H.; Porter, Dale; Wei, Guo; Raychaudhuri, Soumya; Donovan, Jerry; Barretina, Jordi; Boehm, Jesse S.; Dobson, Jennifer; Urashima, Mitsuyoshi; Mc Henry, Kevin T.; Pinchback, Reid M.; Ligon, Azra H.; Cho, Yoon-Jae; Haery, Leila; Greulich, Heidi; Reich, Michael; Winckler, Wendy; Lawrence, Michael S.; Weir, Barbara A.; Tanaka, Kumiko E.; Chiang, Derek Y.; Bass, Adam J.; Loo, Alice; Hoffman, Carter; Prensner, John; Liefeld, Ted; Gao, Qing; Yecies, Derek; Signoretti, Sabina; Maher, Elizabeth; Kaye, Frederic J.; Sasaki, Hidefumi; Tepper, Joel E.; Fletcher, Jonathan A.; Tabernero, Josep; Baselga, Jose; Tsao, Ming-Sound; Demichelis, Francesca; Rubin, Mark A.; Janne, Pasi A.; Daly, Mark J.; Nucera, Carmelo; Levine, Ross L.; Ebert, Benjamin L.; Gabriel, Stacey; Rustgi, Anil K.; Antonescu, Cristina R.; Ladanyi, Marc; Letai, Anthony; Garraway, Levi A.; Loda, Massimo; Beer, David G.; True, Lawrence D.; Okamoto, Aikou; Pomeroy, Scott L.; Singer, Samuel; Golub, Todd R.; Lander, Eric S.; Getz, Gad; Sellers, William R.; Meyerson, Matthew","Beroukhim, R; Mermel, CH; Porter, D; Wei, G; Raychaudhuri, S; Donovan, J; Barretina, J; Boehm, JS; Dobson, J; Urashima, M; Mc Henry, KT; Pinchback, RM; Ligon, AH; Cho, YJ; Haery, L; Greulich, H; Reich, M; Winckler, W; Lawrence, MS; Weir, BA; Tanaka, KE; Chiang, DY; Bass, AJ; Loo, A; Hoffman, C; Prensner, J; Liefeld, T; Gao, Q; Yecies, D; Signoretti, S; Maher, E; Kaye, FJ; Sasaki, H; Tepper, JE; Fletcher, JA; Tabernero, J; Baselga, J; Tsao, MS; Demichelis, F; Rubin, MA; Janne, PA; Daly, MJ; Nucera, C; Levine, RL; Ebert, BL; Gabriel, S; Rustgi, AK; Antonescu, CR; Ladanyi, M; Letai, A; Garraway, LA; Loda, M; Beer, DG; True, LD; Okamoto, A; Pomeroy, SL; Singer, S; Golub, TR; Lander, ES; Getz, G; Sellers, WR; Meyerson, M",899.0,"[Beroukhim, Rameen; Mermel, Craig H.; Wei, Guo; Raychaudhuri, Soumya; Barretina, Jordi; Boehm, Jesse S.; Dobson, Jennifer; Pinchback, Reid M.; Haery, Leila; Greulich, Heidi; Reich, Michael; Winckler, Wendy; Lawrence, Michael S.; Weir, Barbara A.; Tanaka, Kumiko E.; Chiang, Derek Y.; Bass, Adam J.; Hoffman, Carter; Prensner, John; Liefeld, Ted; Gao, Qing; Daly, Mark J.; Ebert, Benjamin L.; Gabriel, Stacey; Garraway, Levi A.; Golub, Todd R.; Lander, Eric S.; Getz, Gad; Meyerson, Matthew] Broad Inst MIT & Harvard, Canc Program, Cambridge Ctr 7, Cambridge, MA 02142 USA; [Beroukhim, Rameen; Mermel, Craig H.; Wei, Guo; Raychaudhuri, Soumya; Barretina, Jordi; Boehm, Jesse S.; Dobson, Jennifer; Pinchback, Reid M.; Haery, Leila; Greulich, Heidi; Reich, Michael; Winckler, Wendy; Lawrence, Michael S.; Weir, Barbara A.; Tanaka, Kumiko E.; Chiang, Derek Y.; Bass, Adam J.; Hoffman, Carter; Prensner, John; Liefeld, Ted; Gao, Qing; Daly, Mark J.; Ebert, Benjamin L.; Gabriel, Stacey; Garraway, Levi A.; Golub, Todd R.; Lander, Eric S.; Getz, Gad; Meyerson, Matthew] Broad Inst MIT & Harvard, Med & Populat Genet Grp, Cambridge Ctr 7, Cambridge, MA 02142 USA; [Lander, Eric S.] Whitehead Inst Biomed Res, Cambridge Ctr 9, Cambridge, MA 02142 USA; [Beroukhim, Rameen; Mermel, Craig H.; Barretina, Jordi; Dobson, Jennifer; Haery, Leila; Greulich, Heidi; Weir, Barbara A.; Tanaka, Kumiko E.; Chiang, Derek Y.; Bass, Adam J.; Hoffman, Carter; Prensner, John; Yecies, Derek; Signoretti, Sabina; Janne, Pasi A.; Letai, Anthony; Garraway, Levi A.; Loda, Massimo; Golub, Todd R.; Meyerson, Matthew] Dana Farber Canc Inst, Dept Med Oncol, Boston, MA 02115 USA; [Beroukhim, Rameen; Mermel, Craig H.; Barretina, Jordi; Dobson, Jennifer; Haery, Leila; Greulich, Heidi; Weir, Barbara A.; Tanaka, Kumiko E.; Chiang, Derek Y.; Bass, Adam J.; Hoffman, Carter; Prensner, John; Yecies, Derek; Signoretti, Sabina; Janne, Pasi A.; Letai, Anthony; Garraway, Levi A.; Loda, Massimo; Golub, Todd R.; Meyerson, Matthew] Dana Farber Canc Inst, Dept Pediat Oncol, Boston, MA 02115 USA; [Beroukhim, Rameen; Mermel, Craig H.; Barretina, Jordi; Dobson, Jennifer; Haery, Leila; Greulich, Heidi; Weir, Barbara A.; Tanaka, Kumiko E.; Chiang, Derek Y.; Bass, Adam J.; Hoffman, Carter; Prensner, John; Yecies, Derek; Signoretti, Sabina; Janne, Pasi A.; Letai, Anthony; Garraway, Levi A.; Loda, Massimo; Golub, Todd R.; Meyerson, Matthew] Dana Farber Canc Inst, Dept Canc Biol, Boston, MA 02115 USA; [Beroukhim, Rameen; Mermel, Craig H.; Barretina, Jordi; Dobson, Jennifer; Haery, Leila; Greulich, Heidi; Weir, Barbara A.; Tanaka, Kumiko E.; Chiang, Derek Y.; Bass, Adam J.; Hoffman, Carter; Prensner, John; Yecies, Derek; Signoretti, Sabina; Janne, Pasi A.; Letai, Anthony; Garraway, Levi A.; Loda, Massimo; Golub, Todd R.; Meyerson, Matthew] Dana Farber Canc Inst, Ctr Canc Genome Discovery, Boston, MA 02115 USA; [Beroukhim, Rameen; Raychaudhuri, Soumya; Ligon, Azra H.; Greulich, Heidi; Bass, Adam J.; Signoretti, Sabina; Fletcher, Jonathan A.; Janne, Pasi A.; Ebert, Benjamin L.; Loda, Massimo] Brigham & Womens Hosp, Dept Med, Boston, MA 02115 USA; [Beroukhim, Rameen; Raychaudhuri, Soumya; Ligon, Azra H.; Greulich, Heidi; Bass, Adam J.; Signoretti, Sabina; Fletcher, Jonathan A.; Janne, Pasi A.; Ebert, Benjamin L.; Loda, Massimo] Brigham & Womens Hosp, Dept Pathol, Boston, MA 02115 USA; [Beroukhim, Rameen; Greulich, Heidi; Ebert, Benjamin L.; Lander, Eric S.; Meyerson, Matthew] Harvard Univ, Sch Med, Dept Med, Boston, MA 02115 USA; [Beroukhim, Rameen; Greulich, Heidi; Ebert, Benjamin L.; Lander, Eric S.; Meyerson, Matthew] Harvard Univ, Sch Med, Dept Pathol, Boston, MA 02115 USA; [Beroukhim, Rameen; Greulich, Heidi; Ebert, Benjamin L.; Lander, Eric S.; Meyerson, Matthew] Harvard Univ, Sch Med, Dept Pediat, Boston, MA 02115 USA; [Beroukhim, Rameen; Greulich, Heidi; Ebert, Benjamin L.; Lander, Eric S.; Meyerson, Matthew] Harvard Univ, Sch Med, Dept Syst Biol, Boston, MA 02115 USA; [Cho, Yoon-Jae; Pomeroy, Scott L.] Childrens Hosp, Dept Neurol, Boston, MA 02115 USA; [Nucera, Carmelo] Beth Israel Deaconess Med Ctr, Dept Pathol, Boston, MA 02115 USA; [Porter, Dale; Donovan, Jerry; Mc Henry, Kevin T.; Loo, Alice; Sellers, William R.] Novartis Inst BioMed Res, Cambridge, MA 02139 USA; [Urashima, Mitsuyoshi] Jikei Univ, Sch Med, Div Mol Epidemiol, Minato Ku, Tokyo 1058461, Japan; [Maher, Elizabeth] Univ Texas SW Med Ctr Dallas, Dept Internal Med, Dallas, TX 75390 USA; [Kaye, Frederic J.] NCI, Genet Branch, Ctr Canc Res, Bethesda, MD 20889 USA; [Kaye, Frederic J.] Natl Naval Med Ctr, Bethesda, MD 20889 USA; [Sasaki, Hidefumi] Nagoya City Univ, Sch Med, Dept Surg 2, Nagoya, Aichi 4678601, Japan; [Chiang, Derek Y.; Tepper, Joel E.] Univ N Carolina, Sch Med, Lineberger Comprehens Canc Ctr, Dept Genet & Radiat Oncol, Chapel Hill, NC 27599 USA; [Tabernero, Josep; Baselga, Jose] Vall Hebron Univ Hosp, Res Inst, Vall Hebron Inst Oncol, Med Oncol Program, Barcelona 08035, Spain; [Tabernero, Josep; Baselga, Jose] Autonomous Univ Barcelona, E-08035 Barcelona, Spain; [Tsao, Ming-Sound] Princess Margaret Hosp, Univ Hlth Network, Dept Pathol, Toronto, ON M5G 2M9, Canada; [Tsao, Ming-Sound] Princess Margaret Hosp, Univ Hlth Network, Div Appl Mol Oncol, Toronto, ON M5G 2M9, Canada; [Tsao, Ming-Sound] Ontario Canc Inst, Toronto, ON M5G 2M9, Canada; [Demichelis, Francesca; Rubin, Mark A.] Weill Cornell Med Coll, Dept Pathol & Lab Med, New York, NY 10065 USA; [Daly, Mark J.] Massachusetts Gen Hosp, Richard B Simches Res Ctr, Ctr Human Genet Res, Boston, MA 02114 USA; [Levine, Ross L.; Antonescu, Cristina R.; Ladanyi, Marc; Singer, Samuel] Mem Sloan Kettering Canc Ctr, Dept Med, New York, NY 10065 USA; [Levine, Ross L.; Antonescu, Cristina R.; Ladanyi, Marc; Singer, Samuel] Mem Sloan Kettering Canc Ctr, Dept Pathol, New York, NY 10065 USA; [Rustgi, Anil K.] Univ Penn, Dept Med, GI Div, Philadelphia, PA 19104 USA; [Rustgi, Anil K.] Univ Penn, Dept Genet, Philadelphia, PA 19104 USA; [Rustgi, Anil K.] Univ Penn, Abramson Canc Ctr, Philadelphia, PA 19104 USA; [Beer, David G.] Univ Michigan, Dept Surg, Thorac Surg Sect, Ann Arbor, MI 48109 USA; [True, Lawrence D.] Univ Washington, Med Ctr, Dept Pathol, Seattle, WA 98195 USA; [Okamoto, Aikou] Jikei Univ, Sch Med, Dept Obstet & Gynecol, Minato Ku, Tokyo 1058461, Japan; [Golub, Todd R.] Howard Hughes Med Inst, Chevy Chase, MD 20815 USA",,,11/20/17,,10.1038/nature08822,Article,,lander@broadinstitute.org; gadgetz@broadinstitute.org; william.sellers@novartis.com; matthew_meyerson@dfci.harvard.edu,905,"National Institutes of Health (NIH) [P50CA90578, R01CA109038, R01CA109467, P01CA085859, P01CA 098101, K08CA122833]; Doris Duke Charitable Foundation; Sarah Thomas Monopoli Lung Cancer Research Fund; Seaman Corporation Fund for Lung Cancer Research; Lucas Foundation","This work was supported by grants from the National Institutes of Health (NIH) (Dana-Farber/Harvard Cancer Center and Pacific Northwest Prostate Cancer SPOREs, P50CA90578, R01CA109038, R01CA109467, P01CA085859, P01CA 098101 and K08CA122833), the Doris Duke Charitable Foundation, the Sarah Thomas Monopoli Lung Cancer Research Fund, the Seaman Corporation Fund for Lung Cancer Research, and the Lucas Foundation. Medulloblastoma samples were obtained in collaboration with the Children's Oncology Group. N. Vena provided technical assistance with FISH, and I. Mellinghoff, P. S. Mischel, L. Liau and T. F. Cloughesy provided DNA samples. We thank T. Ried, R. Weinberg and B. Vogelstein for critical review of the manuscript and for comments about its context in the field of cancer genetics.",556HZ,Y,N,ACUTE LYMPHOBLASTIC-LEUKEMIA; EMBRYONIC STEM-CELLS; LUNG-CANCER; CHROMOSOMAL BREAKPOINT; MALIGNANT-MELANOMA; ADAPTER PROTEINS; ARRAY CGH; GENES; GENOME; AMPLIFICATION,7283.0,NATURE,Nature,English,49.0,No,"Chiang, Daisy/0000-0002-8205-4285; Chiang, Derek/0000-0002-1131-6065; Demichelis, Francesca/0000-0002-8266-8631; Tabernero, Josep/0000-0002-2495-8139; Prensner, John/0000-0002-7024-636X; Yecies, Derek/0000-0001-8534-4651; Rubin, Mark/0000-0002-8321-9950; Boehm, Jesse/0000-0002-6795-6336","MACMILLAN BUILDING, 4 CRINAN ST, LONDON N1 9XW, ENGLAND",18-Feb,7.0,LONDON,20164920.0,J,NATURE PUBLISHING GROUP,2010.0,"kaye, frederic/E-2437-2011; Meyerson, Matthew/E-7123-2012; Chiang, Daisy/C-9481-2011; Levine, Rodney/D-9885-2011; Tsao, Ming-Sound/M-3503-2017","Lander, ES (reprint author), Broad Inst MIT & Harvard, Canc Program, Cambridge Ctr 7, Cambridge, MA 02142 USA.",Science & Technology - Other Topics,0028-0836,NATURE,1393.0,The landscape of somatic copy-number alteration across human cancers,15.0,169.0,WOS:000274582700036,366.0,463,Multidisciplinary Sciences,1416,matthew,meyerson,67.0,3338,male,1.0,OOyBQU0AAAAJ,1,"[0, 1474]",na,0,na,0,na,na,0,0
