,Unnamed: 0.1,Unnamed: 0.1.1,AB,AF,AU,BP,C1,CA,CR,DA,DE,DI,DT,EI,EM,EP,FU,FX,GA,HC,HP,ID,IS,J9,JI,LA,NR,OA,OI,PA,PD,PG,PI,PM,PT,PU,PY,RI,RP,SC,SN,SO,TC,TI,U1,U2,UT,Unnamed: 0.1.1.1,VL,WC,Z9,c_fname,c_lname,citedby,count,gender,probability,scholar_id,quantile,range,page_id,has_page,page_id_nature,has_page_nature,page_title,page_title_nature,page_title_match,page_title_match_nature
70,115,449.0,"The bacterial ubiD and ubiX or the homologous fungal fdc1 and pad1 genes have been implicated in the non-oxidative reversible decarboxylation of aromatic substrates, and play a pivotal role in bacterial ubiquinone (also known as coenzyme Q) biosynthesis(1-3) or microbial biodegradation of aromatic compounds(4-6), respectively. Despite biochemical studies on individual gene products, the composition and cofactor requirement of the enzyme responsible for in vivo decarboxylase activity remained unclear(7-9). Here we show that Fdc1 is solely responsible for the reversible decarboxylase activity, and that it requires a new type of cofactor: a prenylated flavin synthesized by the associated UbiX/Pad1(10). Atomic resolution crystal structures reveal that two distinct isomers of the oxidized cofactor can be observed, an isoalloxazine N5-iminium adduct and a N5 secondary ketimine species with markedly altered ring structure, both having azomethine ylide character. Substrate binding positions the dipolarophile enoic acid group directly above the azomethine ylide group. The structure of a covalent inhibitor-cofactor adduct suggests that 1,3-dipolar cycloaddition chemistry supports reversible decarboxylation in these enzymes. Although 1,3-dipolar cycloaddition is commonly used in organic chemistry(11,12), we propose that this presents the first example, to our knowledge, of an enzymatic 1,3-dipolar cycloaddition reaction. Our model for Fdc1/UbiD catalysis offers new routes in alkene hydrocarbon production or aryl (de) carboxylation.","Payne, Karl A. P.; White, Mark D.; Fisher, Karl; Khara, Basile; Bailey, Samuel S.; Parker, David; Rattray, Nicholas J. W.; Trivedi, Drupad K.; Goodacre, Royston; Beveridge, Rebecca; Barran, Perdita; Rigby, Stephen E. J.; Scrutton, Nigel S.; Hay, Sam; Leys, David","Payne, KAP; White, MD; Fisher, K; Khara, B; Bailey, SS; Parker, D; Rattray, NJW; Trivedi, DK; Goodacre, R; Beveridge, R; Barran, P; Rigby, SEJ; Scrutton, NS; Hay, S; Leys, D",497.0,"[Payne, Karl A. P.; White, Mark D.; Fisher, Karl; Khara, Basile; Bailey, Samuel S.; Rattray, Nicholas J. W.; Trivedi, Drupad K.; Goodacre, Royston; Beveridge, Rebecca; Barran, Perdita; Rigby, Stephen E. J.; Scrutton, Nigel S.; Hay, Sam; Leys, David] Univ Manchester, Manchester Inst Biotechnol, Ctr Synthet Biol Fine & Special Chem, Manchester M1 7DN, Lancs, England; [Parker, David] Westhollow Technol Ctr, Innovat Biodomain Shell Int Explorat & Prod, Houston, TX 77082 USA",,,11/19/17,,10.1038/nature14560,Article,1476-4687,david.leys@manchester.ac.uk,+,"BBSRC [BB/K017802/1, BB/M/017702/1]; EU [FP-7 256808]; Royal Society","The main part of this work was supported by BBSRC grants (BB/K017802/1 with Shell and BB/M/017702/1). Early studies were supported by EU grant FP-7 256808 to D.L. and N.S.S. S.H. is a BBSRC David Phillips research fellow. N.S.S. is an EPSRC Established Career Fellow and Royal Society Wolfson Award holder. We thank Diamond Light Source for access to MX beamlines (proposal number MX8997), which helped to contribute to the results presented here. We thank D. Procter (University of Manchester) for discussions. The authors acknowledge the assistance given by IT Services and the use of the Computational Shared Facility at The University of Manchester.",CL2OC,,,ESCHERICHIA-COLI; SORBIC ACID; COENZYME-Q; BIOSYNTHESIS; UBIX; ENZYME; GENES; CARBOXYLASES; ASPERGILLUS; EVOLUTION,7557.0,NATURE,Nature,English,37.0,No,"payne, karl/0000-0002-6331-6374; Hay, Sam/0000-0003-3274-0938; Fisher, Karl/0000-0003-3539-8939; Goodacre, Roy/0000-0003-2230-645X; Barran, Perdita/0000-0002-7720-586X; Trivedi, Drupad/0000-0001-7969-0195","MACMILLAN BUILDING, 4 CRINAN ST, LONDON N1 9XW, ENGLAND",25-Jun,18.0,LONDON,26083754.0,J,NATURE PUBLISHING GROUP,2015.0,"; Hay, Sam/D-5974-2012; Fisher, Karl/A-5956-2013; Goodacre, Roy/J-1600-2012; Trivedi, Drupad/I-3904-2017","Leys, D (reprint author), Univ Manchester, Manchester Inst Biotechnol, Ctr Synthet Biol Fine & Special Chem, 131 Princess St, Manchester M1 7DN, Lancs, England.",Science & Technology - Other Topics,0028-0836,NATURE,37.0,"New cofactor supports alpha,beta-unsaturated acid decarboxylation via 1,3-dipolar cycloaddition",7.0,87.0,WOS:000356782900054,449.0,522,Multidisciplinary Sciences,40,david,leys,5192.0,12593,male,1.0,E_O_xuoAAAAJ,3,"(4126, 9345]",37536870,1,na,0,David Ley,na,0,0
71,93,112.0,"DNA double-strand breaks (DSBs) are highly cytotoxic DNA lesions that trigger non-proteolytic ubiquitylation of adjacent chromatin areas to generate binding sites for DNA repair factors. This depends on the sequential actions of the E3 ubiquitin ligases RNF8 and RNF168 (refs 1-6), and UBC13 (also known as UBE2N), an E2 ubiquitin-conjugating enzyme that specifically generates K63-linked ubiquitin chains(7). Whereas RNF168 is known to catalyse ubiquitylation of H2A-type histones, leading to the recruitment of repair factors such as 53BP1 (refs 8-10), the critical substrates of RNF8 and K63-linked ubiquitylation remain elusive. Here we elucidate how RNF8 and UBC13 promote recruitment of RNF168 and downstream factors to DSB sites in human cells. We establish that UBC13-dependent K63-linked ubiquitylation at DSB sites is predominantly mediated by RNF8 but not RNF168, and that H1-type linker histones, but not core histones, represent major chromatin-associated targets of this modification. The RNF168 module (UDM1) recognizing RNF8-generated ubiquitylations(11) is a high-affinity reader of K63-ubiquitylated H1, mechanistically explaining the essential roles of RNF8 and UBC13 in recruiting RNF168 to DSBs. Consistently, reduced expression or chromatin association of linker histones impair accumulation of K63-linked ubiquitin conjugates and repair factors at DSB-flanking chromatin. These results identify histone H1 as a key target of RNF8-UBC13 in DSB signalling and expand the concept of the histone code(12,13) by showing that posttranslational modifications of linker histones can serve as important marks for recognition by factors involved in genome stability maintenance, and possibly beyond.","Thorslund, Tina; Ripplinger, Anita; Hoffmann, Saskia; Wild, Thomas; Uckelmann, Michael; Villumsen, Bine; Narita, Takeo; Sixma, Titia K.; Choudhary, Chunaram; Bekker-Jensen, Simon; Mailand, Niels","Thorslund, T; Ripplinger, A; Hoffmann, S; Wild, T; Uckelmann, M; Villumsen, B; Narita, T; Sixma, TK; Choudhary, C; Bekker-Jensen, S; Mailand, N",389.0,"[Thorslund, Tina; Ripplinger, Anita; Hoffmann, Saskia; Villumsen, Bine; Bekker-Jensen, Simon; Mailand, Niels] Univ Copenhagen, Fac Hlth & Med Sci, Novo Nordisk Fdn Ctr Prot Res, Ubiquitin Signaling Grp,Prot Signaling Program, Blegdamsvej 3B, DK-2200 Copenhagen, Denmark; [Wild, Thomas; Narita, Takeo; Choudhary, Chunaram] Univ Copenhagen, Fac Hlth & Med Sci, Novo Nordisk Fdn Ctr Prot Res, Prote Program, DK-2200 Copenhagen, Denmark; [Uckelmann, Michael; Sixma, Titia K.] Netherlands Canc Inst, Canc Genom Ctr, Div Biochem, NL-1066 CX Amsterdam, Netherlands",,,11/19/17,,10.1038/nature15401,Article,1476-4687,niels.mailand@cpr.ku.dk,+,"Novo Nordisk Foundation [NNF14CC0001, NNF12OC0002114]; European Research Council; Nederlandse Organisatie voor Wetenschappelijk Onderzoek-Chemische Wetenschappen (NWO-CW); Danish Cancer Society; Danish Council for Independent Research","We thank D. Durocher and M. Bianchi for providing reagents and J. Lukas for helpful discussions. This work was supported by grants from the Novo Nordisk Foundation (grants NNF14CC0001 and NNF12OC0002114), European Research Council, Nederlandse Organisatie voor Wetenschappelijk Onderzoek-Chemische Wetenschappen (NWO-CW), The Danish Cancer Society, and The Danish Council for Independent Research.",CW9ZN,Y,N,DOUBLE-STRAND BREAKS; POLYUBIQUITIN CHAINS; DEPENDENT RESPONSE; CONJUGATING ENZYME; REPAIR PROTEINS; LIGASE; UBIQUITYLATION; LOCALIZATION; PROTEOME; BINDING,7578.0,NATURE,Nature,English,41.0,No,"Thorslund, Tina/0000-0001-9207-0070; choudhary, chunaram/0000-0002-9863-433X","MACMILLAN BUILDING, 4 CRINAN ST, LONDON N1 9XW, ENGLAND",19-Nov,18.0,LONDON,26503038.0,J,NATURE PUBLISHING GROUP,2015.0,,"Mailand, N (reprint author), Univ Copenhagen, Fac Hlth & Med Sci, Novo Nordisk Fdn Ctr Prot Res, Ubiquitin Signaling Grp,Prot Signaling Program, Blegdamsvej 3B, DK-2200 Copenhagen, Denmark.",Science & Technology - Other Topics,0028-0836,NATURE,88.0,Histone H1 couples initiation and amplification of ubiquitin signalling after DNA damage,3.0,26.0,WOS:000365356800059,112.0,527,Multidisciplinary Sciences,91,niels,mailand,9089.0,210,male,0.95,_LQ07v4AAAAJ,3,"(4126, 9345]",na,0,na,0,na,na,0,0
72,210,197.0,"Catabolism may give rise to toxic intermediates that compromise cell vitality, such as epoxide formation in the recently elucidated and apparently universal bacterial coenzyme A (CoA)-dependent degradation of phenylacetic acid(1). This compound is central to the catabolism of a variety of aromatics, such as phenylalanine, lignin-related compounds or environmental contaminants(2,3). The key phenylacetyl-CoA monooxygenase (epoxidase) of the pathway, PaaABCE(1,4,5), is also connected to the production of various primary and secondary metabolites(6-9), as well as to the virulence of certain pathogens(1,10,11). However, the enzyme complex has so far not been investigated in detail. Here we characterize the bacterial multicomponent monooxygenase PaaABCE that, surprisingly, not only transforms phenylacetyl-CoA into its ring-1,2-epoxide, but also mediates the NADPH-dependent removal of the epoxide oxygen, regenerating phenylacetyl-CoA with formation of water. We provide evidence for a catalytic di-iron centre that is probably the key to the unprecedented deoxygenation of an organic compound by an oxygenase. Presumably, the bifunctionality is vital to avoid toxic intracellular epoxide levels if the subsequent catabolic steps are impeded. Our data suggest that detoxification is assisted by two thioesterases (PaaI and PaaY) forming non-reactive breakdown products. Hence, PaaABCE may harbour an intrinsic escape mechanism from its own toxic product and represents the archetype of a bifunctional oxygenase/deoxygenase. Analogous reactions may possibly be catalysed by other di-iron epoxidases.","Teufel, Robin; Friedrich, Thorsten; Fuchs, Georg","Teufel, R; Friedrich, T; Fuchs, G",359.0,"[Teufel, Robin; Fuchs, Georg] Univ Freiburg, Fak Biol, D-79104 Freiburg, Germany; [Friedrich, Thorsten] Univ Freiburg, Fak Chem, D-79104 Freiburg, Germany",,,11/20/17,,10.1038/nature10862,Article,,georg.fuchs@biologie.uni-freiburg.de,U161,Deutsche Forschungsgemeinschaft,"We thank Deutsche Forschungsgemeinschaft for support; V. Mascaraque, G. Heijman and W. Ismail for their contributions in the initial stage of this work; M. Voss, M. Weiss, I. Sachelaru and T. Spatzal for technical assistance; M. Muller and V. Brecht for mass spectrometry analysis; and I. Berg and H. Heider for critical comments.",908HP,,,ESCHERICHIA-COLI; PHENYLACETIC ACID; METHANE MONOOXYGENASE; BURKHOLDERIA-CENOCEPACIA; CATABOLIC PATHWAY; DIAMOND CORE; PROTEINS; COENZYME; CYCLE; METABOLISM,7389.0,NATURE,Nature,English,41.0,No,,"MACMILLAN BUILDING, 4 CRINAN ST, LONDON N1 9XW, ENGLAND",15-Mar,7.0,LONDON,22398448.0,J,NATURE PUBLISHING GROUP,2012.0,,"Fuchs, G (reprint author), Univ Freiburg, Fak Biol, Schanzlestr 1, D-79104 Freiburg, Germany.",Science & Technology - Other Topics,0028-0836,NATURE,21.0,An oxygenase that forms and deoxygenates toxic epoxide,1.0,39.0,WOS:000301481800055,197.0,483,Multidisciplinary Sciences,22,georg,fuchs,8759.0,64,male,1.0,KtbGUvMAAAAJ,3,"(4126, 9345]",33661964,1,571418,1,Georg Fuchs von Rügheim,Georg Fuchs von Rügheim,1,1
73,56,409.0,"There exists controversy over the nature of haematopoietic progenitors of T cells. Most T cells develop in the thymus, but the lineage potential of thymus-colonizing progenitors is unknown. One approach to resolving this question is to determine the lineage potentials of the earliest thymic progenitors (ETPs). Previous work has shown that ETPs possess T and natural killer lymphoid potentials, and rare subsets of ETPs also possess B lymphoid potential(1), suggesting an origin from lymphoid-restricted progenitor cells. However, whether ETPs also possess myeloid potential is unknown. Here we show that nearly all ETPs in adult mice possess both T and myeloid potential in clonal assays. The existence of progenitors possessing T and myeloid potential within the thymus is incompatible with the current dominant model of haematopoiesis, in which T cells are proposed to arise from lymphoid-restricted progenitors(2). Our results indicate that alternative models for lineage commitment during haematopoiesis must be considered.","Bell, J. Jeremiah; Bhandoola, Avinash","Bell, JJ; Bhandoola, A",764.0,"[Bell, J. Jeremiah; Bhandoola, Avinash] Univ Penn, Sch Med, Dept Pathol & Lab Med, Philadelphia, PA 19104 USA",,,11/20/17,,10.1038/nature06840,Article,,bhandooa@mail.med.upenn.edu,U9,,,285QY,,,COMMON LYMPHOID PROGENITORS; HEMATOPOIETIC STEM-CELLS; BONE-MARROW; DENDRITIC CELLS; IDENTIFICATION; PRECURSOR; DIFFERENTIATION; TRANSCRIPTION; MACROPHAGES; COMMITMENT,7188.0,NATURE,Nature,English,29.0,No,,"MACMILLAN BUILDING, 4 CRINAN ST, LONDON N1 9XW, ENGLAND",10-Apr,5.0,LONDON,18401411.0,J,NATURE PUBLISHING GROUP,2008.0,,"Bhandoola, A (reprint author), Univ Penn, Sch Med, Dept Pathol & Lab Med, Philadelphia, PA 19104 USA.",Science & Technology - Other Topics,0028-0836,NATURE,237.0,The earliest thymic progenitors for T cells possess myeloid lineage potential,0.0,9.0,WOS:000254792500048,409.0,452,Multidisciplinary Sciences,248,avinash,bhandoola,7786.0,119,male,1.0,9UUuCxgAAAAJ,3,"(4126, 9345]",7285133,1,7285133,1,Lymphopoiesis,Lymphopoiesis,0,0
74,69,277.0,"An optical cavity enhances the interaction between atoms and light, and the rate of coherent atom-photon coupling can be made larger than all decoherence rates of the system. For single atoms, this 'strong coupling regime' of cavity quantum electrodynamics(1,2) has been the subject of many experimental advances. Efforts have been made to control the coupling rate by trapping(3,4) the atom and cooling(5,6) it towards the motional ground state; the latter has been achieved in one dimension so far(5). For systems of many atoms, the three-dimensional ground state of motion is routinely achieved(7) in atomic Bose-Einstein condensates (BECs). Although experiments combining BECs and optical cavities have been reported recently(8,9), coupling BECs to cavities that are in the strong-coupling regime for single atoms has remained an elusive goal. Here we report such an experiment, made possible by combining a fibre-based cavity(10) with atom-chip technology(11). This enables single-atom cavity quantum electrodynamics experiments with a simplified set-up and realizes the situation of many atoms in a cavity, each of which is identically and strongly coupled to the cavity mode(12). Moreover, the BEC can be positioned deterministically anywhere within the cavity and localized entirely within a single antinode of the standing-wave cavity field; we demonstrate that this gives rise to a controlled, tunable coupling rate. We study the heating rate caused by a cavity transmission measurement as a function of the coupling rate and find no measurable heating for strongly coupled BECs. The spectrum of the coupled atoms-cavity system, which we map out over a wide range of atom numbers and cavity-atom detunings, shows vacuum Rabi splittings exceeding 20 gigahertz, as well as an unpredicted additional splitting, which we attribute to the atomic hyperfine structure. We anticipate that the system will be suitable as a light-matter quantum interface for quantum information(13).","Colombe, Yves; Steinmetz, Tilo; Dubois, Guilhem; Linke, Felix; Hunger, David; Reichel, Jakob","Colombe, Y; Steinmetz, T; Dubois, G; Linke, F; Hunger, D; Reichel, J",272.0,"Univ Paris 06, CNRS, ENS, Lab Kastler Brossel, F-75005 Paris, France; LMU, Max Planck Inst Quantenopt, D-80799 Munich, Germany",,,11/20/17,,10.1038/nature06331,Article,,jakob.reichel@ens.fr,U9,,,228RC,Y,N,MAGNETIC MICROTRAPS; ULTRACOLD ATOMS; SINGLE ATOMS; LATTICES; PHOTONS; TRAPS,7167.0,NATURE,Nature,English,34.0,No,"Hunger, David/0000-0001-6156-6145; Reichel, Jakob/0000-0003-3420-4178","MACMILLAN BUILDING, 4 CRINAN ST, LONDON N1 9XW, ENGLAND",8-Nov,6.0,LONDON,17994094.0,J,NATURE PUBLISHING GROUP,2007.0,"Hunger, David/A-7673-2012","Reichel, J (reprint author), Univ Paris 06, CNRS, ENS, Lab Kastler Brossel, 24 Rue Lhomond, F-75005 Paris, France.",Science & Technology - Other Topics,0028-0836,NATURE,434.0,Strong atom-field coupling for Bose-Einstein condensates in an optical cavity on a chip,4.0,53.0,WOS:000250746200055,277.0,450,Multidisciplinary Sciences,440,jakob,reichel,8184.0,148,male,0.99,EOrqDVAAAAAJ,3,"(4126, 9345]",38684068,1,174030,1,Jadup and Boel,Jadup and Boel,0,0
75,207,173.0,"The Cretaceous-Paleogene mass extinction approximately 66 million years ago is conventionally thought to have been a turning point in mammalian evolution(1,2). Prior to that event and for the first two-thirds of their evolutionary history, mammals were mostly confined to roles as generalized, small-bodied, nocturnal insectivores(3), presumably under selection pressures from dinosaurs(4). Release from these pressures, by extinction of non-avian dinosaurs at the Cretaceous-Paleogene boundary, triggered ecological diversification of mammals(1,2). Although recent individual fossil discoveries have shown that some mammalian lineages diversified ecologically during the Mesozoic era(5), comprehensive ecological analyses of mammalian groups crossing the Cretaceous-Paleogene boundary are lacking. Such analyses are needed because diversification analyses of living taxa(6,7) allow only indirect inferences of past ecosystems. Here we show that in arguably the most evolutionarily successful clade of Mesozoic mammals, the Multituberculata, an adaptive radiation began at least 20 million years before the extinction of non-avian dinosaurs and continued across the Cretaceous-Paleogene boundary. Disparity in dental complexity, which relates to the range of diets, rose sharply in step with generic richness and disparity in body size. Moreover, maximum dental complexity and body size demonstrate an adaptive shift towards increased herbivory. This dietary expansion tracked the ecological rise of angiosperms(8) and suggests that the resources that were available to multituberculates were relatively unaffected by the Cretaceous-Paleogene mass extinction. Taken together, our results indicate that mammals were able to take advantage of new ecological opportunities in the Mesozoic and that at least some of these opportunities persisted through the Cretaceous-Paleogene mass extinction. Similar broad-scale ecomorphological inventories of other radiations may help to constrain the possible causes of mass extinctions(9,10).","Wilson, Gregory P.; Evans, Alistair R.; Corfe, Ian J.; Smits, Peter D.; Fortelius, Mikael; Jernvall, Jukka","Wilson, GP; Evans, AR; Corfe, IJ; Smits, PD; Fortelius, M; Jernvall, J",457.0,"[Wilson, Gregory P.; Smits, Peter D.] Univ Washington, Dept Biol, Seattle, WA 98195 USA; [Evans, Alistair R.; Smits, Peter D.] Monash Univ, Sch Biol Sci, Clayton, Vic 3800, Australia; [Corfe, Ian J.; Fortelius, Mikael; Jernvall, Jukka] Univ Helsinki, Inst Biotechnol, Dev Biol Program, FIN-00014 Helsinki, Finland; [Fortelius, Mikael] Univ Helsinki, Dept Geosci & Geog, FIN-00014 Helsinki, Finland",,,11/20/17,,10.1038/nature10880,Article,,gpwilson@u.washington.edu,460,National Science Foundation; Denver Museum; University of Washington; Australian Research Council; Monash University; Academy of Finland; EU SYNTHESYS [GB-TAF-4779],"We thank museums, institutions and individuals that made specimens available for this study (full list is available in Supplementary Information). Funding was provided by the National Science Foundation, Denver Museum, the University of Washington (G. P. W. and P. D. S.), the Australian Research Council, Monash University (A. R. E.), the Academy of Finland (A. R. E., M. F. and J.J.) and the EU SYNTHESYS program (project GB-TAF-4779) (I.J.C.).",912CC,,,EVOLUTION; DIVERSITY; DIVERSIFICATION; ANGIOSPERMS; RECORD,7390.0,NATURE,Nature,English,29.0,No,"Evans, Alistair/0000-0002-4078-4693; Smits, Peter D/0000-0003-4074-1447; Corfe, Ian/0000-0002-1824-755X; Fortelius, Mikael/0000-0002-4851-783X","MACMILLAN BUILDING, 4 CRINAN ST, LONDON N1 9XW, ENGLAND",22-Mar,4.0,LONDON,22419156.0,J,NATURE PUBLISHING GROUP,2012.0,"Wilson, Gregory/A-2363-2009; Evans, Alistair/D-4239-2011","Wilson, GP (reprint author), Univ Washington, Dept Biol, Seattle, WA 98195 USA.",Science & Technology - Other Topics,0028-0836,NATURE,92.0,Adaptive radiation of multituberculate mammals before the extinction of dinosaurs,2.0,124.0,WOS:000301771200041,173.0,483,Multidisciplinary Sciences,92,jukka,jernvall,8085.0,62,male,1.0,o2NAG70AAAAJ,3,"(4126, 9345]",28649402,1,28649402,1,Jukka Jernvall,Jukka Jernvall,1,1
