,Unnamed: 0.1,Unnamed: 0.1.1,AB,AF,AU,BP,C1,CA,CR,DA,DE,DI,DT,EI,EM,EP,FU,FX,GA,HC,HP,ID,IS,J9,JI,LA,NR,OA,OI,PA,PD,PG,PI,PM,PT,PU,PY,RI,RP,SC,SN,SO,TC,TI,U1,U2,UT,Unnamed: 0.1.1.1,VL,WC,Z9,c_fname,c_lname,citedby,count,gender,probability,scholar_id,quantile,range,page_id,has_page,page_id_nature,has_page_nature,page_title,page_title_nature,page_title_match,page_title_match_nature
37,66,169.0,"Over a century of research into the origin of turbulence in wall-bounded shear flows has resulted in a puzzling picture in which turbulence appears in a variety of different states competing with laminar background flow(1-6). At moderate flow speeds, turbulence is confined to localized patches; it is only at higher speeds that the entire flow becomes turbulent. The origin of the different states encountered during this transition, the front dynamics of the turbulent regions and the transformation to full turbulence have yet to be explained. By combining experiments, theory and computer simulations, here we uncover a bifurcation scenario that explains the transformation to fully turbulent pipe flow and describe the front dynamics of the different states encountered in the process. Key to resolving this problem is the interpretation of the flow as a bistable system with nonlinear propagation (advection) of turbulent fronts. These findings bridge the gap between our understanding of the onset of turbulence(7) and fully turbulent flows(8,9).","Barkley, Dwight; Song, Baofang; Mukund, Vasudevan; Lemoult, Gregoire; Avila, Marc; Hof, Bjoern","Barkley, D; Song, BF; Mukund, V; Lemoult, G; Avila, M; Hof, B",550.0,"[Barkley, Dwight] Univ Warwick, Inst Math, Coventry CV4 7AL, W Midlands, England; [Song, Baofang; Mukund, Vasudevan; Lemoult, Gregoire; Hof, Bjoern] IST Austria, A-3400 Klosterneuburg, Austria; [Song, Baofang] Max Planck Inst Dynam & Self Org, D-37073 Gottingen, Germany; [Song, Baofang] Univ Erlangen Nurnberg, Inst Multiscale Simulat, D-91052 Erlangen, Germany; [Avila, Marc] Univ Erlangen Nurnberg, Inst Fluid Mech, D-91058 Erlangen, Germany",,,11/19/17,,10.1038/nature15701,Article,1476-4687,D.Barkley@warwick.ac.uk; bhof@ist.ac.at,U191,Deutsche Forschungsgemeinschaft [FOR 1182]; European Research Council under the European Union [306589]; Chinese State Scholarship Fund [2010629145]; International Max Planck Research School for the Physics of Biological and Complex Systems; Gottingen Graduate School for Neurosciences and Molecular Biosciences; Julich Supercomputing Centre [HGU16],"We thank A. P. Willis for sharing his hybrid spectral finite-difference code, and X. Tu for helping to set up and test the experiment. We acknowledge the Deutsche Forschungsgemeinschaft (Project No. FOR 1182), and the European Research Council under the European Union's Seventh Framework Programme (FP/2007-2013)/ERC Grant Agreement 306589 for financial support. B.S. acknowledges financial support from the Chinese State Scholarship Fund under grant number 2010629145. B.S. acknowledges support from the International Max Planck Research School for the Physics of Biological and Complex Systems and the Gottingen Graduate School for Neurosciences and Molecular Biosciences. We acknowledge computing resources from GWDG (Gesellschaft fur wissenschaftliche Datenverarbeitung Gottingen) and the Julich Supercomputing Centre (grant HGU16) where the simulations were performed.",CV1NX,,,PLANE COUETTE-FLOW; TRANSITIONAL PIPE-FLOW; INTERMITTENCY; STATES; SPOTS; SLUGS; PUFFS,7574.0,NATURE,Nature,English,36.0,No,"Barkley, Dwight/0000-0003-4317-3705; Avila, Marc/0000-0001-5988-1090","MACMILLAN BUILDING, 4 CRINAN ST, LONDON N1 9XW, ENGLAND",22-Oct,14.0,LONDON,26490621.0,J,NATURE PUBLISHING GROUP,2015.0,"Barkley, Dwight/F-8218-2014; Avila, Marc/A-1263-2009","Barkley, D (reprint author), Univ Warwick, Inst Math, Coventry CV4 7AL, W Midlands, England.",Science & Technology - Other Topics,0028-0836,NATURE,20.0,The rise of fully turbulent flow,5.0,48.0,WOS:000364026100045,169.0,526,Multidisciplinary Sciences,20,bjoern,hof,2553.0,14,male,1.0,tytU38QAAAAJ,2,"(1474, 4126]",4601,1,na,0,Björn Borg,na,0,0
38,69,196.0,"HIV-1 Nef, a protein important for the development of AIDS, has well-characterized effects on host membrane trafficking and receptor downregulation. By an unidentified mechanism, Nef increases the intrinsic infectivity of HIV-1 virions in a host-cell-dependent manner. Here we identify the host transmembrane protein SERINC5, and to a lesser extent SERINC3, as a potent inhibitor of HIV-1 particle infectivity that is counteracted by Nef. SERINC5 localizes to the plasma membrane, where it is efficiently incorporated into budding HIV-1 virions and impairs subsequent virion penetration of susceptible target cells. Nef redirects SERINC5 to a Rab7-positive endosomal compartment and thereby excludes it from HIV-1 particles. The ability to counteract SERINC5 was conserved in Nef encoded by diverse primate immunodeficiency viruses, as well as in the structurally unrelated glycosylated Gag from murine leukaemia virus. These examples of functional conservation and convergent evolution emphasize the fundamental importance of SERINC5 as a potent anti-retroviral factor.","Rosa, Annachiara; Chande, Ajit; Ziglio, Serena; De Sanctis, Veronica; Bertorelli, Roberto; Goh, Shih Lin; McCauley, Sean M.; Nowosielska, Anetta; Antonarakis, Stylianos E.; Luban, Jeremy; Santoni, Federico Andrea; Pizzato, Massimo","Rosa, A; Chande, A; Ziglio, S; De Sanctis, V; Bertorelli, R; Goh, SL; McCauley, SM; Nowosielska, A; Antonarakis, SE; Luban, J; Santoni, FA; Pizzato, M",212.0,"[Rosa, Annachiara; Chande, Ajit; Ziglio, Serena; Pizzato, Massimo] Univ Trent, Ctr Integrat Biol, I-38123 Trento, Italy; [De Sanctis, Veronica; Bertorelli, Roberto] Univ Trent, Lab Biomol Sequence & Struct Anal Hlth, NGS Facil, I-38123 Trento, Italy; [Goh, Shih Lin; McCauley, Sean M.; Nowosielska, Anetta; Luban, Jeremy] Univ Massachusetts, Sch Med, Program Mol Med, Worcester, MA 01605 USA; [Antonarakis, Stylianos E.; Santoni, Federico Andrea] Univ Geneva, Dept Genet Med & Dev, CH-1211 Geneva, Switzerland; [Antonarakis, Stylianos E.] IGE3 Inst Genet & Genom Geneva, CH-1211 Geneva, Switzerland",,,11/19/17,,10.1038/nature15399,Article,1476-4687,massimo.pizzato@unitn.it,+,University of Trento; FP7 Marie Curie Career Integration grant [322130]; Caritro 'Ricerca Biomedica' grant [2013.0248]; National Institute of Health [DP1DA034990]; European Research Council [249968],"We thank the Centre for AIDS Reagents, NIBSC, and NIH AIDS Research and Reference Reagent Program, Division of AIDS, for cell lines, plasmids and antibodies. We thank V. Adami and the CIBIO high-throughput screening and the Advanced Imaging facilities staff for technical assistance, G. De Silvestro, G. Mattiuzzo, C. Reinhard and L. Conti for reagents, G. Melikian, S. Basmaciogullari, P. Cherepanov, O. Fackler, N. Segata, F. Demichelis, A. Marcello, T. Fedrizzi and A. Helander for critical discussions. This work was supported by the Biotechnology Program of University of Trento, FP7 Marie Curie Career Integration grant number 322130 and Caritro 'Ricerca Biomedica' grant number 2013.0248 to M.P., National Institute of Health grant DP1DA034990 to J.L. and European Research Council grant 249968 to S.E.A.",CS9GV,Y,N,OPTIMAL VIRAL INFECTIVITY; VIRUS TYPE-1 INFECTIVITY; CD4 DOWN-REGULATION; T-CELL-ACTIVATION; IMMUNODEFICIENCY-VIRUS; SYNCYTIUM FORMATION; GLYCOSYLATED-GAG; PORE EXPANSION; FUSION; GENE,7572.0,NATURE,Nature,English,50.0,No,"Chande, Ajit/0000-0003-2210-5180; Antonarakis, Stylianos/0000-0001-8907-5823","MACMILLAN BUILDING, 4 CRINAN ST, LONDON N1 9XW, ENGLAND",8-Oct,13.0,LONDON,26416734.0,J,NATURE PUBLISHING GROUP,2015.0,,"Pizzato, M (reprint author), Univ Trent, Ctr Integrat Biol, I-38123 Trento, Italy.",Science & Technology - Other Topics,0028-0836,NATURE,60.0,HIV-1 Nef promotes infection by excluding SERINC5 from virion incorporation,6.0,23.0,WOS:000362399000038,196.0,526,Multidisciplinary Sciences,63,massimo,pizzato,1784.0,492,male,1.0,Jr9fxZQAAAAJ,2,"(1474, 4126]",na,0,na,0,na,na,0,0
39,86,146.0,"Bone-resorbing osteoclasts significantly contribute to osteoporosis and bone metastases of cancer(1-3). MicroRNAs play important roles in physiology and disease(4,5), and present tremendous therapeutic potential(6). Nonetheless, how microRNAs regulate skeletal biology is underexplored. Here we identify miR-34a as a novel and critical suppressor of osteoclastogenesis, bone resorption and the bone metastatic niche. miR-34a is downregulated during osteoclast differentiation. Osteoclastic miR-34a-overexpressing transgenic mice exhibit lower bone resorption and higher bone mass. Conversely, miR-34a knockout and heterozygous mice exhibit elevated bone resorption and reduced bone mass. Consequently, ovariectomy-induced osteoporosis, as well as bone metastasis of breast and skin cancers, are diminished in osteoclastic miR-34a transgenic mice, and can be effectively attenuated by miR-34a nanoparticle treatment. Mechanistically, we identify transforming growth factor-beta-induced factor 2 (Tgif2) as an essential direct miR-34a target that is pro-osteoclastogenic. Tgif2 deletion reduces bone resorption and abolishes miR-34a regulation. Together, using mouse genetic, pharmacological and disease models, we reveal miR-34a as a key osteoclast suppressor and a potential therapeutic strategy to confer skeletal protection and ameliorate bone metastasis of cancers.","Krzeszinski, Jing Y.; Wei, Wei; HoangDinh Huynh; Jin, Zixue; Wang, Xunde; Chang, Tsung-Cheng; Xie, Xian-Jin; He, Lin; Mangala, Lingegowda S.; Lopez-Berestein, Gabriel; Sood, Anil K.; Mendell, Joshua T.; Wan, Yihong","Krzeszinski, JY; Wei, W; Huynh, H; Jin, ZX; Wang, XD; Chang, TC; Xie, XJ; He, L; Mangala, LS; Lopez-Berestein, G; Sood, AK; Mendell, JT; Wan, YH",431.0,"[Krzeszinski, Jing Y.; Wei, Wei; HoangDinh Huynh; Jin, Zixue; Wang, Xunde; Wan, Yihong] Univ Texas SW Med Ctr Dallas, Dept Pharmacol, Dallas, TX 75390 USA; [Chang, Tsung-Cheng; Mendell, Joshua T.] Univ Texas SW Med Ctr Dallas, Dept Mol Biol, Dallas, TX 75390 USA; [Xie, Xian-Jin; Mendell, Joshua T.; Wan, Yihong] Univ Texas SW Med Ctr Dallas, Simmons Canc Ctr, Dallas, TX 75390 USA; [Xie, Xian-Jin] Univ Texas SW Med Ctr Dallas, Dept Clin Sci, Dallas, TX 75390 USA; [He, Lin] Univ Calif Berkeley, Mol & Cell Biol Dept, Div Cellular & Dev Biol, Berkeley, CA 94705 USA; [Mangala, Lingegowda S.; Sood, Anil K.] Univ Texas MD Anderson Canc Ctr, Dept Gynecol Oncol & Reprod Med, Houston, TX 77030 USA; [Mangala, Lingegowda S.; Lopez-Berestein, Gabriel; Sood, Anil K.] Univ Texas MD Anderson Canc Ctr, Ctr RNA Interference & Noncoding RNA, Houston, TX 77030 USA; [Lopez-Berestein, Gabriel] Univ Texas MD Anderson Canc Ctr, Dept Expt Therapeut, Houston, TX 77030 USA; [Sood, Anil K.] Univ Texas MD Anderson Canc Ctr, Dept Canc Biol, Houston, TX 77030 USA",,,11/20/17,,10.1038/nature13375,Article,1476-4687,yihong.wan@utsouthwestern.edu,U460,"CPRIT [RP130145, R1008]; DOD [BC122877]; National Institutes of Health [R01 DK089113, R01 CA120185, P01 CA134292, U54 CA151668, UH2 TR000943, R01 CA139067]; Welch Foundation [I-1751]; University of Texas Southwestern Endowed Scholar Startup Fund; Harold C. Simmons Cancer Center through an NCI Cancer Center Support Grant [1P30 CA142543]; Department of Radiology; National Institutes of Health American Recovery and Reinvestment Act stimulus funds [1S10RR02564801]","We thank University of Texas Southwestern transgenic core and small animal imaging core for their assistance in our studies; P. Dechow, J. Feng and C. Qin for assistance with micro-computed tomography, histomorphometry and X-ray analysis; A. Ventura for miR-34abc triple knockout mice; D. Wotton for Tgif2-KO mice; H. Kronenberg for Osx-CreER mice; Y. Mishina for CAG-Z-EGFP vector. Y. Wan is a Virginia Murchison Linthicum Scholar in Medical Research. This work was in part supported by CPRIT (RP130145, Y.W.; R1008, J.M.), DOD (BC122877, Y.W.), National Institutes of Health (R01 DK089113, Y.W.; R01 CA120185 and P01 CA134292, J.M.; U54 CA151668 and UH2 TR000943, AS.; R01 CA139067, L.H.), The Welch Foundation (I-1751, Y.W.) and a University of Texas Southwestern Endowed Scholar Startup Fund (Y.W.). The University of Texas Southwestern Small Animal Imaging Resource is supported in part by the Harold C. Simmons Cancer Center through an NCI Cancer Center Support Grant (1P30 CA142543) and The Department of Radiology. The VisualSonics Vevo 770 was purchased with National Institutes of Health American Recovery and Reinvestment Act stimulus funds 1S10RR02564801.",AN8GC,,,CANCER; MICRORNAS; RECEPTOR; MICE; DIFFERENTIATION; REPRESSION; MOUSE,7515.0,NATURE,Nature,English,31.0,No,,"MACMILLAN BUILDING, 4 CRINAN ST, LONDON N1 9XW, ENGLAND",28-Aug,17.0,LONDON,25043055.0,J,NATURE PUBLISHING GROUP,2014.0,,"Wan, YH (reprint author), Univ Texas SW Med Ctr Dallas, Dept Pharmacol, Dallas, TX 75390 USA.",Science & Technology - Other Topics,0028-0836,NATURE,111.0,miR-34a blocks osteoporosis and bone metastasis by inhibiting osteoclastogenesis and Tgif2,8.0,72.0,WOS:000340840600034,146.0,512,Multidisciplinary Sciences,118,yihong,wan,2576.0,1,male,1.0,zfNfm8IAAAAJ,2,"(1474, 4126]",52138911,1,14316449,1,Mute Wife,Mute Wife,0,0
40,117,120.0,"The recent discovery of small paravian theropod dinosaurs with well-preserved feathers in the Middle-Late Jurassic Tiaojishan Formation of Liaoning Province (northeastern China)(1-4) has challenged the pivotal position of Archaeopteryx(3,4), regarded from its discovery to be the most basal bird. Removing Archaeopteryx from the base of Avialae to nest within Deinonychosauria implies that typical bird flight, powered by the forelimbs only, either evolved at least twice, or was subsequently lost or modified in some deinonychosaurians(3,5). Here we describe the complete skeleton of a new paravian from the Tiaojishan Formation of Liaoning Province, China. Including this new taxon in a comprehensive phylogenetic analysis for basal Paraves does the following: (1) it recovers it as the basal-most avialan; (2) it confirms the avialan status of Archaeopteryx; (3) it places Troodontidae as the sister-group to Avialae; (4) it supports a single origin of powered flight within Paraves; and (5) it implies that the early diversification of Paraves and Avialae took place in the Middle-Late Jurassic period.","Godefroit, Pascal; Cau, Andrea; Hu Dong-Yu; Escuillie, Franois; Wu Wenhao; Dyke, Gareth","Godefroit, P; Cau, A; Hu, DY; Escuillie, F; Wu, WH; Dyke, G",359.0,"[Godefroit, Pascal] Royal Belgian Inst Nat Sci, Operat Direct Earth & Hist Life, B-1000 Brussels, Belgium; [Cau, Andrea] Museo Geol Giovanni Capellini, I-40127 Bologna, Italy; [Hu Dong-Yu] Shenyang Normal Univ, Inst Paleontol, Shenyang 110034, Peoples R China; [Hu Dong-Yu] NE Normal Univ, Minist Educ, Key Lab Vegetat Ecol, Changchun 130024, Peoples R China; [Escuillie, Franois] Eldonia, F-3800 Gannat, France; [Wu Wenhao] Jilin Univ, Res Ctr Paleontol & Stratig, Changchun 130021, Peoples R China; [Dyke, Gareth] Univ Southampton, Natl Oceanog Ctr, Southampton SO14 3ZH, Hants, England",,,11/20/17,,10.1038/nature12168,Article,,Pascal.Godefroit@naturalsciences.be,362,SPP Politique scientifique (Belgium) [BL/36/62]; Key Laboratory of Evolutionary Systematics of Vertebrates [CAS2011LESV011]; National Natural Science Foundation of China [41172026],"We thank B. Pohl for making fossils available for study, S. Ge for help and comments on the manuscript and T. Hubin for photographs. This study was supported by a grant (BL/36/62) to P. G. from the SPP Politique scientifique (Belgium). D. H. was supported by the Key Laboratory of Evolutionary Systematics of Vertebrates (CAS2011LESV011) and by the National Natural Science Foundation of China (41172026).",166XI,,,LONG FEATHERS; ARCHAEOPTERYX; THEROPOD; EVOLUTION; MANIRAPTORAN; METATARSUS; FLIGHT,7454.0,NATURE,Nature,English,28.0,No,"Dyke, Gareth/0000-0002-8390-7817","MACMILLAN BUILDING, 4 CRINAN ST, LONDON N1 9XW, ENGLAND",20-Jun,4.0,LONDON,23719374.0,J,NATURE PUBLISHING GROUP,2013.0,,"Godefroit, P (reprint author), Royal Belgian Inst Nat Sci, Operat Direct Earth & Hist Life, Rue Vautier 29, B-1000 Brussels, Belgium.",Science & Technology - Other Topics,0028-0836,NATURE,57.0,A Jurassic avialan dinosaur from China resolves the early phylogenetic history of birds,5.0,214.0,WOS:000320592900039,120.0,498,Multidisciplinary Sciences,60,gareth,dyke,3751.0,475,male,0.97,7hNzBe8AAAAJ,2,"(1474, 4126]",31508756,1,31508756,1,Gareth J. Dyke,Gareth J. Dyke,1,1
41,126,481.0,"Cellulose, the most abundant biological macromolecule, is an extracellular, linear polymer of glucose molecules. It represents an essential component of plant cell walls but is also found in algae and bacteria. In bacteria, cellulose production frequently correlates with the formation of biofilms, a sessile, multicellular growth form. Cellulose synthesis and transport across the inner bacterial membrane is mediated by a complex of the membrane-integrated catalytic BcsA subunit and the membrane-anchored, periplasmic BcsB protein. Here we present the crystal structure of a complex of BcsA and BcsB from Rhodobacter sphaeroides containing a translocating polysaccharide. The structure of the BcsA-BcsB translocation intermediate reveals the architecture of the cellulose synthase, demonstrates how BcsA forms a cellulose-conducting channel, and suggests a model for the coupling of cellulose synthesis and translocation in which the nascent polysaccharide is extended by one glucose molecule at a time.","Morgan, Jacob L. W.; Strumillo, Joanna; Zimmer, Jochen","Morgan, JLW; Strumillo, J; Zimmer, J",181.0,"[Morgan, Jacob L. W.; Strumillo, Joanna; Zimmer, Jochen] Univ Virginia, Dept Mol Physiol & Biol Phys, Ctr Membrane Biol, Charlottesville, VA 22908 USA; [Strumillo, Joanna] Univ Lodz, Fac Biol & Environm Protect, PL-90231 Lodz, Poland",,,11/20/17,,10.1038/nature11744,Article,,jochen_zimmer@virginia.edu,U192,"US Department of Energy, Office of Science, Office of Basic Energy Sciences [DE-AC02-06CH11357, W-31-109-Eng-38]; National Cancer Institute [Y1-CO-1020]; National Institute of General Medical Sciences [Y1-GM-1104]; Department of Energy [DE-FG02-09ER-20097]; NIH [1R01GM101001]; University of Virginia; University of Virginia School of Medicine","We are grateful to G. Murshudov for advice on Refmac refinement and U. and Z. Derewenda for discussions. We thank L. Tamm, M. Wiener, A. Walling and T. Rapoport for critical comments on the manuscript. X-ray diffraction data were collected at GM/CA- and Southeast Regional-Collaborative Access Team beamlines at the Advanced Photon Source (APS), Argonne National Laboratory. Use of the APS was supported by the US Department of Energy, Office of Science, Office of Basic Energy Sciences, contract no. DE-AC02-06CH11357 and W-31-109-Eng-38. GM/CA at APS has been funded in whole or in part with funds from the National Cancer Institute (Y1-CO-1020) and the National Institute of General Medical Sciences (Y1-GM-1104). The University of Georgia CCRC is supported by the Department of Energy funded Center for Plant and Microbial Complex Carbohydrates (DE-FG02-09ER-20097). J.L.W.M. is partially supported by a Peach Fellowship, University of Virginia. J.Z. is support by NIH grant 1R01GM101001 and start-up funds from the University of Virginia School of Medicine.",066YY,Y,N,C-DI-GMP; ACETOBACTER-XYLINUM; BACTERIAL CELLULOSE; STRUCTURAL BASIS; IN-VITRO; PROTEIN; BIOSYNTHESIS; SYNTHASE; SYSTEM; GLYCOSYLTRANSFERASES,7431.0,NATURE,Nature,English,50.0,No,,"MACMILLAN BUILDING, 4 CRINAN ST, LONDON N1 9XW, ENGLAND",10-Jan,7.0,LONDON,23222542.0,J,NATURE PUBLISHING GROUP,2013.0,,"Zimmer, J (reprint author), Univ Virginia, Dept Mol Physiol & Biol Phys, Ctr Membrane Biol, Charlottesville, VA 22908 USA.",Science & Technology - Other Topics,0028-0836,NATURE,153.0,Crystallographic snapshot of cellulose synthesis and membrane translocation,9.0,246.0,WOS:000313259600031,481.0,493,Multidisciplinary Sciences,156,jochen,zimmer,2408.0,32,male,1.0,RhOx8pEAAAAJ,2,"(1474, 4126]",37330608,1,47907122,1,Christine Westermann,Christine Westermann,0,0
42,103,140.0,"Measured rates of river incision into bedrock are commonly interpreted as proxies for rates of rock uplift (see refs 1 and 2, for example) and indices of the strength of climatic forcing of erosion over time (see refs 3 and 4, for example). This approach implicitly assumes that river incision rates are in equilibrium with external forcings over a wide range of timescales. Here we directly test this assumption by examining the temporal scaling of bedrock river incision from 155 independent measurements of river incision compiled from 14 sites. Of these sites, 11 exhibit a negative power-law dependence of bedrock river incision rate on measurement interval, a relationship that is apparent over timescales of 10(4)-10(7) years and is independent of tectonic and geomorphic setting. Thus, like rates of sediment accumulation(5), rates of river incision into bedrock exhibit non-steady-state behaviour even over very long measurement intervals. Non-steady-state behaviour can be explained by episodic hiatuses in river incision triggered by alluvial deposition, if such hiatuses have a heavy-tailed length distribution(6). Regardless of its cause, the dependence of incision rate on measurement interval complicates efforts to infer tectonic or climatic forcing from changes in rates of river incision over time or from comparison of rates computed over different timescales.","Finnegan, Noah J.; Schumer, Rina; Finnegan, Seth","Finnegan, NJ; Schumer, R; Finnegan, S",391.0,"[Finnegan, Noah J.] Univ Calif Santa Cruz, Dept Earth & Planetary Sci, Santa Cruz, CA 95064 USA; [Schumer, Rina] Desert Res Inst, Div Hydrol Sci, Reno, NV 89512 USA; [Finnegan, Seth] Univ Calif Berkeley, Dept Integrat Biol, Berkeley, CA 94720 USA",,,11/20/17,,10.1038/nature12913,Article,1476-4687,nfinnega@ucsc.edu,+,National Science Foundation [EAR-1049889],"This study was supported in part by the National Science Foundation (EAR-1049889). We thank J. Kirchner, B. Crosby and K. Ferrier for discussion and comments that improved the manuscript.",288OR,,,COSMOGENIC AL-26; TIBETAN-PLATEAU; STRATH TERRACES; STREAM INCISION; CLIMATE-CHANGE; YELLOW-RIVER; FORE-ARC; QUATERNARY; EROSION; CANYON,7483.0,NATURE,Nature,English,39.0,No,"Schumer, Rina/0000-0001-6094-5637","MACMILLAN BUILDING, 4 CRINAN ST, LONDON N1 9XW, ENGLAND",16-Jan,6.0,LONDON,24429636.0,J,NATURE PUBLISHING GROUP,2014.0,"Schumer, Rina/H-1179-2011","Finnegan, NJ (reprint author), Univ Calif Santa Cruz, Dept Earth & Planetary Sci, Santa Cruz, CA 95064 USA.",Science & Technology - Other Topics,0028-0836,NATURE,49.0,A signature of transience in bedrock river incision rates over timescales of 10(4)-10(7) years,2.0,56.0,WOS:000329621800040,140.0,505,Multidisciplinary Sciences,49,seth,finnegan,1682.0,373,male,1.0,kjXJR4QAAAAJ,2,"(1474, 4126]",27441622,1,657682,1,List of United States stand-up comedians,List of United States stand-up comedians,0,0
43,43,207.0,"Venus is Earth's near twin in mass and radius, and our nearest planetary neighbour, yet conditions there are very different in many respects. Its atmosphere, mostly composed of carbon dioxide, has a surface temperature and pressure far higher than those of Earth. Only traces of water are found, although it is likely that there was much more present in the past, possibly forming Earth-like oceans. Here we discuss how the first year of observations by Venus Express brings into focus the evolutionary paths by which the climates of two similar planets diverged from common beginnings to such extremes. These include a CO2-driven greenhouse effect, erosion of the atmosphere by solar particles and radiation, surface-atmosphere interactions, and atmospheric circulation regimes defined by differing planetary rotation rates.","Svedhem, Hakan; Titov, Dmitry V.; Taylor, Fredric W.; Witasse, Olivier","Svedhem, H; Titov, DV; Taylor, FW; Witasse, O",629.0,"European Space Agcy, Estec, NL-2200 AG Noordwijk, Netherlands; Max Planck Inst Solar Syst Res, D-37191 Katlenburg Lindau, Germany; Space Res Inst, IKI, Moscow 117997, Russia; Univ Oxford, Dept Atmospher Ocean & Planetary Phys, Oxford OX1 3PU, England",,,11/20/17,,10.1038/nature06432,Article,,h.svedhem@esa.int,632,,,235BY,,,EXPRESS,7170.0,NATURE,Nature,English,6.0,No,,"MACMILLAN BUILDING, 4 CRINAN ST, LONDON N1 9XW, ENGLAND",29-Nov,4.0,LONDON,18046393.0,J,NATURE PUBLISHING GROUP,2007.0,,"Svedhem, H (reprint author), European Space Agcy, Estec, PB 299, NL-2200 AG Noordwijk, Netherlands.",Science & Technology - Other Topics,0028-0836,NATURE,47.0,Venus as a more Earth-like planet,0.0,17.0,WOS:000251209700033,207.0,450,Multidisciplinary Sciences,49,olivier,witasse,2589.0,715,male,0.99,RDplc1gAAAAJ,2,"(1474, 4126]",na,0,na,0,na,na,0,0
