,Unnamed: 0.1,Unnamed: 0.1.1,AB,AF,AU,BP,C1,CA,CR,DA,DE,DI,DT,EI,EM,EP,FU,FX,GA,HC,HP,ID,IS,J9,JI,LA,NR,OA,OI,PA,PD,PG,PI,PM,PT,PU,PY,RI,RP,SC,SN,SO,TC,TI,U1,U2,UT,Unnamed: 0.1.1.1,VL,WC,Z9,c_fname,c_lname,citedby,count,gender,probability,scholar_id,quantile,range,page_id,has_page,page_id_nature,has_page_nature,page_title,page_title_nature,page_title_match,page_title_match_nature
78,86,19.0,"Tandem repeat proteins, which are formed by repetition of modular units of protein sequence and structure, play important biological roles as macromolecular binding and scaffolding domains, enzymes, and building blocks for the assembly of fibrous materials(1,2). The modular nature of repeat proteins enables the rapid construction and diversification of extended binding surfaces by duplication and recombination of simple building blocks(3,4). The overall architecture of tandem repeat protein structures-which is dictated by the internal geometry and local packing of the repeat building blocks-is highly diverse, ranging from extended, super-helical folds that bind peptide, DNA, and RNA partners(5-9), to closed and compact conformations with internal cavities suitable for small molecule binding and catalysis(10). Here we report the development and validation of computational methods for de novo design of tandem repeat protein architectures driven purely by geometric criteria defining the inter-repeat geometry, without reference to the sequences and structures of existing repeat protein families. We have applied these methods to design a series of closed alpha-solenoid(11) repeat structures (alpha-toroids) in which the inter-repeat packing geometry is constrained so as to juxtapose the amino (N) and carboxy (C) termini; several of these designed structures have been validated by X-ray crystallography. Unlike previous approaches to tandem repeat protein engineering(12-20), our design procedure does not rely on template sequence or structural information taken from natural repeat proteins and hence can produce structures unlike those seen in nature. As an example, we have successfully designed and validated closed alpha-solenoid repeats with a left-handed helical architecture that-to our knowledge-is not yet present in the protein structure database(21).","Doyle, Lindsey; Hallinan, Jazmine; Bolduc, Jill; Parmeggiani, Fabio; Baker, David; Stoddard, Barry L.; Bradley, Philip","Doyle, L; Hallinan, J; Bolduc, J; Parmeggiani, F; Baker, D; Stoddard, BL; Bradley, P",585.0,"[Doyle, Lindsey; Hallinan, Jazmine; Bolduc, Jill; Stoddard, Barry L.; Bradley, Philip] Fred Hutchinson Canc Res Ctr, Div Basic Sci, Seattle, WA 98109 USA; [Parmeggiani, Fabio; Baker, David] Univ Washington, Dept Biochem, Seattle, WA 98195 USA; [Parmeggiani, Fabio; Baker, David; Bradley, Philip] Univ Washington, Inst Prot Design, Seattle, WA 98195 USA; [Baker, David] Univ Washington, Howard Hughes Med Inst, Seattle, WA 98195 USA; [Bradley, Philip] Fred Hutchinson Canc Res Ctr, Div Publ Hlth Sci, Seattle, WA 98019 USA",,,11/19/17,,10.1038/nature16191,Article,1476-4687,pbradley@fredhutch.org,+,"National Institutes of Health [R21GM106117, R01GM49857]; Swiss National Science Foundation Postdoc Fellowship [PBZHP3-125470]; Human Frontier Science Program Long-Term Fellowship [LT000070/2009-L]","The authors thank Scientific Computing at the Fred Hutchinson Cancer Research Center for providing the computational infrastructure necessary for this project. This research was supported by the following research grants: National Institutes of Health R21GM106117 to P.B. and R01GM49857 to B.L.S., and Swiss National Science Foundation Postdoc Fellowship PBZHP3-125470 and Human Frontier Science Program Long-Term Fellowship LT000070/2009-L to F.P.",CZ3GH,,,COMPUTATIONAL DESIGN; PEPTIDE-BINDING; CRYSTAL; DNA; CLASSIFICATION; RECOGNITION; REFINEMENT; SCAFFOLDS; SEQUENCES; SOFTWARE,7583.0,NATURE,Nature,English,46.0,No,"Parmeggiani, Fabio/0000-0001-8548-1090; Baker, David/0000-0001-7896-6217","MACMILLAN BUILDING, 4 CRINAN ST, LONDON N1 9XW, ENGLAND",24-Dec,14.0,LONDON,26675735.0,J,NATURE PUBLISHING GROUP,2015.0,"Parmeggiani, Fabio/B-9344-2016; Baker, David/K-8941-2012","Bradley, P (reprint author), Fred Hutchinson Canc Res Ctr, Div Basic Sci, 1100 Fairview Ave N, Seattle, WA 98109 USA.",Science & Technology - Other Topics,0028-0836,NATURE,31.0,Rational design of alpha-helical tandem repeat proteins with closed architectures,7.0,87.0,WOS:000366991900059,19.0,528,Multidisciplinary Sciences,31,philip,bradley,5904.0,1097,male,1.0,#NAME?,3,"(4126, 9345]",1132006,1,15393780,1,Bradley Wright-Phillips,Bradley Wright-Phillips,1,1
79,11,291.0,"DEAD-box helicases are conserved enzymes involved in nearly all aspects of RNA metabolism, but their mechanisms of action remain unclear. Here, we investigated the mechanism of the DEAD-box protein Mss116 on its natural substrate, the group II intron ai5 gamma. Group II introns are structurally complex catalytic RNAs considered evolutionarily related to the eukaryotic spliceosome, and an interesting paradigm for large RNA folding. We used single-molecule fluorescence to monitor the effect of Mss116 on folding dynamics of a minimal active construct, ai5 gamma-D135. The data show that Mss116 stimulates dynamic sampling between states along the folding pathway, an effect previously observed only with high Mg(2+) concentrations. Furthermore, the data indicate that Mss116 promotes folding through discrete ATP-independent and ATP-dependent steps. We propose that Mss116 stimulates group II intron folding through a multi-step process that involves electrostatic stabilization of early intermediates and ATP hydrolysis during the final stages of native state assembly.","Karunatilaka, Krishanthi S.; Solem, Amanda; Pyle, Anna Marie; Rueda, David","Karunatilaka, KS; Solem, A; Pyle, AM; Rueda, D",935.0,"[Karunatilaka, Krishanthi S.; Solem, Amanda; Rueda, David] Wayne State Univ, Dept Chem, Detroit, MI 48202 USA; [Pyle, Anna Marie] Yale Univ, Dept Mol Cellular & Dev Biol, New Haven, CT 06520 USA; [Pyle, Anna Marie] Yale Univ, Dept Chem, New Haven, CT 06520 USA; [Pyle, Anna Marie] Yale Univ, Howard Hughes Med Inst, New Haven, CT 06520 USA",,,11/20/17,,10.1038/nature09422,Article,,anna.pyle@yale.edu; david.rueda@wayne.edu,U75,"National Institutes of Health [R01GM085116, R01GM050313]; National Science Foundation [MCB-0747285]","We thank R. K. Sigel and O. Fedorova for many helpful and stimulating discussions and for commenting on the manuscript, and A. Feig, K. Musier-Forsyth and R. Lamichhane for protein gifts. This work was supported by the National Institutes of Health (R01GM085116 to D.R., R01GM050313 to A.M.P.) and the National Science Foundation (MCB-0747285 to D.R.). A.M.P. is an HHMI investigator.",668FT,,,DEAD-BOX PROTEINS; RNA CHAPERONE ACTIVITY; ATP HYDROLYSIS; UNWINDING RNA; RIBOZYME; SPECTROSCOPY; MECHANISM; HELICASE; REQUIRES; FRET,7318.0,NATURE,Nature,English,35.0,No,,"MACMILLAN BUILDING, 4 CRINAN ST, LONDON N1 9XW, ENGLAND",21-Oct,6.0,LONDON,20944626.0,J,NATURE PUBLISHING GROUP,2010.0,"Solem, Amanda/A-3553-2010; Solem, Amanda/M-5959-2013","Rueda, D (reprint author), Wayne State Univ, Dept Chem, 5101 Cass Ave, Detroit, MI 48202 USA.",Science & Technology - Other Topics,0028-0836,NATURE,51.0,Single-molecule analysis of Mss116-mediated group II intron folding,1.0,23.0,WOS:000283254700031,291.0,467,Multidisciplinary Sciences,51,david,rueda,5790.0,12593,male,1.0,p4GQnTYAAAAJ,3,"(4126, 9345]",46825495,1,50936498,1,David Rueda,David Rueda,1,1
80,212,269.0,"The concept of disease-specific chemotherapy was developed a century ago. Dyes and arsenical compounds that displayed selectivity against trypanosomes were central to this work(1,2), and the drugs that emerged remain in use for treating human African trypanosomiasis (HAT)(3). The importance of understanding the mechanisms underlying selective drug action and resistance for the development of improved HAT therapies has been recognized, but these mechanisms have remained largely unknown. Here we use all five current HAT drugs for genome-scale RNA interference target sequencing (RIT-seq) screens in Trypanosoma brucei, revealing the transporters, organelles, enzymes and metabolic pathways that function to facilitate antitrypanosomal drug action. RIT-seq profiling identifies both known drug importers(4,5) and the only known prodrug activator(6), and links more than fifty additional genes to drug action. A bloodstream stage-specific invariant surface glycoprotein (ISG75) family mediates suramin uptake, and the AP1 adaptin complex, lysosomal proteases and major lysosomal transmembrane protein, as well as spermidine and N-acetylglucosamine biosynthesis, all contribute to suramin action. Further screens link ubiquinone availability to nitro-drug action, plasma membrane P-type H+-ATPases to pentamidine action, and trypanothione and several putative kinases to melarsoprol action. We also demonstrate a major role for aquaglyceroporins in pentamidine and melarsoprol cross-resistance. These advances in our understanding of mechanisms of antitrypanosomal drug efficacy and resistance will aid the rational design of new therapies and help to combat drug resistance, and provide unprecedented molecular insight into the mode of action of antitrypanosomal drugs.","Alsford, Sam; Eckert, Sabine; Baker, Nicola; Glover, Lucy; Sanchez-Flores, Alejandro; Leung, Ka Fai; Turner, Daniel J.; Field, Mark C.; Berriman, Matthew; Horn, David","Alsford, S; Eckert, S; Baker, N; Glover, L; Sanchez-Flores, A; Leung, KF; Turner, DJ; Field, MC; Berriman, M; Horn, D",232.0,"[Alsford, Sam; Baker, Nicola; Glover, Lucy; Horn, David] London Sch Hyg & Trop Med, London WC1E 7HT, England; [Eckert, Sabine; Sanchez-Flores, Alejandro; Turner, Daniel J.; Berriman, Matthew] Wellcome Trust Sanger Inst, Cambridge CB10 1SA, England; [Leung, Ka Fai; Field, Mark C.] Univ Cambridge, Dept Pathol, Cambridge CB2 1QP, England",,,11/20/17,,10.1038/nature10771,Article,1476-4687,david.horn@lshtm.ac.uk,U125,"Wellcome Trust [093010/Z/10/Z, 085775/Z/08/Z, 090007/Z/09/Z]; Bloomsbury colleges PhD studentship","We thank J. Morris, Z. Wang, M. Drew and P. Englund for the RNAi plasmid library, V. Yardley for antitrypanosomal drugs, J. Bangs for anti-p67 and CatL sera, D. Russell for anti-GLP1 sera, A. Varghese for assistance with preliminary Sanger sequencing and J. Kelly, M. Taylor and B. Wren for comments on the draft manuscript. The work was funded by grants from The Wellcome Trust (093010/Z/10/Z at the London School of Hygiene & Tropical Medicine, 085775/Z/08/Z at The Wellcome Trust Sanger Institute and 090007/Z/09/Z at The University of Cambridge). N.B. was supported by a Bloomsbury colleges PhD studentship.",888HI,Y,N,HUMAN AFRICAN TRYPANOSOMIASIS; BLOOD-STREAM FORMS; BRUCEI; EXPRESSION; GLYCOPROTEIN; RNAI; DIAMIDINE; SURAMIN; TRANSPORTER; LYSOSOME,7384.0,NATURE,Nature,English,45.0,No,"Sanchez-Flores, Alejandro/0000-0003-0476-3139; Berriman, Matthew/0000-0002-9581-0377; Field, Mark/0000-0002-4866-2885; Horn, David/0000-0001-5173-9284; Glover, Lucy/0000-0001-7191-6890; Alsford, Sam/0000-0001-8621-4920","MACMILLAN BUILDING, 4 CRINAN ST, LONDON N1 9XW, ENGLAND",9-Feb,6.0,LONDON,22278056.0,J,NATURE PUBLISHING GROUP,2012.0,"Sanchez-Flores, Alejandro/L-9454-2016; Berriman, Matthew/A-7618-2011","Horn, D (reprint author), London Sch Hyg & Trop Med, Keppel St, London WC1E 7HT, England.",Science & Technology - Other Topics,0028-0836,NATURE,130.0,High-throughput decoding of antitrypanosomal drug efficacy and resistance,4.0,58.0,WOS:000299994100041,269.0,482,Multidisciplinary Sciences,130,david,horn,7455.0,12593,male,1.0,gjKDpHIAAAAJ,3,"(4126, 9345]",na,0,na,0,na,na,0,0
81,235,401.0,,"Chapman, Ian","Chapman, I",506.0,,,,11/20/17,,,Article,,,506,,,755QC,,,,7344.0,NATURE,Nature,English,0.0,No,,"MACMILLAN BUILDING, 4 CRINAN ST, LONDON N1 9XW, ENGLAND",28-Apr,1.0,LONDON,,J,NATURE PUBLISHING GROUP,2011.0,,,Science & Technology - Other Topics,0028-0836,NATURE,0.0,TURNING POINT,0.0,5.0,WOS:000289949600043,401.0,472,Multidisciplinary Sciences,0,ian,chapman,7780.0,2159,male,0.99,BIoa7NsAAAAJ,3,"(4126, 9345]",20528022,1,26544580,1,Ian Chapman,Ian Chapman,1,1
82,222,25.0,"Many animals attract mating partners through the release of volatile sex pheromones, which can convey information on the species, gender and receptivity of the sender to induce innate courtship and mating behaviours by the receiver(1). Male Drosophila melanogaster fruitflies display stereotyped reproductive behaviours towards females, and these behaviours are controlled by the neural circuitry expressing male-specific isoforms of the transcription factor Fruitless (FRUM)(2-5). However, the volatile pheromone ligands, receptors and olfactory sensory neurons (OSNs) that promote male courtship have not been identified in this important model organism. Here we describe a novel courtship function of Ionotropic receptor 84a (IR84a), which is a member of the chemosensory ionotropic glutamate receptor family(6), in a previously uncharacterized population of FRUM-positive OSNs. IR84a-expressing neurons are activated not by fly-derived chemicals but by the aromatic odours phenylacetic acid and phenylacetaldehyde, which are widely found in fruit and other plant tissues(7) that serve as food sources and oviposition sites for drosophilid flies(8). Mutation of Ir84a abolishes both odour-evoked and spontaneous electrophysiological activity in these neurons and markedly reduces male courtship behaviour. Conversely, male courtship is increased-in an IR84a-dependent manner-in the presence of phenylacetic acid but not in the presence of another fruit odour that does not activate IR84a. Interneurons downstream of IR84a-expressing OSNs innervate a pheromone-processing centre in the brain. Whereas IR84a orthologues and phenylacetic-acid-responsive neurons are present in diverse drosophilid species, IR84a is absent from insects that rely on long-range sex pheromones. Our results suggest a model in which IR84a couples food presence to the activation of the fru(M) courtship circuitry in fruitflies. These findings reveal an unusual but effective evolutionary solution to coordinate feeding and oviposition site selection with reproductive behaviours through a specific sensory pathway.","Grosjean, Yael; Rytz, Raphael; Farine, Jean-Pierre; Abuin, Liliane; Cortot, Jerome; Jefferis, Gregory S. X. E.; Benton, Richard","Grosjean, Y; Rytz, R; Farine, JP; Abuin, L; Cortot, J; Jefferis, GSXE; Benton, R",236.0,"[Grosjean, Yael; Rytz, Raphael; Abuin, Liliane; Benton, Richard] Univ Lausanne, Fac Biol & Med, Ctr Integrat Genom, CH-1015 Lausanne, Switzerland; [Grosjean, Yael; Farine, Jean-Pierre; Cortot, Jerome] Univ Bourgogne, INRA, UMR 1324, Ctr Sci Gout & Alimentat,CNRS,UMR 6265, F-21000 Dijon, France; [Jefferis, Gregory S. X. E.] MRC, Mol Biol Lab, Div Neurobiol, Cambridge CB2 0QH, England",,,11/20/17,,10.1038/nature10428,Article,1476-4687,Richard.Benton@unil.ch,U123,Centre National de la Recherche Scientifique (CNRS); Agence Nationale de la Recherche (ANR) [GGCB-2010]; Conseil Regional de Bourgogne (FABER); Roche Research Foundation; Medical Research Council; European Research Council; University of Lausanne; Swiss National Science Foundation,"We are grateful to B. Dickson, A. Hofbauer, T. Lee, the Bloomington Drosophila Stock Center, the Drosophila Species Stock Center and the Developmental Studies Hybridoma Bank for provision of plasmid vectors, Drosophila strains and antibodies. We are also grateful to A. Wong, J. Wang, R. Axel, H.-H. Yu and T. Lee for sharing raw image data. We thank D. Featherstone, J.-F. Ferveur, T. Kawecki, L. Keller, S. Martin and members of the Benton laboratory for comments on the manuscript. Y.G., J.-P. F. and J. C. are supported by the Centre National de la Recherche Scientifique (CNRS), the Agence Nationale de la Recherche (ANR; JCJC, GGCB-2010) and the Conseil Regional de Bourgogne (FABER). R. R. was supported by a Roche Research Foundation fellowship. G. S. X. E. J. is supported by the Medical Research Council and a European Research Council Starting Investigator Grant. Research in R.B.'s laboratory is supported by the University of Lausanne, a European Research Council Starting Independent Researcher Grant and the Swiss National Science Foundation.",832DT,,,IONOTROPIC GLUTAMATE RECEPTORS; PHENYLACETIC ACID; SEX-PHEROMONE; BEHAVIOR; MELANOGASTER; NEURONS; REPRESENTATION; ARCHITECTURE; ALGORITHM; RESPONSES,7368.0,NATURE,Nature,English,44.0,No,"Grosjean, Yael/0000-0003-0689-8344; Jefferis, Gregory/0000-0002-0587-9355","MACMILLAN BUILDING, 4 CRINAN ST, LONDON N1 9XW, ENGLAND",13-Oct,7.0,LONDON,21964331.0,J,NATURE PUBLISHING GROUP,2011.0,"Jefferis, Gregory/C-6386-2012","Benton, R (reprint author), Univ Lausanne, Fac Biol & Med, Ctr Integrat Genom, CH-1015 Lausanne, Switzerland.",Science & Technology - Other Topics,0028-0836,NATURE,114.0,An olfactory receptor for food-derived odours promotes male courtship in Drosophila,6.0,72.0,WOS:000295782800049,25.0,478,Multidisciplinary Sciences,115,richard,benton,5419.0,4381,male,1.0,PlPUMesAAAAJ,3,"(4126, 9345]",na,0,na,0,na,na,0,0
83,80,148.0,,"Gorb, Stanislav N.; Niederegger, Senta; Hayashi, Cheryl Y.; Summers, Adam P.; Voetsch, Walter; Walther, Paul","Gorb, SN; Niederegger, S; Hayashi, CY; Summers, AP; Voetsch, W; Walther, P",407.0,"Max Planck Inst Met Res, Evolutionary Biomat Grp, D-70569 Stuttgart, Germany; Max Planck Inst Dev Biol, D-71076 Tubingen, Germany; Univ Jena, Inst Forens Med, D-07743 Jena, Germany; Univ Calif Riverside, Dept Biol, Riverside, CA 92521 USA; Univ Ulm, Dept Electron Microscopy, D-89069 Ulm, Germany",,,11/20/17,,10.1038/443407a,Article,,s.gorb@mf.mpg.de,407,,,088FY,,,SPIDER SILK; ORIGIN; EVOLUTION; ARANEAE,7110.0,NATURE,Nature,English,11.0,No,"Summers, Adam/0000-0003-1930-9748","MACMILLAN BUILDING, 4 CRINAN ST, LONDON N1 9XW, ENGLAND",28-Sep,1.0,LONDON,17006505.0,J,NATURE PUBLISHING GROUP,2006.0,"Summers, Adam/A-9060-2013","Gorb, SN (reprint author), Max Planck Inst Met Res, Evolutionary Biomat Grp, D-70569 Stuttgart, Germany.",Science & Technology - Other Topics,0028-0836,NATURE,34.0,Silk-like secretion from tarantula feet,0.0,16.0,WOS:000240798800033,148.0,443,Multidisciplinary Sciences,34,paul,walther,7806.0,5931,male,1.0,NzijtMEAAAAJ,3,"(4126, 9345]",11935771,1,na,0,Paul Walther,na,1,0
84,213,271.0,"Two defining functional features of ion channels are ion selectivity and channel gating. Ion selectivity is generally considered an immutable property of the open channel structure, whereas gating involves transitions between open and closed channel states, typically without changes in ion selectivity(1). In store-operated Ca2+ release-activated Ca2+ (CRAC) channels, the molecular mechanism of channel gating by the CRAC channel activator, stromal interaction molecule 1 (STIM1), remains unknown. CRAC channels are distinguished by a very high Ca2+ selectivity and are instrumental in generating sustained intracellular calcium concentration elevations that are necessary for gene expression and effector function in many eukaryotic cells(2). Here we probe the central features of the STIM1 gating mechanism in the human CRAC channel protein, ORAI1, and identify V102, a residue located in the extracellular region of the pore, as a candidate for the channel gate. Mutations at V102 produce constitutively active CRAC channels that are open even in the absence of STIM1. Unexpectedly, although STIM1-free V102 mutant channels are not Ca2+-selective, their Ca2+ selectivity is dose-dependently boosted by interactions with STIM1. Similar enhancement of Ca2+ selectivity is also seen in wild-type ORAI1 channels by increasing the number of STIM1 activation domains that are directly tethered to ORAI1 channels, or by increasing the relative expression of full-length STIM1. Thus, exquisite Ca2+ selectivity is not an intrinsic property of CRAC channels but rather a tuneable feature that is bestowed on otherwise non-selective ORAI1 channels by STIM1. Our results demonstrate that STIM1-mediated gating of CRAC channels occurs through an unusual mechanism in which permeation and gating are closely coupled.","McNally, Beth A.; Somasundaram, Agila; Yamashita, Megumi; Prakriya, Murali","McNally, BA; Somasundaram, A; Yamashita, M; Prakriya, M",241.0,"[McNally, Beth A.; Somasundaram, Agila; Yamashita, Megumi; Prakriya, Murali] Northwestern Univ, Dept Mol Pharmacol & Biol Chem, Sch Med, Chicago, IL 60611 USA",,,11/20/17,,10.1038/nature10752,Article,,m-prakriya@northwestern.edu,U136,NIH [NS057499]; American Heart Association,"We thank C. Lingle, R. Lewis, K. Swartz, J. Sack, A. Gross, L. Tirado-Lee and T. Hornell for discussions and comments on the manuscript. This work was supported by NIH grant NS057499 to M. P. An American Heart Association predoctoral fellowship supported A.S.",888HI,,,CA2+-DEPENDENT INACTIVATION; ORAI1; PORE; PERMEATION; SUBUNIT,7384.0,NATURE,Nature,English,30.0,No,,"MACMILLAN BUILDING, 4 CRINAN ST, LONDON N1 9XW, ENGLAND",9-Feb,6.0,LONDON,22278058.0,J,NATURE PUBLISHING GROUP,2012.0,,"Prakriya, M (reprint author), Northwestern Univ, Dept Mol Pharmacol & Biol Chem, Sch Med, 303 E Chicago Ave,Ward 8-296, Chicago, IL 60611 USA.",Science & Technology - Other Topics,0028-0836,NATURE,92.0,Gated regulation of CRAC channel ion selectivity by STIM1,0.0,11.0,WOS:000299994100043,271.0,482,Multidisciplinary Sciences,94,murali,prakriya,7667.0,40,male,1.0,vNCCEvQAAAAJ,3,"(4126, 9345]",na,0,na,0,na,na,0,0
85,73,374.0,"One motivation in the study of development is the discovery of mechanisms that may guide evolutionary change. Here we report how development governs relative size and number of cheek teeth, or molars, in the mouse. We constructed an inhibitory cascade model by experimentally uncovering the activator-inhibitor logic of sequential tooth development. The inhibitory cascade acts as a ratchet that determines molar size differences along the jaw, one effect being that the second molar always makes up one-third of total molar area. By using a macroevolutionary test, we demonstrate the success of the model in predicting dentition patterns found among murine rodent species with various diets, thereby providing an example of ecologically driven evolution along a developmentally favoured trajectory. In general, our work demonstrates how to construct and test developmental rules with evolutionary predictability in natural systems.","Kavanagh, Kathryn D.; Evans, Alistair R.; Jernvall, Jukka","Kavanagh, KD; Evans, AR; Jernvall, J",427.0,"SUNY Stony Brook, Dept Ecol & Evolut, Stony Brook, NY 11794 USA; Univ Helsinki, Inst Biotechnol, Evolut & Dev Unit, FIN-00014 Helsinki, Finland",,,11/20/17,,10.1038/nature06153,Article,,kathryn_kavanagh@yahoo.com; jernvall@fastmail.fm,U1,,,214GQ,,,EXPRESSION PATTERNS; TOOTH DEVELOPMENT; GENETIC-BASIS; LIFE-HISTORY; MOLAR TEETH; REDUCTION; MOUSE; DIFFERENTIATION; DENTITIONS; GROWTH,7161.0,NATURE,Nature,English,50.0,No,"Evans, Alistair/0000-0002-4078-4693","MACMILLAN BUILDING, 4 CRINAN ST, LONDON N1 9XW, ENGLAND",27-Sep,7.0,LONDON,17898761.0,J,NATURE PUBLISHING GROUP,2007.0,"Evans, Alistair/D-4239-2011","Kavanagh, KD (reprint author), SUNY Stony Brook, Sch Marine & Atmospher Sci, Stony Brook, NY 11794 USA.",Science & Technology - Other Topics,0028-0836,NATURE,167.0,Predicting evolutionary patterns of mammalian teeth from development,11.0,53.0,WOS:000249724800033,374.0,449,Multidisciplinary Sciences,171,jukka,jernvall,8085.0,62,male,1.0,o2NAG70AAAAJ,3,"(4126, 9345]",28649402,1,28649402,1,Jukka Jernvall,Jukka Jernvall,1,1
