,Unnamed: 0.1,Unnamed: 0.1.1,AB,AF,AU,BP,C1,CA,CR,DA,DE,DI,DT,EI,EM,EP,FU,FX,GA,HC,HP,ID,IS,J9,JI,LA,NR,OA,OI,PA,PD,PG,PI,PM,PT,PU,PY,RI,RP,SC,SN,SO,TC,TI,U1,U2,UT,Unnamed: 0.1.1.1,VL,WC,Z9,c_fname,c_lname,citedby,count,gender,probability,scholar_id,quantile,range,page_id,has_page,page_id_nature,has_page_nature,page_title,page_title_nature,page_title_match,page_title_match_nature
0,97,185.0,"Most herpes simplex virus 2 (HSV-2) reactivations in humans are subclinical and associated with rapid expansion and containment of virus. Previous studies have shown that CD8(+) T cells persist in genital skin and mucosa at the dermal-epidermal junction (DEJ)-the portal of neuronal release of reactivating virus-for prolonged time periods after herpes lesions are cleared(1,2). The phenotype and function of this persistent CD8(+) T-cell population remain unknown. Here, using cell-type-specific laser capture microdissection, transcriptional profiling and T-cell antigen receptor beta-chain (TCR beta) genotyping on sequential genital skin biopsies, we show that CD8 alpha alpha(+) T cells are the dominant resident population of DEJ CD8(+) T cells that persist at the site of previous HSV-2 reactivation. CD8 alpha alpha(+) T cells located at the DEJ lack chemokine-receptor expression required for lymphocyte egress and recirculation, express gene signatures of T-cell activation and antiviral activity, and produce cytolytic granules during clinical and virological quiescent time periods. Sequencing of the TCR beta-chain repertoire reveals that the DEJ CD8 alpha alpha(+) T cells are oligoclonal with diverse usage of TCR variable-beta genes, which differ from those commonly described for mucosa-associated invariant T cells and natural killer T cells. Dominant clonotypes are shown to overlap among multiple recurrences over a period of two-and-a-half years. Episodes of rapid asymptomatic HSV-2 containment were also associated with a high CD8 effector-to-target ratio and focal enrichment of CD8 alpha alpha(+) T cells. These studies indicate that DEJ CD8 alpha alpha(+) T cells are tissue-resident cells that seem to have a fundamental role in immune surveillance and in initial containment of HSV-2 reactivation in human peripheral tissue. Elicitation of CD8 alpha alpha(+) T cells may be a critical component for developing effective vaccines against skin and mucosal infections.","Zhu, Jia; Peng, Tao; Johnston, Christine; Phasouk, Khamsone; Kask, Angela S.; Klock, Alexis; Jin, Lei; Diem, Kurt; Koelle, David M.; Wald, Anna; Robins, Harlan; Corey, Lawrence","Zhu, J; Peng, T; Johnston, C; Phasouk, K; Kask, AS; Klock, A; Jin, L; Diem, K; Koelle, DM; Wald, A; Robins, H; Corey, L",494.0,"[Zhu, Jia; Kask, Angela S.; Klock, Alexis; Jin, Lei; Diem, Kurt; Koelle, David M.; Wald, Anna; Corey, Lawrence] Univ Washington, Dept Lab Med, Seattle, WA 98195 USA; [Zhu, Jia; Peng, Tao; Phasouk, Khamsone; Koelle, David M.; Wald, Anna; Corey, Lawrence] Fred Hutchinson Canc Res Ctr, Vaccine & Infect Dis Div, Seattle, WA 98109 USA; [Peng, Tao; Johnston, Christine; Koelle, David M.; Wald, Anna; Corey, Lawrence] Univ Washington, Dept Med, Seattle, WA 98195 USA; [Koelle, David M.; Corey, Lawrence] Univ Washington, Dept Pathobiol, Seattle, WA 98195 USA; [Koelle, David M.] Benaroya Res Inst, Seattle, WA 98104 USA; [Wald, Anna] Univ Washington, Dept Epidemiol, Seattle, WA 98195 USA; [Robins, Harlan] Fred Hutchinson Canc Res Ctr, Program Computat Biol, Seattle, WA 98109 USA",,,11/20/17,,10.1038/nature12110,Article,,jiazhu@u.washington.edu; lcorey@fhcrc.org,+,"National Institutes of Health [R37AI042528, R01AI04252815, P01AI030731, R56AI093746]; James B. Pendleton Charitable Trust","We thank M. Huang, H. Xie, J. Vazquez and D. McDonald for technical assistance; M. Prlic and C. Desmarais for discussion and reading the manuscript and M. Miner for editing. We also thank our study participants and S. Kuntz and M. Stern for clinical assistance. This work was supported by grants from the National Institutes of Health (R37AI042528, R01AI04252815, P01AI030731 and R56AI093746) and the James B. Pendleton Charitable Trust.",148OG,,,SIMPLEX-VIRUS; PERIPHERAL-TISSUES; HSV-2 REACTIVATION; RECEPTOR-1; RESPONSES; CLONES; EXIT,7450.0,NATURE,Nature,English,30.0,No,"Wald, Anna/0000-0003-3486-6438; Koelle, David/0000-0003-1255-9023","MACMILLAN BUILDING, 4 CRINAN ST, LONDON N1 9XW, ENGLAND",23-May,5.0,LONDON,23657257.0,J,NATURE PUBLISHING GROUP,2013.0,"Wald, Anna/B-6272-2012; Koelle, David/Q-6529-2016","Zhu, J (reprint author), Univ Washington, Dept Lab Med, Seattle, WA 98195 USA.",Science & Technology - Other Topics,0028-0836,NATURE,96.0,Immune surveillance by CD8 alpha alpha(+) skin-resident T cells in human herpes virus infection,3.0,34.0,WOS:000319254000049,185.0,497,Multidisciplinary Sciences,98,lawrence,corey,1110.0,393,male,1.0,1ZBdOOcAAAAJ,1,"[0, 1474]",12310579,1,12310579,1,Lawrence Corey,Lawrence Corey,1,1
1,123,191.0,"The ability to learn new skills and perfect them with practice applies not only to physical skills but also to abstract skills(1), like motor planning or neuroprosthetic actions. Although plasticity in corticostriatal circuits has been implicated in learning physical skills(2-4), it remains unclear if similar circuits or processes are required for abstract skill learning. Here we use a novel behavioural task in rodents to investigate the role of corticostriatal plasticity in abstract skill learning. Rodents learned to control the pitch of an auditory cursor to reach one of two targets by modulating activity in primary motor cortex irrespective of physical movement. Degradation of the relation between action and outcome, as well as sensory-specific devaluation and omission tests, demonstrate that these learned neuroprosthetic actions are intentional and goal-directed, rather than habitual. Striatal neurons change their activity with learning, with more neurons modulating their activity in relation to target-reaching as learning progresses. Concomitantly, strong relations between the activity of neurons in motor cortex and the striatum emerge. Specific deletion of striatal NMDA receptors impairs the development of this corticostriatal plasticity, and disrupts the ability to learn neuroprosthetic skills. These results suggest that corticostriatal plasticity is necessary for abstract skill learning, and that neuroprosthetic movements capitalize on the neural circuitry involved in natural motor learning.","Koralek, Aaron C.; Jin, Xin; Ii, John D. Long; Costa, Rui M.; Carmena, Jose M.","Koralek, AC; Jin, X; Ii, JDL; Costa, RM; Carmena, JM",331.0,"[Jin, Xin; Costa, Rui M.] NIAAA, Lab Integrat Neurosci, NIH, Bethesda, MD 20892 USA; [Koralek, Aaron C.; Ii, John D. Long; Carmena, Jose M.] Univ Calif Berkeley, Helen Wills Neurosci Inst, Berkeley, CA 94720 USA; [Carmena, Jose M.] Univ Calif Berkeley, Dept Elect Engn & Comp Sci, Berkeley, CA 94720 USA; [Carmena, Jose M.] Univ Calif Berkeley, Program Cognit Sci, Berkeley, CA 94720 USA; [Carmena, Jose M.] Univ Calif Berkeley, UC Berkeley & UC San Francisco Joint Grad Grp Bio, Berkeley, CA 94720 USA; [Costa, Rui M.] Champalimaud Ctr Unknown, Champalimaud Neurosci Programme, P-1400038 Lisbon, Portugal",,,11/20/17,,10.1038/nature10845,Article,,ruicosta@fchampalimaud.org; carmena@eecs.berkeley.edu,335,National Science Foundation [0954243]; Multiscale Systems Research Center; Defense Advanced Research Projects Agency [N66001-10-C-2008]; Division of Intramural Clinical and Basic Research of the National Institute on Alcohol Abuse and Alcoholism [239527]; European Research Council [STG 243393],"We thank S. Venkatraman for the three-axis accelerometer, Y. Li for the RGS9L-Cre mice, K. Nakazawa for the NMDAR1-loxP mice, G. Luo for genotyping, M. Davis for advice on staining and G. Martins for performing immunohistochemistry. This work was supported by National Science Foundation CAREER Award 0954243, the Multiscale Systems Research Center and the Defense Advanced Research Projects Agency contract N66001-10-C-2008 to J. M. C., and the Division of Intramural Clinical and Basic Research of the National Institute on Alcohol Abuse and Alcoholism, Marie Curie International Reintegration Grant 239527 and European Research Council STG 243393 to R.M.C.",908HP,,,COGNITIVE SKILL; PREFRONTAL CORTEX; STRIATAL NEURONS; MOTOR CORTEX; ACQUISITION; CONSOLIDATION; PERFORMANCE; CONTINGENCY; ACTIVATION; NETWORKS,7389.0,NATURE,Nature,English,30.0,No,"Koralek, Aaron/0000-0001-5205-0171; Costa, Rui/0000-0003-0495-8374","MACMILLAN BUILDING, 4 CRINAN ST, LONDON N1 9XW, ENGLAND",15-Mar,5.0,LONDON,22388818.0,J,NATURE PUBLISHING GROUP,2012.0,,"Costa, RM (reprint author), NIAAA, Lab Integrat Neurosci, NIH, 5625 Fishers Lane, Bethesda, MD 20892 USA.",Science & Technology - Other Topics,0028-0836,NATURE,131.0,Corticostriatal plasticity is necessary for learning intentional neuroprosthetic skills,0.0,38.0,WOS:000301481800049,191.0,483,Multidisciplinary Sciences,132,jose m.,carmena,85.0,3,male,1.0,yTIIzd0AAAAJ,1,"[0, 1474]",na,0,na,0,na,na,0,0
2,63,324.0,"mu-Opioid receptors (mu ORs) are G-protein-coupled receptors that are activated by a structurally diverse spectrum of natural and synthetic agonists including endogenous endorphin peptides, morphine and methadone. The recent structures of the mu OR in inactive(1) and agonist-induced active states (Huang et al., ref. 2) provide snapshots of the receptor at the beginning and end of a signalling event, but little is known about the dynamic sequence of events that span these two states. Here we use solution-state NMR to examine the process of mu OR activation using a purified receptor (mouse sequence) preparation in an amphiphile membrane-like environment. We obtain spectra of the mu OR in the absence of ligand, and in the presence of the high-affinity agonist BU72 alone, or with BU72 and a G protein mimetic nanobody. Our results show that conformational changes in transmembrane segments 5 and 6 (TM5 and TM6), which are required for the full engagement of a G protein, are almost completely dependent on the presence of both the agonist and the G protein mimetic nanobody, revealing a weak allosteric coupling between the agonist-binding pocket and the G-protein-coupling interface (TM5 and TM6), similar to that observed for the beta 2-adrenergic receptor(3). Unexpectedly, in the presence of agonist alone, we find larger spectral changes involving intracellular loop 1 and helix 8 compared to changes in TM5 and TM6. These results suggest that one or both of these domains may play a role in the initial interaction with the G protein, and that TM5 and TM6 are only engaged later in the process of complex formation. The initial interactions between the G protein and intracellular loop 1 and/or helix 8 may be involved in G-protein coupling specificity, as has been suggested for other family A G-protein-coupled receptors.","Sounier, Remy; Mas, Camille; Steyaert, Jan; Laeremans, Toon; Manglik, Aashish; Huang, Weijiao; Kobilka, Brian K.; Demene, Helene; Granier, Sebastien","Sounier, R; Mas, C; Steyaert, J; Laeremans, T; Manglik, A; Huang, WJ; Kobilka, BK; Demene, H; Granier, S",375.0,"[Sounier, Remy; Mas, Camille; Granier, Sebastien] Univ Montpellier, Inst Genom Fonct, CNRS, INSERM,U1191,UMR 5203, F-34000 Montpellier, France; [Steyaert, Jan; Laeremans, Toon] Vrije Univ Brussel, Struct Biol Brussels, B-1050 Brussels, Belgium; [Steyaert, Jan; Laeremans, Toon] VIB, Struct Biol Res Ctr, B-1050 Brussels, Belgium; [Manglik, Aashish; Huang, Weijiao; Kobilka, Brian K.] Stanford Univ, Sch Med, Dept Mol & Cellular Physiol, Stanford, CA 94305 USA; [Demene, Helene] Univ Montpellier, Ctr Biochim Struct, CNRS, INSERM 1054,UMR 5048, F-34090 Montpellier, France",,,11/19/17,,10.1038/nature14680,Article,1476-4687,helene@cbs.cnrs.fr; sebastien.granier@igf.cnrs.fr,+,INSERM; CNRS; National Institutes of Health [NIDA-DA036246],We acknowledge support from INSERM (S.G.) and CNRS (H.D.) and from the National Institutes of Health Grant (NIDA-DA036246 to B.K.K. and S.G.). We also acknowledge the National Institute of Drug Abuse Drug Supply Program for providing [Dmt1] DALDA.,CP2NN,Y,N,PROTEIN-COUPLED RECEPTOR; BETA(2)-ADRENERGIC RECEPTOR; CRYSTAL-STRUCTURE; NMR-SPECTROSCOPY; DYNAMIC PROCESS; ANALGESIA; EFFICACY; RHODOPSIN; AGONIST; COMPLEX,7565.0,NATURE,Nature,English,28.0,No,"Steyaert, Jan/0000-0002-3825-874X; ","MACMILLAN BUILDING, 4 CRINAN ST, LONDON N1 9XW, ENGLAND",20-Aug,12.0,LONDON,26245377.0,J,NATURE PUBLISHING GROUP,2015.0,"Steyaert, Jan/H-4662-2011; Granier, Sebastien/J-1089-2016","Granier, S (reprint author), Univ Montpellier, Inst Genom Fonct, CNRS, INSERM,U1191,UMR 5203, F-34000 Montpellier, France.",Science & Technology - Other Topics,0028-0836,NATURE,62.0,Propagation of conformational changes during mu-opioid receptor activation,11.0,81.0,WOS:000359714000041,324.0,524,Multidisciplinary Sciences,63,sebastien,granier,20.0,112,male,1.0,uo7xXeAAAAAJ,1,"[0, 1474]",na,0,na,0,na,na,0,0
3,2,260.0,"To establish productive infection, a retrovirus must insert a DNA replica of its genome into host cell chromosomal DNA(1,2). This process is operated by the intasome, a nucleoprotein complex composed of an integrase tetramer (IN) assembled on the viral DNA ends(3,4). The intasome engages chromosomal DNA within a target capture complex to carry out strand transfer, irreversibly joining the viral and cellular DNA molecules. Although several intasome/transpososome structures from the DDE(D) recombinase superfamily have been reported(4-6), the mechanics of target DNA capture and strand transfer by these enzymes remained unclear. Here we report crystal structures of the intasome from prototype foamy virus in complex with target DNA, elucidating the pre-integration target DNA capture and post-catalytic strand transfer intermediates of the retroviral integration process. The cleft between IN dimers within the intasome accommodates chromosomal DNA in a severely bent conformation, allowing widely spaced IN active sites to access the scissile phosphodiester bonds. Our results resolve the structural basis for retroviral DNA integration and provide a framework for the design of INs with altered target sequences.","Maertens, Goedele N.; Hare, Stephen; Cherepanov, Peter","Maertens, GN; Hare, S; Cherepanov, P",326.0,"[Maertens, Goedele N.; Hare, Stephen; Cherepanov, Peter] Univ London Imperial Coll Sci Technol & Med, Div Infect Dis, London W2 1PG, England",,,11/20/17,,10.1038/nature09517,Article,1476-4687,p.cherepanov@imperial.ac.uk,U217,UK Medical Research Council,"We thank A. Engelman and F. Dyda for critical reading of the manuscript, J. Sanchez-Weatherby for assistance with X-ray data collection at the I02 beamline of the Diamond Light Source and J. Moore for help with crystallization screening and the X-ray generator. This work was funded by the UK Medical Research Council.",678DG,,,VIRUS INTEGRASE; DNA INTEGRATION; FOAMY VIRUS; AMINO-ACID; SITES; TRANSPOSITION; INHIBITION; INTASOME; COMPLEX; CELLS,7321.0,NATURE,Nature,English,26.0,No,"Cherepanov, Peter/0000-0002-0634-538X; Maertens, Goedele/0000-0002-1963-8026; Hare, Stephen/0000-0003-2951-1595","MACMILLAN BUILDING, 4 CRINAN ST, LONDON N1 9XW, ENGLAND",11-Nov,5.0,LONDON,21068843.0,J,NATURE PUBLISHING GROUP,2010.0,"Cherepanov, Peter/F-6859-2010; Maertens, Goedele/D-8628-2015","Cherepanov, P (reprint author), Univ London Imperial Coll Sci Technol & Med, Div Infect Dis, St Marys Campus,Norfolk Pl, London W2 1PG, England.",Science & Technology - Other Topics,0028-0836,NATURE,170.0,The mechanism of retroviral integration from X-ray structures of its key intermediates,2.0,16.0,WOS:000284051000055,260.0,468,Multidisciplinary Sciences,171,peter,cherepanov,8.0,4373,male,1.0,6rCD_4AAAAAJ,1,"[0, 1474]",12935070,1,436077,1,2007 Super Series,2007 Super Series,0,0
4,49,22.0,"The contribution of co-translational chaperone functions to protein folding is poorly understood. Ribosome-associated trigger factor (TF) is the first molecular chaperone encountered by nascent polypeptides in bacteria. Here we show, using fluorescence spectroscopy to monitor TF function and structural rearrangements in real time, that TF interacts with ribosomes and translating polypeptides in a dynamic reaction cycle. Ribosome binding stabilizes TF in an open, activated conformation. Activated TF departs from the ribosome after a mean residence time of similar to 10 s, but may remain associated with the elongating nascent chain for up to 35 s, allowing entry of a new TF molecule at the ribosome docking site. The duration of nascent-chain interaction correlates with the occurrence of hydrophobic motifs in translating polypeptides, reflecting a high aggregation propensity. These findings can explain how TF prevents misfolding events during translation and may provide a paradigm for the regulation of nucleotide-independent chaperones.","Kaiser, Christian M.; Chang, Hung-Chun; Agashe, Vishwas R.; Lakshmipathy, Sathish K.; Etchells, Stephanie A.; Hayer-Hartl, Manajit; Hartl, F. Ulrich; Barral, Jose M.","Kaiser, CM; Chang, HC; Agashe, VR; Lakshmipathy, SK; Etchells, SA; Hayer-Hartl, M; Hartl, FU; Barral, JM",455.0,"Max Planck Inst Biochem, Dept Cellular Biochem, D-82152 Martinsried, Germany; Univ Texas, Med Branch, Dept Neurosci & Cell Biol, Galveston, TX 77555 USA",,,11/20/17,,10.1038/nature05225,Article,,uhartl@biochem.mpg.de; jmbarral@utmb.edu,460,,,108BQ,,,SIGNAL-RECOGNITION PARTICLE; ESCHERICHIA-COLI RIBOSOME; MOLECULAR CHAPERONES; NASCENT POLYPEPTIDE; CRYSTAL-STRUCTURE; AMINO-ACID; IN-VIVO; PROTEINS; BINDING; SRP,7118.0,NATURE,Nature,English,44.0,No,,"MACMILLAN BUILDING, 4 CRINAN ST, LONDON N1 9XW, ENGLAND",23-Nov,6.0,LONDON,17051157.0,J,NATURE PUBLISHING GROUP,2006.0,,"Hartl, FU (reprint author), Max Planck Inst Biochem, Dept Cellular Biochem, Klopferspitz 18, D-82152 Martinsried, Germany.",Science & Technology - Other Topics,0028-0836,NATURE,131.0,Real-time observation of trigger factor function on translating ribosomes,2.0,19.0,WOS:000242215700039,22.0,444,Multidisciplinary Sciences,131,jose m.,barral,9.0,3,male,1.0,WzJR7foAAAAJ,1,"[0, 1474]",na,0,na,0,na,na,0,0
5,50,39.0,"The most efficient energy sources known in the Universe are accretion disks. Those around black holes convert 5 - 40 per cent of restmass energy to radiation. Like water circling a drain, inflowing mass must lose angular momentum, presumably by vigorous turbulence in disks, which are essentially inviscid(1). The origin of the turbulence is unclear. Hot disks of electrically conducting plasma can become turbulent by way of the linear magnetorotational instability(2). Cool disks, such as the planet- forming disks of protostars, may be too poorly ionized for the magnetorotational instability to occur, and therefore essentially unmagnetized and linearly stable. Nonlinear hydrodynamic instability often occurs in linearly stable flows ( for example, pipe flows) at sufficiently large Reynolds numbers. Although planet- forming disks have extreme Reynolds numbers, keplerian rotation enhances their linear hydrodynamic stability, so the question of whether they can be turbulent and thereby transport angular momentum effectively is controversial(3-15). Here we report a laboratory experiment, demonstrating that non- magnetic quasi- keplerian flows at Reynolds numbers up to millions are essentially steady. Scaled to accretion disks, rates of angular momentum transport lie far below astrophysical requirements. By ruling out purely hydrodynamic turbulence, our results indirectly support the magnetorotational instability as the likely cause of turbulence, even in cool disks.","Ji, Hantao; Burin, Michael; Schartman, Ethan; Goodman, Jeremy","Ji, HT; Burin, M; Schartman, E; Goodman, J",343.0,"Princeton Univ, Ctr Magnet Self Org Lab & Astrophys Plasmas, Plasma Phys Lab, Princeton, NJ 08543 USA; Princeton Univ, Dept Astrophys Sci, Princeton, NJ 08543 USA",,,11/20/17,,10.1038/nature05323,Article,,hji@pppl.gov,346,,,105GL,,,ROTATING CYLINDERS; ACCRETION DISKS; NONLINEAR STABILITY; SHEAR TURBULENCE; STRATIFIED DISKS; REYNOLDS-NUMBER; INSTABILITY; FLOW; CIRCULATION; EVOLUTION,7117.0,NATURE,Nature,English,32.0,No,,"MACMILLAN BUILDING, 4 CRINAN ST, LONDON N1 9XW, ENGLAND",16-Nov,4.0,LONDON,17108959.0,J,NATURE PUBLISHING GROUP,2006.0,,"Ji, HT (reprint author), Princeton Univ, Ctr Magnet Self Org Lab & Astrophys Plasmas, Plasma Phys Lab, Princeton, NJ 08543 USA.",Science & Technology - Other Topics,0028-0836,NATURE,139.0,Hydrodynamic turbulence cannot transport angular momentum effectively in astrophysical disks,0.0,16.0,WOS:000242018300042,39.0,444,Multidisciplinary Sciences,139,jeremy,goodman,98.0,1840,male,0.99,OUIu4uoAAAAJ,1,"[0, 1474]",42790519,1,17914517,1,Chloe Goodman,Chloe Goodman,1,1
6,101,366.0,"More than half of mammalian genes generate multiple messenger RNA isoforms that differ in their 3' untranslated regions (3' UTRs) and therefore in regulatory sequences(1), often associated with cell proliferation and cancer(2,3); however, the mechanisms coordinating alternative 3'-UTR processing for specific mRNA populations remain poorly defined. Here we report that the cytoplasmic-polyadenylation element binding protein 1 (CPEB1), an RNA-binding protein that regulates mRNA translation(4), also controls alternative 3'-UTR processing. CPEB1 shuttles to the nudeus(5,6), where it co-localizes with splicing factors and mediates shortening of hundreds of mRNA 3' UTRs, thereby modulating their translation efficiency in the cytoplasm. CPEB1-mediated 3'-UTR shortening correlates with cell proliferation and tumorigenesis. CPEB1 binding to pre-mRNAs not only directs the use of alternative polyadenylation sites, but also changes alternative splicing by preventing U2AF65 recruitment. Our results reveal a novel function of CPEB1 in mediating alternative 3'-UTR processing, which is coordinated with regulation of mRNA translation, through its dual nuclear and cytoplasmic functions.","Bava, Felice-Alessio; Eliscovich, Carolina; Ferreira, Pedro G.; Minana, Belen; Ben-Dov, Claudia; Guigo, Roderic; Valcarcel, Juan; Mendez, Raul","Bava, FA; Eliscovich, C; Ferreira, PG; Minana, B; Ben-Dov, C; Guigo, R; Valcarcel, J; Mendez, R",121.0,"[Bava, Felice-Alessio; Mendez, Raul] Inst Res Biomed IRB Barcelona, Barcelona 08028, Spain; [Eliscovich, Carolina; Ferreira, Pedro G.; Minana, Belen; Ben-Dov, Claudia; Guigo, Roderic; Valcarcel, Juan] UPF, Ctr Genom Regulat CRG, Barcelona 08003, Spain; [Valcarcel, Juan; Mendez, Raul] Passeig Lluis Co 23, ICREA, Barcelona 08010, Spain",,,11/20/17,,10.1038/nature11901,Article,,raul.mendez@irbbarcelona.org,125,"Consolider; MICINN; Generalitat de Catalunya; RNAREG; AICR; EURASNET; Fundacion Marcelino Botin; National Institutes of Health; Instituto de Salud Carlos III; ""la Caixa"" predoctoral fellowship; FCT-Portugal; Spanish MICINN; ICREA","We thank A. Nebreda, R. Gomis, T. Yates, M. Fernandez, V. Giangarra, J. P. Tavanez, F. Lai, I. Novoa, J. La Cava and members of the Valcarcel and Mendez laboratories for comments on the manuscript and other contributions. We also thank the Ultrasequencing Units (CRG, IRB) and the Microscopy Units (CRG, IRB) for technical assistance. This work was funded by research grants as follows: from Consolider, MICINN and Generalitat de Catalunya to J.V., R.G. and R.M.; from RNAREG to J.V. and R.M.; from AICR to R.M.; from EURASNET and Fundacion Marcelino Botin to J.V.; and from the National Institutes of Health and Instituto de Salud Carlos III to R.G. F.-A.B. holds a ""la Caixa"" predoctoral fellowship, and P.G.F was supported by a FCT-Portugal postdoctoral grant and by a Spanish MICINN Consolider grant.",105BE,,,MESSENGER-RNAS; UNTRANSLATED REGIONS; CYTOPLASMIC POLYADENYLATION; CHROMOSOME SEGREGATION; CELLS; MECHANISMS; INSIGHTS; COMPLEX,7439.0,NATURE,Nature,English,23.0,No,"Valcarcel, Juan/0000-0001-5398-3571; Guigo, Roderic/0000-0002-5738-4477; minana, belen/0000-0001-7676-5788; Ferreira, Pedro/0000-0003-3838-8664; Mendez, Raul/0000-0002-1952-6905","MACMILLAN BUILDING, 4 CRINAN ST, LONDON N1 9XW, ENGLAND",7-Mar,5.0,LONDON,23434754.0,J,NATURE PUBLISHING GROUP,2013.0,"Valcarcel, Juan/O-9814-2014; Guigo, Roderic/D-1303-2010; minana, belen/K-5530-2015; Ferreira, Pedro/J-6379-2013","Mendez, R (reprint author), Inst Res Biomed IRB Barcelona, Baldiri Reixac 10, Barcelona 08028, Spain.",Science & Technology - Other Topics,0028-0836,NATURE,54.0,CPEB1 coordinates alternative 3 ' -UTR formation with translational regulation,4.0,47.0,WOS:000316039800052,366.0,495,Multidisciplinary Sciences,56,raul,mendez,1421.0,821,male,1.0,Brl2udAAAAAJ,1,"[0, 1474]",40286951,1,10715560,1,Raúl Méndez,Raúl Méndez,0,0
