,Unnamed: 0.1,Unnamed: 0.1.1,AB,AF,AU,BP,C1,CA,CR,DA,DE,DI,DT,EI,EM,EP,FU,FX,GA,HC,HP,ID,IS,J9,JI,LA,NR,OA,OI,PA,PD,PG,PI,PM,PT,PU,PY,RI,RP,SC,SN,SO,TC,TI,U1,U2,UT,Unnamed: 0.1.1.1,VL,WC,Z9,c_fname,c_lname,citedby,count,gender,probability,scholar_id,quantile,range,page_id,has_page,page_id_nature,has_page_nature,page_title,page_title_nature,page_title_match,page_title_match_nature
70,42,216.0,"The early vertebrate skeletal muscle is a well- organized tissue in which the primitive muscle fibres, the myocytes, are all parallel and aligned along the antero- posterior axis of the embryo. How myofibres acquire their orientation during development is unknown. Here we show that during early chick myogenesis WNT11 has an essential role in the oriented elongation of the myocytes. We find that the neural tube, known to drive WNT11 expression in the medial border of somites(1), is necessary and sufficient to orient myocyte elongation. We then show that the specific inhibition of WNT11 function in somites leads to the disorganization of myocytes. We establish that WNT11 mediates this effect through the evolutionary conserved planar cell polarity ( PCP) pathway, downstream of the WNT/beta-catenin-dependent pathway, required to initiate the myogenic program of myocytes and WNT11 expression. Finally, we demonstrate that a localized ectopic source of WNT11 can markedly change the orientation of myocytes, indicating that WNT11 acts as a directional cue in this process. All together, these data show that the sequential action of the WNT/ PCP and the WNT/beta-catenin pathways is necessary for the formation of fully functional embryonic muscle fibres. This study also provides evidence that WNTs can act as instructive cues to regulate the PCP pathway in vertebrates.","Gros, Jerome; Serralbo, Olivier; Marcelle, Christophe","Gros, J; Serralbo, O; Marcelle, C",589.0,"[Gros, Jerome; Serralbo, Olivier; Marcelle, Christophe] Univ Aix Marseille 2, CNRS, Dev Biol Inst Marseille Luminy IBDML, UMR 6216, F-13288 Marseille 09, France",,,11/20/17,,10.1038/nature07564,Article,,marcelle@ibdm.univ-mrs.fr,U97,Actions Concertees Incitatives; Agence Nationale de la Recherche; Association Francaise contre les Myopathies; EU 6th Framework Programme Network of Excellence MYORES,"We thank C. Tabin for critical reading of the manuscript. The help of P. Weber for the two- photon imaging, and of the Zeiss team, are acknowledged. We are grateful to M. Manceau for Supplementary Fig. 1d, and to R. Kanadia for his help. This study was funded by grants from the Actions Concertees Incitatives (ACI), the Agence Nationale de la Recherche (ANR), the Association Francaise contre les Myopathies (AFM) and by the EU 6th Framework Programme Network of Excellence MYORES. J. G. was a Fellow of the AFM.",400FA,,,CONVERGENT EXTENSION MOVEMENTS; CELL POLARITY; SUBCELLULAR-LOCALIZATION; SIGNALING PATHWAYS; PLANAR POLARITY; NEURAL-TUBE; GASTRULATION; PRICKLE; MEDIATE; CHICK,7229.0,NATURE,Nature,English,35.0,No,"Gros, Jerome/0000-0002-2264-2851","MACMILLAN BUILDING, 4 CRINAN ST, LONDON N1 9XW, ENGLAND",29-Jan,6.0,LONDON,18987628.0,J,NATURE PUBLISHING GROUP,2009.0,,"Marcelle, C (reprint author), Univ Aix Marseille 2, CNRS, Dev Biol Inst Marseille Luminy IBDML, UMR 6216, Campus Luminy,Case 907, F-13288 Marseille 09, France.",Science & Technology - Other Topics,0028-0836,NATURE,98.0,WNT11 acts as a directional cue to organize the elongation of early muscle fibres,0.0,11.0,WOS:000262852200043,216.0,457,Multidisciplinary Sciences,99,christophe,marcelle,4545.0,629,male,0.99,GikrxXcAAAAJ,3,"(4126, 9345]",na,0,na,0,na,na,0,0
71,74,391.0,"The Plio-Pleistocene site of Dmanisi, Georgia, has yielded a rich fossil and archaeological record documenting an early presence of the genus Homo outside Africa. Although the craniomandibular morphology of early Homo is well known as a result of finds from Dmanisi and African localities, data about its postcranial morphology are still relatively scarce. Here we describe newly excavated postcranial material from Dmanisi comprising a partial skeleton of an adolescent individual, associated with skull D2700/D2735, and the remains from three adult individuals. This material shows that the postcranial anatomy of the Dmanisi hominins has a surprising mosaic of primitive and derived features. The primitive features include a small body size, a low encephalization quotient and absence of humeral torsion; the derived features include modern-human-like body proportions and lower limb morphology indicative of the capability for long-distance travel. Thus, the earliest known hominins to have lived outside of Africa in the temperate zones of Eurasia did not yet display the full set of derived skeletal features.","Lordkipanidze, David; Jashashvili, Tea; Vekua, Abesalom; de Leon, Marcia S. Ponce; Zollikofer, Christoph P. E.; Rightmire, G. Philip; Pontzer, Herman; Ferring, Reid; Oms, Oriol; Tappen, Martha; Bukhsianidze, Maia; Agusti, Jordi; Kahlke, Ralf; Kiladze, Gocha; Martinez-Navarro, Bienvenido; Mouskhelishvili, Alexander; Nioradze, Medea; Rook, Lorenzo","Lordkipanidze, D; Jashashvili, T; Vekua, A; de Leon, MSP; Zollikofer, CPE; Rightmire, GP; Pontzer, H; Ferring, R; Oms, O; Tappen, M; Bukhsianidze, M; Agusti, J; Kahlke, R; Kiladze, G; Martinez-Navarro, B; Mouskhelishvili, A; Nioradze, M; Rook, L",305.0,"Georgian Natl Museum, GE-0105 Tbilisi, Rep of Georgia; Univ Florence, Dipartimento Sci Terra, I-50121 Florence, Italy; Othar Lordkipanidze Ctr Archaeol Res, GE-0102 Tbilisi, Rep of Georgia; Senckenberg Res Inst, D-99423 Weimar, Germany; Univ Rovira & Virgili, Inst Human Paleoecol, ICREA, Tarragona, Spain; Univ Minnesota, Dept Anthropol, Minneapolis, MN 55455 USA; Univ Autonoma Barcelona, Dept Geol, Bellaterra, Spain; Univ N Texas, Dept Geog, Denton, TX 76203 USA; Washington Univ, Dept Anthropol, St Louis, MO 63130 USA; Harvard Univ, Peabody Museum, Dept Anthropol, Cambridge, MA 02138 USA; Univ Zurich, Inst Anthropol, CH-8057 Zurich, Switzerland",,,11/20/17,,10.1038/nature06134,Article,,dlordkipanidze@museum.ge,310,ICREA,,211XP,Y,N,EAST-RUDOLF; AUSTRALOPITHECUS-AFRICANUS; PLIOPLEISTOCENE HOMINID; LATE PLEISTOCENE; OLDUVAI-GORGE; BODY-SIZE; PROPORTIONS; ETHIOPIA; KENYA; HABILIS,7160.0,NATURE,Nature,English,50.0,No,"Rook, Lorenzo/0000-0001-8923-5428; Martinez-Navarro, Bienvenido/0000-0002-8374-5109; Oms, Oriol/0000-0001-8355-847X","MACMILLAN BUILDING, 4 CRINAN ST, LONDON N1 9XW, ENGLAND",20-Sep,6.0,LONDON,17882214.0,J,NATURE PUBLISHING GROUP,2007.0,"Rook, Lorenzo/D-9675-2011; Martinez-Navarro, Bienvenido/L-5950-2014","Lordkipanidze, D (reprint author), Georgian Natl Museum, GE-0105 Tbilisi, Rep of Georgia.",Science & Technology - Other Topics,0028-0836,NATURE,287.0,"Postcranial evidence from early Homo from Dmanisi, Georgia",9.0,86.0,WOS:000249557300038,391.0,449,Multidisciplinary Sciences,299,lorenzo,rook,5417.0,496,male,1.0,u915ttUAAAAJ,3,"(4126, 9345]",na,0,na,0,na,na,0,0
72,106,307.0,"Cell division requires the precise coordination of chromosome segregation and cytokinesis. This coordination is achieved by the recruitment of an actomyosin regulator, Ect2, to overlapping microtubules at the centre of the elongating anaphase spindle(1). Ect2 then signals to the overlying cortex to promote the assembly and constriction of an actomyosin ring between segregating chromosomes(1). Here, by studying division in proliferating Drosophila and human cells, we demonstrate the existence of a second, parallel signalling pathway, which triggers the relaxation of the polar cell cortex at mid anaphase. This is independent of furrow formation, centrosomes and microtubules and, instead, depends on PP1 phosphatase and its regulatory subunit Sds22 (refs 2, 3). As separating chromosomes move towards the polar cortex at mid anaphase, kinetochore-localized PP1-Sds22 helps to break cortical symmetry by inducing the dephosphorylation and inactivation of ezrin/radixin/moesin proteins at cell poles. This promotes local softening of the cortex(2,3), facilitating anaphase elongation and orderly cell division. In summary, this identifies a conserved kinetochore-based phosphatase signal and substrate, which function together to link anaphase chromosome movements to cortical polarization, thereby coupling chromosome segregation to cell division.","Rodrigues, Nelio T. L.; Lekomtsev, Sergey; Jananji, Silvana; Kriston-Vizi, Janos; Hickson, Gilles R. X.; Baum, Buzz","Rodrigues, NTL; Lekomtsev, S; Jananji, S; Kriston-Vizi, J; Hickson, GRX; Baum, B",489.0,"[Rodrigues, Nelio T. L.; Lekomtsev, Sergey; Kriston-Vizi, Janos; Baum, Buzz] UCL, MRC Lab Mol Cell Biol, London WC1E 6BT, England; [Jananji, Silvana; Hickson, Gilles R. X.] St Justine Hosp Res Ctr, Montreal, PQ H3T 1C5, Canada; [Hickson, Gilles R. X.] Univ Montreal, Dept Pathol & Cell Biol, Montreal, PQ H3T 1J4, Canada; [Baum, Buzz] UCL, Inst Phys Living Syst, London WC1E 6BT, England; [Baum, Buzz] Inst Curie, CelTisPhyBio Labex, F-75248 Paris 05, France",,,11/19/17,,10.1038/nature14496,Article,1476-4687,b.baum@ucl.ac.uk,+,Cancer Research UK; Medical Research Council; Canadian Institutes of Health Research; Canada Foundation for Innovation; Fonds de Recherche du Quebec-Sante; Cole Foundation; INCa; BBSRC [BB/K009001/1],"N.T.L.R., S.L. and B.B. thank Cancer Research UK, and J.K.-V. the Medical Research Council for funding. S.J. and G.R.X.H. were funded by the Canadian Institutes of Health Research, the Canada Foundation for Innovation and a salary award from the Fonds de Recherche du Quebec-Sante, and G.R.X.H. thanks the Cole Foundation for a Transition award. This study benefited from support from INCa and the BBSRC (BB/K009001/1). We thank M. Lam, E. Paluch, M. Petronczki, G. Salbreux and members of the Baum laboratory for input and critical reading of the manuscript.",CP7LN,,,CELL-SHAPE CHANGES; AURORA B; CYTOKINESIS; SPINDLE; DROSOPHILA; POLARIZATION; ANAPHASE; CONTRACTILITY; MEMBRANE; POSITION,7566.0,NATURE,Nature,English,35.0,No,"Kriston-Vizi, Janos/0000-0002-0149-145X; Baum, Buzz/0000-0002-9201-6186","MACMILLAN BUILDING, 4 CRINAN ST, LONDON N1 9XW, ENGLAND",27-Aug,23.0,LONDON,26168397.0,J,NATURE PUBLISHING GROUP,2015.0,"Kriston-Vizi, Janos/L-6021-2013","Baum, B (reprint author), UCL, MRC Lab Mol Cell Biol, Gower St, London WC1E 6BT, England.",Science & Technology - Other Topics,0028-0836,NATURE,13.0,Kinetochore-localized PP1-Sds22 couples chromosome segregation to polar relaxation,2.0,21.0,WOS:000360069300043,307.0,524,Multidisciplinary Sciences,13,buzz,baum,5963.0,15,male,1.0,FEfP9AsAAAAJ,3,"(4126, 9345]",30229971,1,47152640,1,Harry Neal Baum,Harry Neal Baum,1,1
73,9,220.0,"Bose-Einstein condensation (BEC)-the macroscopic ground-state accumulation of particles with integer spin (bosons) at low temperature and high density-has been observed in several physical systems(1-9), including cold atomic gases and solid-state quasiparticles. However, the most omnipresent Bose gas, blackbody radiation (radiation in thermal equilibrium with the cavity walls) does not show this phase transition. In such systems photons have a vanishing chemical potential, meaning that their number is not conserved when the temperature of the photon gas is varied(10); at low temperatures, photons disappear in the cavity walls instead of occupying the cavity ground state. Theoretical works have considered thermalization processes that conserve photon number (a prerequisite for BEC), involving Compton scattering with a gas of thermal electrons(11) or photon-photon scattering in a nonlinear resonator configuration(12,13). Number-conserving thermalization was experimentally observed(14) for a two-dimensional photon gas in a dye-filled optical microcavity, which acts as a 'white-wall' box. Here we report the observation of a Bose-Einstein condensate of photons in this system. The cavity mirrors provide both a confining potential and a nonvanishing effective photon mass, making the system formally equivalent to a two-dimensional gas of trapped, massive bosons. The photons thermalize to the temperature of the dye solution (room temperature) by multiple scattering with the dye molecules. Upon increasing the photon density, we observe the following BEC signatures: the photon energies have a Bose-Einstein distribution with a massively populated ground-state mode on top of a broad thermal wing; the phase transition occurs at the expected photon density and exhibits the predicted dependence on cavity geometry; and the ground-state mode emerges even for a spatially displaced pump spot. The prospects of the observed effects include studies of extremely weakly interacting low-dimensional Bose gases(9) and new coherent ultraviolet sources(15).","Klaers, Jan; Schmitt, Julian; Vewinger, Frank; Weitz, Martin","Klaers, J; Schmitt, J; Vewinger, F; Weitz, M",545.0,"[Klaers, Jan; Schmitt, Julian; Vewinger, Frank; Weitz, Martin] Univ Bonn, Inst Angew Phys, D-53115 Bonn, Germany",,,11/20/17,,10.1038/nature09567,Article,,martin.weitz@uni-bonn.de,548,Deutsche Forschungsgemeinschaft within the focused research unit [FOR557]; IFRAF at LKB Paris,"We thank J. Dalibard and Y. Castin for discussions. Financial support from the Deutsche Forschungsgemeinschaft within the focused research unit FOR557 is acknowledged. M.W. thanks the IFRAF for support of a guest stay at LKB Paris, where part of the discussion on interacting two-dimensional photon gases was developed.",684WA,Y,N,EXCITON POLARITONS; PHASE-TRANSITION; CAVITY; GAS; LASERS,7323.0,NATURE,Nature,English,30.0,No,"Klaers, Jan/0000-0001-5939-7477; Vewinger, Frank/0000-0001-7818-2981; Schmitt, Julian/0000-0002-0002-3777","MACMILLAN BUILDING, 4 CRINAN ST, LONDON N1 9XW, ENGLAND",25-Nov,4.0,LONDON,21107426.0,J,NATURE PUBLISHING GROUP,2010.0,"Klaers, Jan/N-9793-2016","Weitz, M (reprint author), Univ Bonn, Inst Angew Phys, Wegelerstr 8, D-53115 Bonn, Germany.",Science & Technology - Other Topics,0028-0836,NATURE,237.0,Bose-Einstein condensation of photons in an optical microcavity,4.0,84.0,WOS:000284584200038,220.0,468,Multidisciplinary Sciences,237,martin,weitz,6328.0,3568,male,1.0,XBYSdPwAAAAJ,3,"(4126, 9345]",na,0,na,0,na,na,0,0
74,24,167.0,"Polycomb group (PcG) proteins are transcriptional repressors that control processes ranging from the maintenance of cell fate decisions and stem cell pluripotency in animals to the control of flowering time in plants(1-6). In Drosophila, genetic studies identified more than 15 different PcG proteins that are required to repress homeotic (HOX) and other developmental regulator genes in cells where they must stay inactive(1,7,8). Biochemical analyses established that these PcG proteins exist in distinct multiprotein complexes that bind to and modify chromatin of target genes(1-4). Among those, Polycomb repressive complex 1 (PRC1) and the related dRing-associated factors (dRAF) complex contain an E3 ligase activity for monoubiquitination of histone H2A (refs 1-4). Here we show that the uncharacterized Drosophila PcG gene calypso encodes the ubiquitin carboxy-terminal hydrolase BAP1. Biochemically purified Calypso exists in a complex with the PcG protein ASX, and this complex, named Polycomb repressive deubiquitinase (PR-DUB), is bound at PcG target genes in Drosophila. Reconstituted recombinant Drosophila and human PR-DUB complexes remove monoubiquitin from H2A but not from H2B in nucleosomes. Drosophila mutants lacking PR-DUB show a strong increase in the levels of monoubiquitinated H2A. A mutation that disrupts the catalytic activity of Calypso, or absence of the ASX subunit abolishes H2A deubiquitination in vitro and HOX gene repression in vivo. Polycomb gene silencing may thus entail adynamic balance between H2A ubiquitination by PRC1 and dRAF, and H2A deubiquitination by PR-DUB.","Scheuermann, Johanna C.; Alonso, Andres Gaytan de Ayala; Oktaba, Katarzyna; Ly-Hartig, Nga; McGinty, Robert K.; Fraterman, Sven; Wilm, Matthias; Muir, Tom W.; Mueller, Juerg","Scheuermann, JC; Alonso, AGD; Oktaba, K; Ly-Hartig, N; McGinty, RK; Fraterman, S; Wilm, M; Muir, TW; Muller, J",243.0,"[Scheuermann, Johanna C.; Alonso, Andres Gaytan de Ayala; Oktaba, Katarzyna; Ly-Hartig, Nga; Fraterman, Sven; Wilm, Matthias; Mueller, Juerg] European Mol Biol Lab, D-69117 Heidelberg, Germany; [McGinty, Robert K.; Muir, Tom W.] Rockefeller Univ, New York, NY 10065 USA",,,11/20/17,,10.1038/nature08966,Article,,juerg.mueller@embl.de,U138,NIH [RC2CA148354]; EMBL; DFG,"We thank T. Sixma and G. Buchwald for the gift of proteins, H. W. Brock, R. E. Kingston, B. Korn and B. Turner for plasmids, baculoviruses and antibodies, V. Benes, J. de Graaf, S. Muller and A. Riddell for technical support, and W. Huber and J. Gagneur for discussions. T. W. M. is supported by NIH grant RC2CA148354. J. C. S., A. G. A. A., K.O., N.L.-H. and J. M. are supported by EMBL and by grants from the DFG.",594SS,,,GROUP PROTEIN COMPLEXES; BITHORAX COMPLEX; DROSOPHILA; GENES; MECHANISMS; CORE; TRIMETHYLATION; UBIQUITINATION; UBIQUITYLATION; HYDROLASES,7295.0,NATURE,Nature,English,40.0,No,,"MACMILLAN BUILDING, 4 CRINAN ST, LONDON N1 9XW, ENGLAND",13-May,7.0,LONDON,20436459.0,J,NATURE PUBLISHING GROUP,2010.0,,"Muller, J (reprint author), European Mol Biol Lab, Meyerhofstr 1, D-69117 Heidelberg, Germany.",Science & Technology - Other Topics,0028-0836,NATURE,323.0,Histone H2A deubiquitinase activity of the Polycomb repressive complex PR-DUB,2.0,36.0,WOS:000277558500041,167.0,465,Multidisciplinary Sciences,334,juerg,mueller,6002.0,2,male,1.0,qU5PVzAAAAAJ,3,"(4126, 9345]",na,0,na,0,na,na,0,0
75,18,490.0,"Graphene nanoribbons-narrow and straight-edged stripes of graphene, or single-layer graphite-are predicted to exhibit electronic properties that make them attractive for the fabrication of nanoscale electronic devices(1-3). In particular, although the twodimensional parent material graphene(4,5) exhibits semimetallic behaviour, quantum confinement and edge effects(2,6) should render all graphene nanoribbons with widths smaller than 10 nm semiconducting. But exploring the potential of graphene nanoribbons is hampered by their limited availability: although they have been made using chemical(7-9), sonochemical(10) and lithographic(11,12) methods as well as through the unzipping of carbon nanotubes(13-16), the reliable production of graphene nanoribbons smaller than 10 nm with chemical precision remains a significant challenge. Here we report a simple method for the production of atomically precise graphene nanoribbons of different topologies and widths, which uses surface-assisted coupling(17,18) of molecular precursors into linear polyphenylenes and their subsequent cyclodehydrogenation(19,20). The topology, width and edge periphery of the graphene nanoribbon products are defined by the structure of the precursor monomers, which can be designed to give access to a wide range of different graphene nanoribbons. We expect that our bottom-up approach to the atomically precise fabrication of graphene nanoribbons will finally enable detailed experimental investigations of the properties of this exciting class of materials. It should even provide a route to graphene nanoribbon structures with engineered chemical and electronic properties, including the theoretically predicted intraribbon quantum dots(21), superlattice structures(22) and magnetic devices based on specific graphene nanoribbon edge states(3).","Cai, Jinming; Ruffieux, Pascal; Jaafar, Rached; Bieri, Marco; Braun, Thomas; Blankenburg, Stephan; Muoth, Matthias; Seitsonen, Ari P.; Saleh, Moussa; Feng, Xinliang; Muellen, Klaus; Fasel, Roman","Cai, JM; Ruffieux, P; Jaafar, R; Bieri, M; Braun, T; Blankenburg, S; Muoth, M; Seitsonen, AP; Saleh, M; Feng, XL; Mullen, K; Fasel, R",470.0,"[Cai, Jinming; Ruffieux, Pascal; Jaafar, Rached; Bieri, Marco; Braun, Thomas; Blankenburg, Stephan; Fasel, Roman] Empa, Swiss Fed Labs Mat Sci & Technol, Nanotech Surfaces Lab, CH-3602 Thun, Switzerland; [Cai, Jinming; Ruffieux, Pascal; Jaafar, Rached; Bieri, Marco; Braun, Thomas; Blankenburg, Stephan; Fasel, Roman] Empa, Swiss Fed Labs Mat Sci & Technol, Nanotech Surfaces Lab, CH-8600 Dubendorf, Switzerland; [Muoth, Matthias] ETH, Dept Mech & Proc Engn Micro & Nanosyst, CH-8092 Zurich, Switzerland; [Seitsonen, Ari P.] Univ Zurich, Inst Phys Chem, CH-8057 Zurich, Switzerland; [Seitsonen, Ari P.] CNRS, IMPMC, F-75252 Paris, France; [Seitsonen, Ari P.] Univ Paris 06, F-75252 Paris, France; [Saleh, Moussa; Feng, Xinliang; Muellen, Klaus] Max Planck Inst Polymer Res, D-55124 Mainz, Germany; [Fasel, Roman] Univ Bern, Dept Chem & Biochem, CH-3012 Bern, Switzerland",,,11/20/17,,10.1038/nature09211,Article,,muellen@mpip-mainz.mpg.de; roman.fasel@empa.ch,473,"Swiss National Science Foundation; NCCR Nanoscale Science; Max Planck Society; German Science Foundation (Korean-German IRTG); DFG [SPP 1355, DFG MU 334/32-1]","This work was supported by the Swiss National Science Foundation and the NCCR Nanoscale Science. R.F. and P.R. thank O. Groning and P. Groning for stimulating discussions and continued support. A. P. S. acknowledges discussions with F. Mauri and M. Lazzeri. The Mainz group acknowledges financial support from the Max Planck Society through the program ENERCHEM, the German Science Foundation (Korean-German IRTG), the DFG Priority Program SPP 1355 and DFG MU 334/32-1.",628SJ,Y,N,CARBON NANOTUBES; SURFACES; FILMS; FORM,7305.0,NATURE,Nature,English,30.0,No,"Ruffieux, Pascal/0000-0001-5729-5354; Fasel, Roman/0000-0002-1553-6487; Seitsonen, Ari/0000-0003-4331-0650","MACMILLAN BUILDING, 4 CRINAN ST, LONDON N1 9XW, ENGLAND",22-Jul,4.0,LONDON,20651687.0,J,NATURE PUBLISHING GROUP,2010.0,"Ruffieux, Pascal/E-8227-2010; Fasel, Roman/B-5396-2011; Seitsonen, Ari/B-1552-2009","Fasel, R (reprint author), Empa, Swiss Fed Labs Mat Sci & Technol, Nanotech Surfaces Lab, CH-3602 Thun, Switzerland.",Science & Technology - Other Topics,0028-0836,NATURE,1372.0,Atomically precise bottom-up fabrication of graphene nanoribbons,93.0,1257.0,WOS:000280141200031,490.0,466,Multidisciplinary Sciences,1391,roman,fasel,8520.0,449,male,1.0,gGL8InkAAAAJ,3,"(4126, 9345]",1247406,1,42482555,1,Christian Social Party (Switzerland),Christian Social Party (Switzerland),0,0
76,139,484.0,"Modern observations of the geomagnetic field reveal fluctuations(1-3) with a dominant period of about 60 years. These fluctuations are probably a result of waves in the liquid core(4), although the precise nature of the waves is uncertain. Common suggestions include a type of magnetic wave, known as a torsional oscillation(5), but recent studies(6) favour periods that are too short to account for a 60-year fluctuation. Another possibility involves MAC waves(7), which arise from the interplay between magnetic, Archimedes and Coriolis forces. Waves with a suitable period can emerge when the top of the core is stably stratified. Here I show that MAC waves provide a good description of time-dependent zonal flow at the top of the core(8), as inferred from geomagnetic secular variation(9). The same wave motion can also account for unexplained fluctuations in the dipole field(10). Both of these independent predictions require a 140-kilometre-thick stratified layer with a buoyancy frequency comparable to the Earth's rotation rate. Such a stratified layer could have a thermal origin(11,12), implying a core heat flow of about 13 terawatts. Alternatively, the layer could result from chemical stratification(13,14). In either case, the existence of a stratified layer at the top of the core obscures the nature of flow deeper in the core, where the magnetic field is continually regenerated.","Buffett, Bruce","Buffett, B",484.0,"Univ Calif Berkeley, Dept Earth & Planetary Sci, Berkeley, CA 94720 USA",,,11/20/17,,10.1038/nature13122,Article,1476-4687,bbuffett@berkeley.edu,+,US National Science Foundation [EAR-1045277],A. Jackson and I. Wardinski provided models of surface core flow and magnetic field. Comments and suggestions from R. Holme substantially improved the final text. This work was supported in part by the US National Science Foundation (EAR-1045277).,AD6WN,,,MAGNETIC-FIELD; MANTLE BOUNDARY; TORSIONAL OSCILLATIONS; SECULAR VARIATION; MOTIONS,7493.0,NATURE,Nature,English,32.0,No,,"MACMILLAN BUILDING, 4 CRINAN ST, LONDON N1 9XW, ENGLAND",27-Mar,9.0,LONDON,24670768.0,J,NATURE PUBLISHING GROUP,2014.0,,"Buffett, B (reprint author), Univ Calif Berkeley, Dept Earth & Planetary Sci, Berkeley, CA 94720 USA.",Science & Technology - Other Topics,0028-0836,NATURE,34.0,Geomagnetic fluctuations reveal stable stratification at the top of the Earth's core,2.0,44.0,WOS:000333402000037,484.0,507,Multidisciplinary Sciences,34,bruce,buffett,7675.0,800,male,1.0,lo8iEA4AAAAJ,3,"(4126, 9345]",211518,1,211518,1,Warren Buffett,Warren Buffett,1,1
