,Unnamed: 0.1,Unnamed: 0.1.1,AB,AF,AU,BP,C1,CA,CR,DA,DE,DI,DT,EI,EM,EP,FU,FX,GA,HC,HP,ID,IS,J9,JI,LA,NR,OA,OI,PA,PD,PG,PI,PM,PT,PU,PY,RI,RP,SC,SN,SO,TC,TI,U1,U2,UT,Unnamed: 0.1.1.1,VL,WC,Z9,c_fname,c_lname,citedby,count,gender,probability,scholar_id,quantile,range,page_id,has_page,page_id_nature,has_page_nature,page_title,page_title_nature,page_title_match,page_title_match_nature
111,63,255.0,"Following the discovery of long- range antiferromagnetic order in the parent compounds of high- transition- temperature ( high- T(c)) copper oxides(1,2), there have been efforts to understand the role of magnetism in the superconductivity that occurs when mobile 'electrons' or 'holes' are doped into the antiferromagnetic parent compounds. Superconductivity in the newly discovered rare- earth iron- based oxide systems ROFeAs ( R, rare- earth metal) also arises from either electron(3-7) or hole(8) doping of their non- superconducting parent compounds. The parent material LaOFeAs is metallic but shows anomalies near 150 K in both resistivity and d. c. magnetic susceptibility(3). Although optical conductivity and theoretical calculations suggest that LaOFeAs exhibits a spin- density- wave ( SDW) instability that is suppressed by doping with electrons to induce superconductivity(9), there has been no direct evidence of SDW order. Here we report neutron- scattering experiments that demonstrate that LaOFeAs undergoes an abrupt structural distortion below 155 K, changing the symmetry from tetragonal ( space group P4/ nmm) to monoclinic ( space group P112/ n) at low temperatures, and then, at similar to 137 K, develops long- range SDW- type antiferromagnetic order with a small moment but simple magnetic structure(9). Doping the system with fluorine suppresses both the magnetic order and the structural distortion in favour of superconductivity. Therefore, like high- T(c) copper oxides, the superconducting regime in these iron- based materials occurs in close proximity to a long- range- ordered antiferromagnetic ground state.","de la Cruz, Clarina; Huang, Q.; Lynn, J. W.; Li, Jiying; Ratcliff, W., II; Zarestky, J. L.; Mook, H. A.; Chen, G. F.; Luo, J. L.; Wang, N. L.; Dai, Pengcheng","de la Cruz, C; Huang, Q; Lynn, JW; Li, JY; Ratcliff, W; Zarestky, JL; Mook, HA; Chen, GF; Luo, JL; Wang, NL; Dai, PC",899.0,"[de la Cruz, Clarina; Dai, Pengcheng] Univ Tennessee, Dept Phys & Astron, Knoxville, TN 37996 USA; [de la Cruz, Clarina; Mook, H. A.; Dai, Pengcheng] Oak Ridge Natl Lab, Oak Ridge, TN 37831 USA; [Huang, Q.; Lynn, J. W.; Li, Jiying; Ratcliff, W., II] Natl Inst Stand & Technol, NIST Ctr Neutron Res, Gaithersburg, MD 20899 USA; [Li, Jiying] Univ Maryland, Dept Mat Sci & Engn, College Pk, MD 20742 USA; [Zarestky, J. L.] Iowa State Univ, Ames Lab, Ames, IA 50011 USA; [Zarestky, J. L.] Iowa State Univ, Dept Phys & Astron, Ames, IA 50011 USA; [Chen, G. F.; Luo, J. L.; Wang, N. L.] Chinese Acad Sci, Beijing Natl Lab Condensed Matter Phys, Inst Phys, Beijing 100080, Peoples R China",,,11/20/17,,10.1038/nature07057,Article,,daip@ornl.gov,902,,,311WV,Y,N,,7197.0,NATURE,Nature,English,17.0,No,"Dai, Pengcheng /0000-0002-6088-3170; dela Cruz, Clarina/0000-0003-4233-2145","MACMILLAN BUILDING, 4 CRINAN ST, LONDON N1 9XW, ENGLAND",12-Jun,4.0,LONDON,18509333.0,J,NATURE PUBLISHING GROUP,2008.0,"Dai, Pengcheng /C-9171-2012; dela Cruz, Clarina/C-2747-2013","Dai, PC (reprint author), Univ Tennessee, Dept Phys & Astron, Knoxville, TN 37996 USA.",Science & Technology - Other Topics,0028-0836,NATURE,1470.0,Magnetic order close to superconductivity in the iron-based layered LaO(1-x)F(x)FeAs systems,30.0,319.0,WOS:000256632000038,255.0,453,Multidisciplinary Sciences,1471,pengcheng,dai,17333.0,3,male,1.0,GsSElvMAAAAJ,4,"(9345, 17929]",767723,1,52216427,1,Chu–Han Contention,Chu–Han Contention,0,0
112,136,377.0,"T cells discriminate between foreign and host molecules by recognizing distinct microbial molecules, predominantly peptides and lipids(1-4). Riboflavin precursors found in many bacteria and yeast also selectively activate mucosal-associated invariant T (MAIT) cells(5,6), an abundant population of innate-like T cells in humans(7-9). However, the genesis of these small organic molecules and their mode of presentation to MAIT cells by the major histocompatibility complex (MHC)-related protein MR1 (ref. 8) are not well understood. Here we show that MAIT-cell activation requires key genes encoding enzymes that form 5-amino-6-D-ribitylaminouracil (5-A-RU), an early intermediate in bacterial riboflavin synthesis. Although 5-A-RU does not bind MR1 or activate MAIT cells directly, it does form potent MAIT-activating antigens via non-enzymatic reactions with small molecules, such as glyoxal and methylglyoxal, which are derived from other metabolic pathways. The MAIT antigens formed by the reactions between 5-A-RU and glyoxal/methylglyoxal were simple adducts, 5-(2-oxoethylideneamino)-6-D-ribitylaminouracil (5-OE-RU) and 5-(2-oxopropylideneamino)-6-D-ribitylaminouracil (5-OP-RU), respectively, which bound to MR1 as shown by crystal structures of MAIT TCR ternary complexes. Although 5-OP-RU and 5-OE-RU are unstable intermediates, they became trapped by MR1 as reversible covalent Schiff base complexes. Mass spectra supported the capture by MR1 of 5-OP-RU and 5-OE-RU from bacterial cultures that activate MAIT cells, but not from non-activating bacteria, indicating that these MAIT antigens are present in a range of microbes. Thus, MR1 is able to capture, stabilize and present chemically unstable pyrimidine intermediates, which otherwise convert to lumazines, as potent antigens to MAIT cells. These pyrimidine adducts are microbial signatures for MAIT-cell immunosurveillance.","Corbett, Alexandra J.; Eckle, Sidonia B. G.; Birkinshaw, Richard W.; Liu, Ligong; Patel, Onisha; Mahony, Jennifer; Chen, Zhenjun; Reantragoon, Rangsima; Meehan, Bronwyn; Cao, Hanwei; Williamson, Nicholas A.; Strugnell, Richard A.; Van Sinderen, Douwe; Mak, Jeffrey Y. W.; Fairlie, David P.; Kjer-Nielsen, Lars; Rossjohn, Jamie; McCluskey, James","Corbett, AJ; Eckle, SBG; Birkinshaw, RW; Liu, LG; Patel, O; Mahony, J; Chen, ZJ; Reantragoon, R; Meehan, B; Cao, HW; Williamson, NA; Strugnell, RA; Van Sinderen, D; Mak, JYW; Fairlie, DP; Kjer-Nielsen, L; Rossjohn, J; McCluskey, J",361.0,"[Corbett, Alexandra J.; Eckle, Sidonia B. G.; Chen, Zhenjun; Reantragoon, Rangsima; Meehan, Bronwyn; Cao, Hanwei; Strugnell, Richard A.; Kjer-Nielsen, Lars; McCluskey, James] Univ Melbourne, Peter Doherty Inst Infect & Immun, Dept Microbiol & Immunol, Parkville, Vic 3010, Australia; [Birkinshaw, Richard W.; Patel, Onisha; Rossjohn, Jamie] Monash Univ, Sch Biomed Sci, Dept Biochem & Mol Biol, Clayton, Vic 3800, Australia; [Liu, Ligong; Mak, Jeffrey Y. W.; Fairlie, David P.] Univ Queensland, Inst Mol Biosci, Div Chem & Struct Biol, Brisbane, Qld 4072, Australia; [Mahony, Jennifer; Van Sinderen, Douwe] Natl Univ Ireland Univ Coll Cork, Sch Microbiol, Cork, Ireland; [Williamson, Nicholas A.] Univ Melbourne, Mol Sci & Biotechnol Inst Bio21, Parkville, Vic 3010, Australia; [Van Sinderen, Douwe] Natl Univ Ireland Univ Coll Cork, Alimentary Pharmabiot Ctr, Cork, Ireland; [Fairlie, David P.] Univ Queensland, Australian Res Council Ctr Excellence Adv Mol Ima, Brisbane, Qld 4072, Australia; [Rossjohn, Jamie] Monash Univ, Australian Res Council Ctr Excellence Adv Mol Ima, Clayton, Vic 3800, Australia; [Rossjohn, Jamie] Cardiff Univ, Inst Infect & Immun, Sch Med, Cardiff CF14 4XN, S Glam, Wales",,,11/20/17,,10.1038/nature13160,Article,1476-4687,d.fairlie@imb.uq.edu.au; lkn@unimelb.edu.au; jamie.rossjohn@monash.edu; jamesm1@unimelb.edu.au,+,Australian Research Council (ARC); National Health and Medical Research Council of Australia (NHMRC); Science Foundation Ireland (SFI) [08/IN.1/B1909]; ARC; NHMRC [1027369]; NHMRC Australia,"We thank the staff of the Monash crystallization facility and the Australian Synchrotron for assistance with crystallization and data collection, respectively, and M. J. McConville, P. O'Donnell and C.-S. Ang from the University of Melbourne Bio21 Institute mass spectrometry platform for assistance with mass spectrometry experiments. The Australian Research Council (ARC), a Program Grant and Project Grant of the National Health and Medical Research Council of Australia (NHMRC) supported this research; D. V. S. is a recipient of a Science Foundation Ireland (SFI) Principal Investigator award (ref. no. 08/IN.1/B1909); O.P. was supported by an ARC Future Fellowship; D. P. F. was supported by an NHMRC Senior Principal Research Fellowship (1027369); J. R. was supported by an NHMRC Australia Fellowship.",AH4TM,Y,N,VITAMIN-B METABOLITES; SALMONELLA-TYPHIMURIUM; RECOGNITION; MR1; RIBOFLAVIN; RECEPTOR; BIOSYNTHESIS; SYNTHASE; DESIGN,7500.0,NATURE,Nature,English,27.0,No,"Strugnell, Richard/0000-0003-0614-5641; Fairlie, David/0000-0002-7856-8566; Rossjohn, Jamie/0000-0002-2020-7522; Mak, Jeffrey/0000-0002-8011-4539; liu, ligong/0000-0002-2693-1896; Eckle, Sidonia/0000-0003-0766-171X; Corbett, Alexandra/0000-0003-1618-4337; Williamson, Nicholas/0000-0002-2173-3452; McCluskey, James/0000-0002-8597-815X","MACMILLAN BUILDING, 4 CRINAN ST, LONDON N1 9XW, ENGLAND",15-May,16.0,LONDON,24695216.0,J,NATURE PUBLISHING GROUP,2014.0,"; Fairlie, David/F-8865-2014; Mak, Jeffrey/E-8764-2011; liu, ligong/B-1690-2010; Van Sinderen, Douwe/A-6778-2015; Williamson, Nicholas/O-9812-2016; McCluskey, James/A-1291-2007","Fairlie, DP (reprint author), Univ Queensland, Inst Mol Biosci, Div Chem & Struct Biol, Brisbane, Qld 4072, Australia.",Science & Technology - Other Topics,0028-0836,NATURE,120.0,T-cell activation by transitory neo-antigens derived from distinct microbial pathways,5.0,49.0,WOS:000336121200039,377.0,509,Multidisciplinary Sciences,120,james,mccluskey,17280.0,6359,male,0.99,xZP8IAkAAAAJ,4,"(9345, 17929]",35074663,1,40605906,1,James McCluskey,James McCluskey,1,1
113,148,256.0,"Planets with sizes between that of Earth (with radius R-circle plus) and Neptune (about 4R(circle plus)) are now known to be common around Sun-like stars(1-3). Most such planets have been discovered through the transit technique, by which the planet's size can be determined from the fraction of starlight blocked by the planet as it passes in front of its star. Measuring the planet's mass-and hence its density, which is a clue to its composition-is more difficult. Planets of size 2-4R(circle plus) have proved to have a wide range of densities, implying a diversity of compositions(4,5), but these measurements did not extend to planets as small as Earth. Here we report Doppler spectroscopic measurements of the mass of the Earth-sized planet Kepler-78b, which orbits its host star every 8.5 hours (ref. 6). Given a radius of 1.20 +/- 0.09R(circle plus) and a mass of 1.69 +/- 0.41M(circle plus), the planet's mean density of 5.3 +/- 1.8 g cm(-3) is similar to Earth's, suggesting a composition of rock and iron.","Howard, Andrew W.; Sanchis-Ojeda, Roberto; Marcy, Geoffrey W.; Johnson, John Asher; Winn, Joshua N.; Isaacson, Howard; Fischer, Debra A.; Fulton, Benjamin J.; Sinukoff, Evan; Fortney, Jonathan J.","Howard, AW; Sanchis-Ojeda, R; Marcy, GW; Johnson, JA; Winn, JN; Isaacson, H; Fischer, DA; Fulton, BJ; Sinukoff, E; Fortney, JJ",381.0,"[Howard, Andrew W.; Fulton, Benjamin J.; Sinukoff, Evan] Univ Hawaii Manoa, Inst Astron, Honolulu, HI 96822 USA; [Sanchis-Ojeda, Roberto; Winn, Joshua N.] MIT, Dept Phys, Cambridge, MA 02139 USA; [Sanchis-Ojeda, Roberto; Winn, Joshua N.] MIT, Kavli Inst Astrophys & Space Res, Cambridge, MA 02139 USA; [Marcy, Geoffrey W.; Isaacson, Howard] Univ Calif Berkeley, Dept Astron, Berkeley, CA 94720 USA; [Johnson, John Asher] Harvard Smithsonian Ctr Astrophys, Cambridge, MA 02138 USA; [Fischer, Debra A.] Yale Univ, Dept Astron, New Haven, CT 06510 USA; [Fortney, Jonathan J.] Univ Calif Santa Cruz, Dept Astron & Astrophys, Santa Cruz, CA 95064 USA",,,11/20/17,,10.1038/nature12767,Article,1476-4687,howard@ifa.hawaii.edu; rsanchis86@gmail.com,+,NASA's Science Mission Directorate; Kepler Participating Scientist programme; NASA [NNX12AJ23G],"This Letter and another<SUP>10</SUP> were submitted simultaneously and are the result of coordinated, independent radial-velocity observations and analyses of Kepler-78. We thank the HARPS-N team for their collegiality. We also thank E. Chiang, I. Crossfield, R. Kolbl, E. Petigura, and D. Huber for discussions, S. Howard for support, C. Dressing for a convenient packaging of stellar models, and A. Hatzes for a thorough review. This work was based on observations at the W.M. Keck Observatory granted by the University of Hawaii, the University of California, and the California Institute of Technology. We thank the observers who contributed to the measurements reported here and acknowledge the efforts of the Keck Observatory staff. We thank those of Hawaiian ancestry on whose sacred mountain of Mauna Kea we are guests. Kepler was competitively selected as the tenth Discovery mission with funding provided by NASA's Science Mission Directorate. J.N.W. and R.S.-O. acknowledge support from the Kepler Participating Scientist programme. A.W.H. acknowledges funding from NASA grant NNX12AJ23G.",254KG,,,SOLAR-TYPE STARS; PLANET-SEARCH; MASS; KEPLER; EVOLUTION; ROTATION; ORBIT; SPECTROMETER; PRECISION; TRANSITS,7476.0,NATURE,Nature,English,43.0,No,"Fortney, Jonathan/0000-0002-9843-4354; Fischer, Debra/0000-0003-2221-0861","MACMILLAN BUILDING, 4 CRINAN ST, LONDON N1 9XW, ENGLAND",21-Nov,9.0,LONDON,24172898.0,J,NATURE PUBLISHING GROUP,2013.0,,"Howard, AW (reprint author), Univ Hawaii Manoa, Inst Astron, 2680 Woodlawn Dr, Honolulu, HI 96822 USA.",Science & Technology - Other Topics,0028-0836,NATURE,81.0,A rocky composition for an Earth-sized exoplanet,0.0,43.0,WOS:000327163200037,256.0,503,Multidisciplinary Sciences,81,jonathan j.,fortney,16838.0,36,male,1.0,iTeJ15IAAAAJ,4,"(9345, 17929]",na,0,na,0,na,na,0,0
114,135,360.0,"Groundwater use in California's San Joaquin Valley exceeds replenishment of the aquifer, leading to substantial diminution of this resource(1-4) and rapid subsidence of the valley floor(5). The volume of groundwater lost over the past century and a half also represents a substantial reduction in mass and a large-scale unburdening of the lithosphere, with significant but unexplored potential impacts on crustal deformation and seismicity. Here we use vertical global positioning system measurements to show that a broad zone of rock uplift of up to 1-3 mm per year surrounds the southern San Joaquin Valley. The observed uplift matches well with predicted flexure from a simple elastic model of current rates of water-storage loss, most of which is caused by groundwater depletion(3). The height of the adjacent central Coast Ranges and the Sierra Nevada is strongly seasonal and peaks during the dry late summer and autumn, out of phase with uplift of the valley floor during wetter months. Our results suggest that long-term and late-summer flexural uplift of the Coast Ranges reduce the effective normal stress resolved on the San Andreas Fault. This process brings the fault closer to failure, thereby providing a viable mechanism for observed seasonality in microseismicity at Parkfield(6) and potentially affecting long-term seismicity rates for fault systems adjacent to the valley. We also infer that the observed contemporary uplift of the southern Sierra Nevada previously attributed to tectonic or mantle-derived forces(7-10) is partly a consequence of human-caused groundwater depletion.","Amos, Colin B.; Audet, Pascal; Hammond, William C.; Buergmann, Roland; Johanson, Ingrid A.; Blewitt, Geoffrey","Amos, CB; Audet, P; Hammond, WC; Burgmann, R; Johanson, IA; Blewitt, G",483.0,"[Amos, Colin B.] Western Washington Univ, Dept Geol, Bellingham, WA 98225 USA; [Audet, Pascal] Univ Ottawa, Dept Earth Sci, Ottawa, ON K1N 6N5, Canada; [Hammond, William C.; Blewitt, Geoffrey] Univ Nevada, Nevada Geodet Lab, Nevada Bur Mines & Geol, Reno, NV 89557 USA; [Hammond, William C.; Blewitt, Geoffrey] Univ Nevada, Nevada Seismol Lab, Reno, NV 89557 USA; [Buergmann, Roland; Johanson, Ingrid A.] Univ Calif Berkeley, Berkeley Seismol Lab, Berkeley, CA 94720 USA; [Buergmann, Roland] Univ Calif Berkeley, Dept Earth & Planetary Sci, Berkeley, CA 94720 USA",,,11/20/17,,10.1038/nature13275,Article,1476-4687,colin.amos@wwu.edu,+,NSF Earth Scope award [EAR-1252210],"Funding for this work comes from NSF Earth Scope award number EAR-1252210 to G. B. and W. C. H. GPS data were collected using the EarthScope Plate Boundary Observatory, SCIGN, BARGEN, BARD, CORS and IGS networks. We are particularly grateful to UNAVCO for operating the vast majority of GPS stations used in this project. GPS data were processed using the GIPSY OASIS II software and data products from the Jet Propulsion Laboratory.",AH4VE,,,SAN-ANDREAS FAULT; SIERRA-NEVADA; SEASONAL-VARIATION; ROCK UPLIFT; GPS; SUBSIDENCE; PARKFIELD; STRAIN; REGION; VALLEY,7501.0,NATURE,Nature,English,40.0,No,"Amos, Colin/0000-0002-3862-9344; Johanson, Ingrid/0000-0002-6049-2225","MACMILLAN BUILDING, 4 CRINAN ST, LONDON N1 9XW, ENGLAND",22-May,10.0,LONDON,24828048.0,J,NATURE PUBLISHING GROUP,2014.0,"Amos, Colin/B-2397-2008","Amos, CB (reprint author), Western Washington Univ, Dept Geol, Bellingham, WA 98225 USA.",Science & Technology - Other Topics,0028-0836,NATURE,44.0,Uplift and seismicity driven by groundwater depletion in central California,4.0,100.0,WOS:000336126000037,360.0,509,Multidisciplinary Sciences,44,geoffrey,blewitt,9664.0,262,male,1.0,YPJuQRsAAAAJ,4,"(9345, 17929]",2056373,1,22621,1,GPO Film Unit,GPO Film Unit,0,0
115,113,104.0,"When used in combination with raster scanning, small-angle X-ray scattering (SAXS) has proven to be a valuable imaging technique of the nanoscale(1), for example of bone, teeth and brain matter(2-5). Although two-dimensional projection imaging has been used to characterize various materials successfully, its three-dimensional extension, SAXS computed tomography, poses substantial challenges, which have yet to be overcome. Previous work(6-11) using SAXS computed tomography was unable to preserve oriented SAXS signals during reconstruction. Here we present a solution to this problem and obtain a complete SAXS computed tomography, which preserves oriented scattering information. By introducing virtual tomography axes, we take advantage of the two-dimensional SAXS information recorded on an area detector and use it to reconstruct the full three-dimensional scattering distribution in reciprocal space for each voxel of the three-dimensional object in real space. The presented method could be of interest for a combined six-dimensional real and reciprocal space characterization of mesoscopic materials with hierarchically structured features with length scales ranging from a few nanometres to a few millimetres-for example, biomaterials such as bone or teeth, or functional materials such as fuel-cell or battery components.","Schaff, Florian; Bech, Martin; Zaslansky, Paul; Jud, Christoph; Liebi, Marianne; Guizar-Sicairos, Manuel; Pfeiffer, Franz","Schaff, F; Bech, M; Zaslansky, P; Jud, C; Liebi, M; Guizar-Sicairos, M; Pfeiffer, F",353.0,"[Schaff, Florian; Jud, Christoph; Pfeiffer, Franz] Tech Univ Munich, Lehrstuhl Biomed Phys, Dept Phys, D-85748 Garching, Germany; [Schaff, Florian; Jud, Christoph; Pfeiffer, Franz] Tech Univ Munich, Inst Med Tech, D-85748 Garching, Germany; [Bech, Martin] Lund Univ, Dept Med Radiat Phys, Clin Sci, S-22185 Lund, Sweden; [Zaslansky, Paul] Charite, Julius Wolff Inst, D-13353 Berlin, Germany; [Liebi, Marianne; Guizar-Sicairos, Manuel] Paul Scherrer Inst, CH-5232 Villigen, Switzerland; [Pfeiffer, Franz] Tech Univ Munich, Klinikum Rechts Isar, Inst Diagnost & Interventionelle Radiol, D-81675 Munich, Germany",,,11/19/17,,10.1038/nature16060,Article,1476-4687,florian.schaff@tum.de; martin.bech@med.lu.se; franz.pfeiffer@tum.de,+,DFG Cluster of Excellence Munich-Centre for Advanced Photonics (MAP); DFG Gottfried Wilhelm Leibniz program; DFG (German Research Foundation) [SPP1420]; TUM Graduate School; TUM Institute for Advanced Studies (TUM-IAS),"The SAXS experiments were performed at the cSAXS beamline of the Swiss Light Source (SLS) at the Paul Scherrer Institut (PSI), Villigen, Switzerland. We are grateful for travel support that was granted by the EU access program CALIPSO. We acknowledge financial support through the DFG Cluster of Excellence Munich-Centre for Advanced Photonics (MAP) and the DFG Gottfried Wilhelm Leibniz program. P.Z. is grateful for funding of the DFG (German Research Foundation) through SPP1420. F.S. and C.J. thank the TUM Graduate School for support of their studies. F.P. acknowledges support through the TUM Institute for Advanced Studies (TUM-IAS). We thank A. Fehringer for developing the GPU projectors used for the reconstruction.",CW9ZN,,,COMPUTED-TOMOGRAPHY; COLLAGEN ORIENTATION; BONE; MYELIN; SAXS; NANOSTRUCTURE; COMPOSITE; DENTIN; BRAIN,7578.0,NATURE,Nature,English,26.0,No,"Liebi, Marianne/0000-0002-5403-0593","MACMILLAN BUILDING, 4 CRINAN ST, LONDON N1 9XW, ENGLAND",19-Nov,10.0,LONDON,26581292.0,J,NATURE PUBLISHING GROUP,2015.0,"Guizar-Sicairos, Manuel/I-4899-2013; Liebi, Marianne/A-3821-2015","Schaff, F (reprint author), Tech Univ Munich, Lehrstuhl Biomed Phys, Dept Phys, D-85748 Garching, Germany.",Science & Technology - Other Topics,0028-0836,NATURE,21.0,Six-dimensional real and reciprocal space small-angle X-ray scattering tomography,7.0,71.0,WOS:000365356800051,104.0,527,Multidisciplinary Sciences,21,franz,pfeiffer,13060.0,86,male,1.0,q87hwVUAAAAJ,4,"(9345, 17929]",209368,1,54157791,1,Franz Pfeiffer,Franz Pfeiffer,1,1
116,88,420.0,"The terrestrial and lunar cratering rate is often assumed to have been nearly constant over the past 3Gyr. Different lines of evidence, however, suggest that the impact flux from kilometre-sized bodies increased by at least a factor of two over the long-term average during the past similar to,100 Myr. Here we argue that this apparent surge was triggered by the catastrophic disruption of the parent body of the asteroid Baptistina, which we infer was a similar to 170-km-diameter body ( carbonaceous-chondrite-like) that broke up 160(-20)(+30) Myr ago in the inner main asteroid belt. Fragments produced by the collision were slowly delivered by dynamical processes to orbits where they could strike the terrestrial planets. We find that this asteroid shower is the most likely source (. 90 per cent probability) of the Chicxulub impactor that produced the Cretaceous/Tertiary ( K/T) mass extinction event 65 Myr ago.","Bottke, William F.; Vokrouhlicky, David; Nesvorny, David","Bottke, WF; Vokrouhlicky, D; Nesvorny, D",48.0,"SW Res Inst, Boulder, CO 80302 USA; Charles Univ Prague, Inst Astron, CR-18000 Prague 8, Czech Republic",,,11/20/17,,10.1038/nature06070,Article,,bottke@boulder.swri.edu,53,,,207ED,,,NEAR-EARTH OBJECTS; FAMILIES; DISTRIBUTIONS; SIMULATIONS; POPULATION; DISRUPTION; METEORITES; CRATERS; HAZARD; COMETS,7158.0,NATURE,Nature,English,50.0,No,,"MACMILLAN BUILDING, 4 CRINAN ST, LONDON N1 9XW, ENGLAND",6-Sep,6.0,LONDON,17805288.0,J,NATURE PUBLISHING GROUP,2007.0,,"Bottke, WF (reprint author), SW Res Inst, 1050 Walnut St,Suite 300, Boulder, CO 80302 USA.",Science & Technology - Other Topics,0028-0836,NATURE,88.0,An asteroid breakup 160 Myr ago as the probable source of the K/T impactor,3.0,27.0,WOS:000249233500033,420.0,449,Multidisciplinary Sciences,90,david,nesvorny,11063.0,12593,male,1.0,BeLy4xcAAAAJ,4,"(9345, 17929]",39937576,1,886732,1,Hunt for Exomoons with Kepler,Hunt for Exomoons with Kepler,0,0
