,Unnamed: 0.1,Unnamed: 0.1.1,AB,AF,AU,BP,C1,CA,CR,DA,DE,DI,DT,EI,EM,EP,FU,FX,GA,HC,HP,ID,IS,J9,JI,LA,NR,OA,OI,PA,PD,PG,PI,PM,PT,PU,PY,RI,RP,SC,SN,SO,TC,TI,U1,U2,UT,Unnamed: 0.1.1.1,VL,WC,Z9,c_fname,c_lname,citedby,count,gender,probability,scholar_id,quantile,range,page_id,has_page,page_id_nature,has_page_nature,page_title,page_title_nature,page_title_match,page_title_match_nature
119,57,89.0,"In many biological examples of cooperation, individuals that cooperate cannot benefit from the resulting public good. This is especially clear in cases of self- destructive cooperation, where individuals die when helping others. If self- destructive cooperation is genetically encoded, these genes can only be maintained if they are expressed by just a fraction of their carriers, whereas the other fraction benefits from the public good. One mechanism that can mediate this differentiation into two phenotypically different sub- populations is phenotypic noise(1,2). Here we show that noisy expression of self- destructive cooperation can evolve if individuals that have a higher probability for self- destruction have, on average, access to larger public goods. This situation, which we refer to as assortment, can arise if the environment is spatially structured. These results provide a new perspective on the significance of phenotypic noise in bacterial pathogenesis: it might promote the formation of cooperative sub- populations that die while preparing the ground for a successful infection. We show experimentally that this model captures essential features of Salmonella typhimurium pathogenesis. We conclude that noisily expressed self- destructive cooperative actions can evolve under conditions of assortment, that self- destructive cooperation is a plausible biological function of phenotypic noise, and that self- destructive cooperation mediated by phenotypic noise could be important in bacterial pathogenesis.","Ackermann, Martin; Stecher, Baerbel; Freed, Nikki E.; Songhet, Pascal; Hardt, Wolf-Dietrich; Doebeli, Michael","Ackermann, M; Stecher, B; Freed, NE; Songhet, P; Hardt, WD; Doebeli, M",987.0,"[Ackermann, Martin; Freed, Nikki E.] ETH, Inst Integrat Biol, CH-8092 Zurich, Switzerland; [Stecher, Baerbel; Songhet, Pascal; Hardt, Wolf-Dietrich] ETH, Inst Microbiol, CH-8092 Zurich, Switzerland; [Doebeli, Michael] Univ British Columbia, Dept Zool, Vancouver, BC V6T 1Z4, Canada; [Doebeli, Michael] Univ British Columbia, Dept Math, Vancouver, BC V6T 1Z4, Canada",,,11/20/17,,10.1038/nature07067,Article,1476-4687,martin.ackermann@env.ethz.ch; hardt@micro.biol.ethz.ch; doebeli@zoology.ubc.ca,990,Roche Research Foundation; Novartis Foundation; NSERC ( Canada); UBS foundation; ETH research foundation [TH-10 06-1]; Swiss National Science Foundation [310000-113623/1]; European Union [SavinMucoPath number 032296],"We are grateful to Markus Schlumberger, K. Aktories, I. Just, S. Hammerschmidt and J. Fletcher for discussions, and M. Barthel and the RCHCI team for professional help with the animal experiments. M. A. and N. E. F. were supported by the Swiss National Science Foundation, and M. A. was also supported by the Roche Research Foundation and the Novartis Foundation. M. D. is supported by NSERC ( Canada). B. S. and W.- D. H. were supported by the UBS foundation. Salmonella work in the Hardt laboratory is supported by grants from the ETH research foundation (TH- 10 06- 1), the Swiss National Science Foundation (310000-113623/1) and the European Union ( SavinMucoPath number 032296).",339QB,,,GENE-EXPRESSION; STREPTOCOCCUS-PNEUMONIAE; PRISONERS-DILEMMA; EVOLUTION; DISEASE; CELLS; INFECTION; VIRULENCE; GAME,7207.0,NATURE,Nature,English,29.0,No,"Stecher, Barbel/0000-0002-7445-5193","MACMILLAN BUILDING, 4 CRINAN ST, LONDON N1 9XW, ENGLAND",21-Aug,4.0,LONDON,18719588.0,J,NATURE PUBLISHING GROUP,2008.0,"Doebeli, Michael/D-5391-2012; Stecher, Barbel/A-2911-2015","Ackermann, M (reprint author), ETH, Inst Integrat Biol, CH-8092 Zurich, Switzerland.",Science & Technology - Other Topics,0028-0836,NATURE,173.0,Self-destructive cooperation mediated by phenotypic noise,0.0,23.0,WOS:000258591000037,89.0,454,Multidisciplinary Sciences,174,michael,doebeli,11459.0,11094,male,1.0,qHUy6RMAAAAJ,4,"(9345, 17929]",na,0,na,0,na,na,0,0
120,109,17.0,"Eukaryotic transcription factors (TFs) are key determinants of gene activity, yet they bind only a fraction of their corresponding DNA sequence motifs in any given cell type(1). Chromatin has the potential to restrict accessibility of binding sites; however, in which context chromatin states are instructive for TF binding remains mainly unknown(1,2). To explore the contribution of DNA methylation to constrained TF binding, we mapped DNase-I-hypersensitive sites in murine stem cells in the presence and absence of DNA methylation. Methylation-restricted sites are enriched for TF motifs containing CpGs, especially for those of NRF1. In fact, the TF NRF1 occupies several thousand additional sites in the unmethylated genome, resulting in increased transcription. Restoring de novo methyltransferase activity initiates remethylation at these sites and outcompetes NRF1 binding. This suggests that binding of DNA-methylation-sensitive TFs relies on additional determinants to induce local hypomethylation. In support of this model, removal of neighbouring motifs in cis or of a TF in trans causes local hypermethylation and subsequent loss of NRF1 binding. This competition between DNA methylation and TFs in vivo reveals a case of cooperativity between TFs that acts indirectly via DNA methylation. Methylation removal by methylation-insensitive factors enables occupancy of methylation-sensitive factors, a principle that rationalizes hypomethylation of regulatory regions.","Domcke, Silvia; Bardet, Anais Flore; Ginno, Paul Adrian; Hartl, Dominik; Burger, Lukas; Schuebeler, Dirk","Domcke, S; Bardet, AF; Ginno, PA; Hartl, D; Burger, L; Schubeler, D",575.0,"[Domcke, Silvia; Bardet, Anais Flore; Ginno, Paul Adrian; Hartl, Dominik; Burger, Lukas; Schuebeler, Dirk] Friedrich Miescher Inst Biomed Res, CH-4058 Basel, Switzerland; [Domcke, Silvia; Hartl, Dominik; Schuebeler, Dirk] Univ Basel, Fac Sci, CH-4003 Basel, Switzerland; [Burger, Lukas] Swiss Inst Bioinformat, CH-4058 Basel, Switzerland",,,11/19/17,,10.1038/nature16462,Article,1476-4687,dirk@fmi.ch,+,Novartis Research Foundation; European Union (NoE 'EpiGeneSys') [FP7-HEALTH-2010-257082]; European Union ('Blueprint' consortium) [FP7-282510]; European Research Council (EpiGePlas); Swiss initiative in Systems Biology (RTD Cell Plasticity); EMBO postdoctoral long-term fellowships; Boehringer Ingelheim Fonds,"We are grateful to S. Dessus-Babus, K. Jacobeit and T. Roloff (FMI) for processing deep-sequencing samples, to C. Wirbelauer for technical assistance and to A. Arnold for technical advice. We thank M. Stadler and D. Gaidatzis for bioinformatic advice and members of our laboratory, N. Thomae (FMI) and M. Lorincz (UBC Vancouver) for comments on the manuscript. We apologize to colleagues whose work we could not cite owing to space limitations. Research in the laboratory of D. S. is supported by the Novartis Research Foundation, the European Union (NoE 'EpiGeneSys' FP7-HEALTH-2010-257082 and the 'Blueprint' consortium FP7-282510), the European Research Council (EpiGePlas) and the Swiss initiative in Systems Biology (RTD Cell Plasticity). A.F.B. and P.A.G. are supported by EMBO postdoctoral long-term fellowships and S. D. and D.H. by predoctoral fellowships from the Boehringer Ingelheim Fonds.",CZ3GH,,,EMBRYONIC STEM-CELLS; HUMAN GENOME; GROUND-STATE; MOUSE GENOME; IN-VIVO; GENE; ELEMENTS; EXPRESSION; SEQUENCE; ABSENCE,7583.0,NATURE,Nature,English,54.0,No,"Domcke, Silvia/0000-0002-4102-7774","MACMILLAN BUILDING, 4 CRINAN ST, LONDON N1 9XW, ENGLAND",24-Dec,19.0,LONDON,26675734.0,J,NATURE PUBLISHING GROUP,2015.0,,"Schubeler, D (reprint author), Friedrich Miescher Inst Biomed Res, Maulbeerstr 66, CH-4058 Basel, Switzerland.",Science & Technology - Other Topics,0028-0836,NATURE,59.0,Competition between DNA methylation and transcription factors determines binding of NRF1,3.0,37.0,WOS:000366991900057,17.0,528,Multidisciplinary Sciences,59,dirk,schuebeler,15369.0,213,male,1.0,AlL8XW8AAAAJ,4,"(9345, 17929]",na,0,na,0,na,na,0,0
121,99,154.0,"In standard fluid dynamics(1,2), the density change associated with flow is often assumed to be negligible, implying that the fluid is incompressible. For example, this has been established for simple shear flows, where no pressure change is associated with flow: there is no volume deformation due to viscous stress and inertial effects can be neglected. Accordingly, any flow-induced instabilities ( such as cavitation) are unexpected for simple shear flows. Here we demonstrate that the incompressibility condition can be violated even for simple shear flows, by taking into account the coupling between the flow and density fluctuations, which arises owing to the density dependence of the viscosity. We show that a liquid can become mechanically unstable above a critical shear rate that is given by the inverse of the derivative of viscosity with respect to pressure. Our model predicts that, for very viscous liquids, this shear-induced instability should occur at moderate shear rates that are experimentally accessible. Our results explain the unusual shear-induced instability observed in viscous lubricants(3-5), and may illuminate other poorly understood phenomena associated with mechanical instability of liquids at low Reynolds number; for example, shear-induced cavitation and bubble growth(6), and shear-banding of very viscous liquids such as metallic glasses(7) and the Earth's mantle(8).","Furukawa, Akira; Tanaka, Hajime","Furukawa, A; Tanaka, H",434.0,"Univ Tokyo, Inst Ind Sci, Tokyo 1538505, Japan",,,11/20/17,,10.1038/nature05119,Article,,furu@iis.u-tokyo.ac.jp,438,,,088FY,,,POLYMER-SOLUTIONS; STRESS RHEOLOGY; HIGH-PRESSURE; LUBRICANTS; VISCOSITY; FLUCTUATIONS; STATE; TEMPERATURE; DEPENDENCE; FLUIDS,7110.0,NATURE,Nature,English,30.0,No,"Tanaka, Hajime/0000-0002-4444-1890; ","MACMILLAN BUILDING, 4 CRINAN ST, LONDON N1 9XW, ENGLAND",28-Sep,5.0,LONDON,17006510.0,J,NATURE PUBLISHING GROUP,2006.0,"Tanaka, Hajime/A-9653-2008; Furukawa, Akira/C-8629-2009","Furukawa, A (reprint author), Univ Tokyo, Inst Ind Sci, 4-6-1 Komaba, Tokyo 1538505, Japan.",Science & Technology - Other Topics,0028-0836,NATURE,26.0,Violation of the incompressibility of liquid by simple shear flow,3.0,40.0,WOS:000240798800041,154.0,443,Multidisciplinary Sciences,26,hajime,tanaka,15523.0,4,male,1.0,2gcE8bwAAAAJ,4,"(9345, 17929]",16715156,1,2070128,1,Romeo Tanaka,Romeo Tanaka,1,1
122,32,14.0,"Nucleosomes compact and regulate access to DNA in the nucleus, and are composed of approximately 147 bases of DNA wrapped around a histone octamer(1,2). Here we report a genome-wide nucleosome positioning analysis of Arabidopsis thaliana using massively parallel sequencing of mononucleosomes. By combining this data with profiles of DNA methylation at single base resolution, we identified 10-base periodicities in the DNA methylation status of nucleosome-bound DNA and found that nucleosomal DNA was more highly methylated than flanking DNA. These results indicate that nucleosome positioning influences DNA methylation patterning throughout the genome and that DNA methyltransferases preferentially target nucleosome-bound DNA. We also observed similar trends in human nucleosomal DNA, indicating that the relationships between nucleosomes and DNA methyltransferases are conserved. Finally, as has been observed in animals, nucleosomes were highly enriched on exons, and preferentially positioned at intron-exon and exon-intron boundaries. RNA polymerase II (Pol II) was also enriched on exons relative to introns, consistent with the hypothesis that nucleosome positioning regulates Pol II processivity. DNA methylation is also enriched on exons, consistent with the targeting of DNA methylation to nucleosomes, and suggesting a role for DNA methylation in exon definition.","Chodavarapu, Ramakrishna K.; Feng, Suhua; Bernatavichute, Yana V.; Chen, Pao-Yang; Stroud, Hume; Yu, Yanchun; Hetzel, Jonathan A.; Kuo, Frank; Kim, Jin; Cokus, Shawn J.; Casero, David; Bernal, Maria; Huijser, Peter; Clark, Amander T.; Kraemer, Ute; Merchant, Sabeeha S.; Zhang, Xiaoyu; Jacobsen, Steven E.; Pellegrini, Matteo","Chodavarapu, RK; Feng, SH; Bernatavichute, YV; Chen, PY; Stroud, H; Yu, YC; Hetzel, JA; Kuo, F; Kim, J; Cokus, SJ; Casero, D; Bernal, M; Huijser, P; Clark, AT; Kramer, U; Merchant, SS; Zhang, XY; Jacobsen, SE; Pellegrini, M",388.0,"[Chodavarapu, Ramakrishna K.; Feng, Suhua; Bernatavichute, Yana V.; Chen, Pao-Yang; Stroud, Hume; Hetzel, Jonathan A.; Kuo, Frank; Kim, Jin; Cokus, Shawn J.; Casero, David; Clark, Amander T.; Jacobsen, Steven E.; Pellegrini, Matteo] Univ Calif Los Angeles, Dept Mol Cell & Dev Biol, Los Angeles, CA 90095 USA; [Feng, Suhua; Jacobsen, Steven E.] Univ Calif Los Angeles, Howard Hughes Med Inst, Los Angeles, CA 90095 USA; [Bernatavichute, Yana V.; Merchant, Sabeeha S.; Jacobsen, Steven E.; Pellegrini, Matteo] Univ Calif Los Angeles, Inst Mol Biol, Los Angeles, CA 90095 USA; [Yu, Yanchun; Zhang, Xiaoyu] Univ Georgia, Dept Plant Biol, Athens, GA 30602 USA; [Bernal, Maria; Kraemer, Ute] Univ Heidelberg, D-69120 Heidelberg, Germany; [Huijser, Peter] Max Planck Inst Plant Breeding Res, Dept Mol Plant Genet, D-50829 Cologne, Germany; [Clark, Amander T.] Univ Calif Los Angeles, Eli & Edythe Broad Ctr Regenerat Med & Stem Cell, Los Angeles, CA 90095 USA; [Merchant, Sabeeha S.] Univ Calif Los Angeles, Dept Chem & Biochem, Los Angeles, CA 90095 USA",,,11/20/17,,10.1038/nature09147,Article,,jacobsen@ucla.edu; matteop@mcdb.ucla.edu,392,"Department of Energy, Institute for Genomics and Proteomics; NIH [GM07104, GM60398, GM42143]; Eli & Edythe Broad Center of Regenerative Medicine & Stem Cell Research at UCLA; Alexander-von-Humboldt Fellowship; Heisenberg Fellowship; University of Georgia [JR-040]; NSF [0701745]","We thank members of our laboratories for input and guidance, and the Department of Energy, Institute for Genomics and Proteomics for support. R. K. C. is supported by NIH training grant GM07104. S. F. is a Howard Hughes Medical Institute Fellow of the Life Sciences Research Foundation. P.-Y.C. is funded by Eli & Edythe Broad Center of Regenerative Medicine & Stem Cell Research at UCLA. M. B. was supported by an Alexander-von-Humboldt Fellowship and U. K. by a Heisenberg Fellowship. X.Z. was supported by a Faculty Research Grant (JR-040) from the University of Georgia. Research was supported by an Innovation Award from the Eli & Edythe Broad Center of Regenerative Medicine & Stem Cell Research at UCLA, NIH grants GM60398 and GM42143, and NSF Plant Genome Research Program #0701745. S.E.J. is an Investigator of the Howard Hughes Medical Institute.",625BP,Y,N,GENOME; ORGANIZATION; PLANTS; RESOLUTION; SEQUENCE; PARTICLE; ANIMALS; REVEALS; H2A.Z; MARKS,7304.0,NATURE,Nature,English,29.0,No,"Kraemer, Ute/0000-0001-7870-4508; Casero, David/0000-0002-7347-3330","MACMILLAN BUILDING, 4 CRINAN ST, LONDON N1 9XW, ENGLAND",15-Jul,5.0,LONDON,20512117.0,J,NATURE PUBLISHING GROUP,2010.0,"Kraemer, Ute/C-5025-2008; Casero, David/E-7365-2010","Jacobsen, SE (reprint author), Univ Calif Los Angeles, Dept Mol Cell & Dev Biol, Los Angeles, CA 90095 USA.",Science & Technology - Other Topics,0028-0836,NATURE,381.0,Relationship between nucleosome positioning and DNA methylation,3.0,82.0,WOS:000279867100053,14.0,466,Multidisciplinary Sciences,392,matteo,pellegrini,20862.0,555,male,1.0,TT_duF0AAAAJ,5,"(17929, ]",907340,1,27360417,1,Federica Pellegrini,Federica Pellegrini,1,1
123,269,479.0,"Enhancers control the correct temporal and cell-type-specific activation of gene expression in multicellular eukaryotes. Knowing their properties, regulatory activity and targets is crucial to understand the regulation of differentiation and homeostasis. Here we use the FANTOM5 panel of samples, covering the majority of human tissues and cell types, to produce an atlas of active, in vivo-transcribed enhancers. We show that enhancers share properties with CpG-poor messenger RNA promoters but produce bidirectional, exosome-sensitive, relatively short unspliced RNAs, the generation of which is strongly related to enhancer activity. The atlas is used to compare regulatory programs between different cells at unprecedented depth, to identify disease-associated regulatory single nucleotide polymorphisms, and to classify cell-type-specific and ubiquitous enhancers. We further explore the utility of enhancer redundancy, which explains gene expression strength rather than expression patterns. The online FANTOM5 enhancer atlas represents a unique resource for studies on cell-type-specific enhancers and gene regulation.","Andersson, Robin; Gebhard, Claudia; Miguel-Escalada, Irene; Hoof, Ilka; Bornholdt, Jette; Boyd, Mette; Chen, Yun; Zhao, Xiaobei; Schmidl, Christian; Suzuki, Takahiro; Ntini, Evgenia; Arner, Erik; Valen, Eivind; Li, Kang; Schwarzfischer, Lucia; Glatz, Dagmar; Raithel, Johanna; Lilje, Berit; Rapin, Nicolas; Bagger, Frederik Otzen; Jorgensen, Mette; Andersen, Peter Refsing; Bertin, Nicolas; Rackham, Owen; Burroughs, A. Maxwell; Baillie, J. Kenneth; Ishizu, Yuri; Shimizu, Yuri; Furuhata, Erina; Maeda, Shiori; Negishi, Yutaka; Mungall, Christopher J.; Meehan, Terrence F.; Lassmann, Timo; Itoh, Masayoshi; Kawaji, Hideya; Kondo, Naoto; Kawai, Jun; Lennartsson, Andreas; Daub, Carsten O.; Heutink, Peter; Hume, David A.; Jensen, Torben Heick; Suzuki, Harukazu; Hayashizaki, Yoshihide; Mueller, Ferenc; Forrest, Alistair R. R.; Carninci, Piero; Rehli, Michael; Sandelin, Albin","Andersson, R; Gebhard, C; Miguel-Escalada, I; Hoof, I; Bornholdt, J; Boyd, M; Chen, Y; Zhao, X; Schmidl, C; Suzuki, T; Ntini, E; Arner, E; Valen, E; Li, K; Schwarzfischer, L; Glatz, D; Raithel, J; Lilje, B; Rapin, N; Bagger, FO; Jorgensen, M; Andersen, PR; Bertin, N; Rackham, O; Burroughs, AM; Baillie, JK; Ishizu, Y; Shimizu, Y; Furuhata, E; Maeda, S; Negishi, Y; Mungall, CJ; Meehan, TF; Lassmann, T; Itoh, M; Kawaji, H; Kondo, N; Kawai, J; Lennartsson, A; Daub, CO; Heutink, P; Hume, DA; Jensen, TH; Suzuki, H; Hayashizaki, Y; Muller, F; Forrest, ARR; Carninci, P; Rehli, M; Sandelin, A",455.0,"[Andersson, Robin; Hoof, Ilka; Bornholdt, Jette; Boyd, Mette; Chen, Yun; Zhao, Xiaobei; Valen, Eivind; Li, Kang; Lilje, Berit; Rapin, Nicolas; Bagger, Frederik Otzen; Jorgensen, Mette; Sandelin, Albin] Univ Copenhagen, Dept Biol, Bioinformat Ctr, DK-2200 Copenhagen, Denmark; [Andersson, Robin; Hoof, Ilka; Bornholdt, Jette; Boyd, Mette; Chen, Yun; Zhao, Xiaobei; Valen, Eivind; Li, Kang; Lilje, Berit; Rapin, Nicolas; Bagger, Frederik Otzen; Jorgensen, Mette; Sandelin, Albin] Univ Copenhagen, Biotech Res & Innovat Ctr, DK-2200 Copenhagen, Denmark; [Gebhard, Claudia; Schmidl, Christian; Schwarzfischer, Lucia; Glatz, Dagmar; Raithel, Johanna; Rehli, Michael] Univ Hosp Regensburg, Dept Internal Med 3, D-93042 Regensburg, Germany; [Gebhard, Claudia; Rehli, Michael] Regensburg Ctr Intervent Immunol RCI, D-93042 Regensburg, Germany; [Miguel-Escalada, Irene; Mueller, Ferenc] Univ Birmingham, Sch Clin & Expt Med, Coll Med & Dent Sci, Birmingham B15 2TT, W Midlands, England; [Zhao, Xiaobei] Univ N Carolina, Lineberger Comprehens Canc Ctr, Chapel Hill, NC 27599 USA; [Suzuki, Takahiro; Arner, Erik; Bertin, Nicolas; Rackham, Owen; Burroughs, A. Maxwell; Ishizu, Yuri; Shimizu, Yuri; Furuhata, Erina; Maeda, Shiori; Negishi, Yutaka; Lassmann, Timo; Itoh, Masayoshi; Kawaji, Hideya; Kondo, Naoto; Kawai, Jun; Daub, Carsten O.; Hume, David A.; Suzuki, Harukazu; Hayashizaki, Yoshihide; Forrest, Alistair R. R.; Carninci, Piero] RIKEN Yokohama Inst, RIKEN OMICS Sci Ctr, Yokohama, Kanagawa 2300045, Japan; [Suzuki, Takahiro; Arner, Erik; Bertin, Nicolas; Rackham, Owen; Burroughs, A. Maxwell; Ishizu, Yuri; Shimizu, Yuri; Furuhata, Erina; Maeda, Shiori; Negishi, Yutaka; Lassmann, Timo; Itoh, Masayoshi; Daub, Carsten O.; Suzuki, Harukazu; Forrest, Alistair R. R.; Carninci, Piero] RIKEN Yokohama Inst, RIKEN Ctr Life Sci Technol, Div Genom Technol, Tsurumi Ku, Yokohama, Kanagawa 2300045, Japan; [Ntini, Evgenia; Andersen, Peter Refsing; Jensen, Torben Heick] Ctr mRNP Biogenesis & Metab, Dept Mol Biol & Genet, DK-8000 Aarhus, Denmark; [Valen, Eivind] Harvard Univ, Dept Mol & Cellular Biol, Cambridge, MA 02138 USA; [Rapin, Nicolas; Bagger, Frederik Otzen] Univ Copenhagen, Finsen Lab, Rigshosp, DK-2200 Copenhagen, Denmark; [Rapin, Nicolas; Bagger, Frederik Otzen] Univ Copenhagen, Danish Stem Cell Ctr DanStem, DK-2200 Copenhagen, Denmark; [Baillie, J. Kenneth; Hume, David A.] Univ Edinburgh, Roslin Inst, Edinburgh EH25 9RG, Midlothian, Scotland; [Mungall, Christopher J.] Univ Calif Berkeley, Lawrence Berkeley Natl Lab, Genom Div, Berkeley, CA 94720 USA; [Meehan, Terrence F.] EMBL Outstn Hinxton, European Bioinformat Inst, Cambridge CB10 1SD, England; [Itoh, Masayoshi; Kawaji, Hideya; Kondo, Naoto; Kawai, Jun] RIKEN Yokohama Inst, RIKEN Prevent Med & Diag Innovat Program, Tsurumi Ku, Yokohama, Kanagawa 2300045, Japan; [Lennartsson, Andreas; Daub, Carsten O.] Karolinska Inst, Dept Biosci & Nutr, SE-4183 Stockholm, Sweden; [Hayashizaki, Yoshihide] Vrije Univ Amsterdam, Med Ctr, Dept Clin Genet, NL-1081 BT Amsterdam, Netherlands",FANTOM Consortium,,11/20/17,,10.1038/nature12787,Article,1476-4687,alistair.forrest@gmail.com; carninci@riken.jp; michael.rehli@ukr.de; albin@binf.ku.dk,+,"MEXT; MEXT, Japan; European Research Council/ERC [204135]; Novo Nordisk foundation; Lundbeck foundation; Deutsche Forschungsgemeinschaft [RE1310/7, RE1310/11, RE1310/13]; Rudolf Bartling Stiftung; ""BOLD"" MarieCurie ITN; ""ZF-Health"" Integrated project of the European Commission","FANTOM5 was made possible by a Research Grant for RIKEN Omics Science Center from MEXT to Y.H. and a Grant of the Innovative Cell Biology by Innovative Technology (Cell Innovation Program) from the MEXT, Japan, to Y.H. The A. S. group was supported by funds from the European Research Council FP7/2007-2013/ERC no. 204135, the Novo Nordisk and Lundbeck foundations. Work in the M. R. group was funded by grants from the Deutsche Forschungsgemeinschaft (RE1310/7,11,13) and Rudolf Bartling Stiftung. F. M. and I. M. E. were supported by ""BOLD"" MarieCurie ITN and ""ZF-Health"" Integrated project of the European Commission. We thank S. Noma, M. Sakai and H. Tarui for RNA-seq and sRNA-seq preparation, RIKEN GeNAS for generation and sequencing of the Heliscope CAGE libraries, Illumina RNA-seq and sRNA-seq, the Copenhagen National High-throughput DNA Sequencing Center for Illumina CAGE-seq, M. Edinger, P. Hoffmann and R. Eder for cell sorting, A. Albrechtsen, I. Moltke, W. Wasserman for advice, and the Netherlands Brain Bank for post-mortem human brain material.",AD6WN,Y,N,GENE-EXPRESSION; HUMAN GENOME; TRANSCRIPTION FACTORS; CAP-ANALYSIS; PROMOTER DIRECTIONALITY; REGULATORY SEQUENCES; ZEBRAFISH EMBRYOS; DNA METHYLATION; RNA-SEQ; ELEMENTS,7493.0,NATURE,Nature,English,73.0,No,"Lennartsson, Andreas/0000-0002-3272-2505; Fisher, Malcolm/0000-0003-1074-8103; Rashid, Mamoon/0000-0003-4851-4994; Katayama, Shintaro/0000-0001-7581-5157; Valen, Eivind/0000-0003-1840-6108; Meehan, Terrence/0000-0003-1980-3228; Wells, Christine/0000-0003-3133-3628; Otzen Bagger, Frederik/0000-0003-0636-8845; Ohno, Hiroshi/0000-0001-8776-9661; Arner, Erik/0000-0003-1225-4908; Itoh, Masayoshi/0000-0002-1772-318X; Suzuki, Harukazu/0000-0002-8087-0836; KONDO, NAOTO/0000-0001-9576-7615; Faulkner, Geoffrey/0000-0001-5769-4494; Mackay-Sim, Alan/0000-0003-4446-5371; Ovchinnikov, Dmitry/0000-0001-9603-8385; Kawaji, Hideya/0000-0002-0575-0308; Wolvetang, Ernst/0000-0002-2146-6614; Bertin, Nicolas/0000-0002-9835-9606; Baillie, John Kenneth/0000-0001-5258-793X; Hide, Winston Hide/0000-0002-8621-3271; Zhao, Xiaobei/0000-0002-5277-0846; Andersson, Robin/0000-0003-1516-879X; Daub, Carsten/0000-0002-3295-8729; Lassmann, Timo/0000-0002-0138-2691; Carninci, Piero/0000-0001-7202-7243; Sandelin, Albin/0000-0002-7109-7378; Kere, Juha/0000-0003-1974-0271; Rehli, Michael/0000-0003-3992-932X; Prendergast, James/0000-0001-8916-018X; Bodega, Beatrice/0000-0003-0527-9234; Freeman, Thomas/0000-0001-5235-8483; Blake, Judith/0000-0001-8522-334X; Wasserman, Wyeth/0000-0001-6098-6412; Miguel-Escalada, Irene/0000-0003-3461-6404; Forrest, Alistair/0000-0003-4543-1675; Jensen, Torben Heick/0000-0001-5127-1239; Lenhard, Boris/0000-0002-1114-1509; Rapin, Nicolas/0000-0001-5208-8874; Rackham, Owen/0000-0002-4390-0872; Taylor, Martin/0000-0001-7656-330X","MACMILLAN BUILDING, 4 CRINAN ST, LONDON N1 9XW, ENGLAND",27-Mar,13.0,LONDON,24670763.0,J,NATURE PUBLISHING GROUP,2014.0,"Jensen, Torben/G-2954-2017; Ohno, Hiroshi/L-7899-2014; Kenna, Tony/A-6035-2011; Arner, Erik/A-1895-2010; Itoh, Masayoshi/N-5363-2015; Suzuki, Harukazu/N-9553-2015; KONDO, NAOTO/A-5829-2016; Kawai, Jun/A-6451-2016; Faulkner, Geoffrey/M-3168-2014; Mackay-Sim, Alan/C-3431-2008; Ovchinnikov, Dmitry/J-7963-2014; Kawaji, Hideya/N-5116-2015; Wolvetang, Ernst/D-6644-2017; Bertin, Nicolas/C-3025-2008; Ravasi, Timothy/B-8777-2008; Baillie, John Kenneth/F-3124-2011; Hide, Winston Hide/C-7217-2009; Zhao, Xiaobei/G-3567-2014; Andersson, Robin/B-5311-2009; Daub, Carsten/A-7436-2010; Lassmann, Timo/A-8271-2008; Carninci, Piero/K-1568-2014; Sandelin, Albin/G-2881-2011; Muller, Ferenc/C-6426-2009; Kere, Juha/A-9179-2008; Rehli, Michael/E-9093-2011","Forrest, ARR (reprint author), RIKEN Yokohama Inst, RIKEN OMICS Sci Ctr, 1-7-22 Suehiro Cho,Tsurumi Ku, Yokohama, Kanagawa 2300045, Japan.",Science & Technology - Other Topics,0028-0836,NATURE,548.0,An atlas of active enhancers across human cell types and tissues,21.0,154.0,WOS:000333402000032,479.0,507,Multidisciplinary Sciences,552,albin,sandelin,22858.0,22,male,1.0,LogVjoAAAAAJ,5,"(17929, ]",na,0,na,0,na,na,0,0
