,Unnamed: 0.1,Unnamed: 0.1.1,AB,AF,AU,BP,C1,CA,CR,DA,DE,DI,DT,EI,EM,EP,FU,FX,GA,HC,HP,ID,IS,J9,JI,LA,NR,OA,OI,PA,PD,PG,PI,PM,PT,PU,PY,RI,RP,SC,SN,SO,TC,TI,U1,U2,UT,Unnamed: 0.1.1.1,VL,WC,Z9,c_fname,c_lname,citedby,count,gender,probability,scholar_id,quantile,range,page_id,has_page,page_id_nature,has_page_nature,page_title,page_title_nature,page_title_match,page_title_match_nature
0,81,273.0,"Tuberculosis remains second only to HIV/AIDS as the leading cause of mortality worldwide due to a single infectious agent(1). Despite chemotherapy, the global tuberculosis epidemic has intensified because of HIV co-infection, the lack of an effective vaccine and the emergence of multi-drug-resistant bacteria(2-5). Alternative host-directed strategies could be exploited to improve treatment efficacy and outcome, contain drug-resistant strains and reduce disease severity and mortality(6). The innate inflammatory response elicited by Mycobacterium tuberculosis (Mtb) represents a logical host target(7). Here we demonstrate that interleukin-1 (IL-1) confers host resistance through the induction of eicosanoids that limit excessive type I interferon (IFN) production and foster bacterial containment. We further show that, in infected mice and patients, reduced IL-1 responses and/or excessive type I IFN induction are linked to an eicosanoid imbalance associated with disease exacerbation. Host-directed immunotherapy with clinically approved drugs that augment prostaglandin E2 levels in these settings prevented acute mortality of Mtb-infected mice. Thus, IL-1 and type I IFNs represent two major counter-regulatory classes of inflammatory cytokines that control the outcome of Mtb infection and are functionally linked via eicosanoids. Our findings establish proof of concept for host-directed treatment strategies that manipulate the host eicosanoid network and represent feasible alternatives to conventional chemotherapy.","Mayer-Barber, Katrin D.; Andrade, Bruno B.; Oland, Sandra D.; Amaral, Eduardo P.; Barber, Daniel L.; Gonzales, Jacqueline; Derrick, Steven C.; Shi, Ruiru; Kumar, Nathella Pavan; Wei, Wang; Yuan, Xing; Zhang, Guolong; Cai, Ying; Babu, Subash; Catalfamo, Marta; Salazar, Andres M.; Via, Laura E.; Barry, Clifton E., III; Sher, Alan","Mayer-Barber, KD; Andrade, BB; Oland, SD; Amaral, EP; Barber, DL; Gonzales, J; Derrick, SC; Shi, RR; Kumar, NP; Wei, W; Yuan, X; Zhang, GL; Cai, Y; Babu, S; Catalfamo, M; Salazar, AM; Via, LE; Barry, CE; Sher, A",99.0,"[Mayer-Barber, Katrin D.; Andrade, Bruno B.; Oland, Sandra D.; Amaral, Eduardo P.; Sher, Alan] NIAID, Immunobiol Sect, LPD, NIH, Bethesda, MD 20892 USA; [Amaral, Eduardo P.] Univ Sao Paulo, Inst Biomed Sci, Dept Immunol, BR-05508900 Sao Paulo, Brazil; [Barber, Daniel L.] NIAID, Lymphocyte Biol Unit T, LPD, NIH, Bethesda, MD 20892 USA; [Gonzales, Jacqueline; Via, Laura E.; Barry, Clifton E., III] NIAID, TB Res Sect, Lab Clin Infect Dis, NIH, Bethesda, MD 20892 USA; [Derrick, Steven C.] US FDA, Ctr Biol Evaluat & Res, Bethesda, MD 20892 USA; [Shi, Ruiru; Wei, Wang; Yuan, Xing] Henan Chest Hosp, Zhengzhou 450003, Peoples R China; [Kumar, Nathella Pavan; Babu, Subash] Int Ctr Excellence Res, NIH, Madras 600031, Tamil Nadu, India; [Kumar, Nathella Pavan] NIRT, Madras 600031, Tamil Nadu, India; [Zhang, Guolong] SinoUS Int Res Ctr TB, Zhengzhou 450003, Peoples R China; [Zhang, Guolong] Henan Publ Hlth Ctr, Zhengzhou 450003, Peoples R China; [Babu, Subash] NIAID, Helminth Immunol Sect, LPD, NIH, Bethesda, MD 20892 USA; [Catalfamo, Marta] NIAID, Clin & Mol Retrovirol Sect, Immunoregulat Lab, NIH, Bethesda, MD 20892 USA; [Salazar, Andres M.] Oncovir Inc, Washington, DC 20008 USA",,,11/20/17,,10.1038/nature13489,Article,1476-4687,mayerk@niaid.nih.gov,U491,"NIAID Intramural Research program; Concept Acceleration Program-Award from DMID, NIAID","This work was supported by the NIAID Intramural Research program and a Concept Acceleration Program-Award (K.D.M.-B., B.B.A. and A.S.) from DMID, NIAID. We are grateful to K. Elkins, S. Morris, M. Belcher as well as the NIAID ABSL3 support staff for facilitating our animal studies. We thank R. Chen, L. Goldfeder and Q. Gao for sharing their clinical trial expertise and research facilities, respectively. We also thank K. Kauffman, R. Thompson, S. Hieny, P. Dayal, D. Surman, L. Meng, Z. Li, L. Lifa, Q. Shen and Z. Huang for technical assistance, H. Boshoff for help with direct anti-mycobacterial activity assays and M. S. Jawahar, V. V. Banurekha and R. Sridhar for recruitment and clinical evaluation of patients in Chennai, India. We are grateful to F. Andrade Neto, H. Remold, K. Arora, J. Aliberti, M. Moayeri, P. Murphy, A. O'Garra, R. Germain and C. Serhan for discussion or critical reading of the manuscript. Finally, we thank the patients, volunteer participants, and clinical staff of the Tuberculosis department of Henan Chest Hospital in Zhengzhou, China and the Department of Clinical Research (NIRT) and Department of Thoracic Medicine (Government Stanley Medical Hospital) in Chennai, India for their participation in our clinical studies.",AK1TN,Y,N,NECROSIS-FACTOR-ALPHA; MYCOBACTERIUM-TUBERCULOSIS; PULMONARY TUBERCULOSIS; LIPID MEDIATORS; INDUCTION; INFECTION; SUSCEPTIBILITY; INFLAMMATION; IMMUNITY; INNATE,7507.0,NATURE,Nature,English,32.0,No,"Amaral, Eduardo/0000-0001-5465-8113; Andrade, Bruno/0000-0001-6833-3811; Via, Laura/0000-0001-6074-9521","MACMILLAN BUILDING, 4 CRINAN ST, LONDON N1 9XW, ENGLAND",3-Jul,17.0,LONDON,24990750.0,J,NATURE PUBLISHING GROUP,2014.0,"Amaral, Eduardo/M-2456-2014; Andrade, Bruno/J-9111-2012; Barry, III, Clifton/H-3839-2012","Mayer-Barber, KD (reprint author), NIAID, Immunobiol Sect, LPD, NIH, 9000 Rockville Pike, Bethesda, MD 20892 USA.",Science & Technology - Other Topics,0028-0836,NATURE,195.0,Host-directed therapy of tuberculosis based on interleukin-1 and type I interferon crosstalk,9.0,104.0,WOS:000338199400044,273.0,511,Multidisciplinary Sciences,199,alan,sher,1318.0,2079,male,1.0,SKkUkqkAAAAJ,1,"[0, 1474]",na,0,na,0,na,na,0,0
1,12,256.0,"Endogenous retroviruses (ERVs), retrovirus-like elements with long terminal repeats, are widely dispersed in the euchromatic compartment in mammalian cells, comprising similar to 10% of the mouse genome(1). These parasitic elements are responsible for >10% of spontaneous mutations(2). Whereas DNA methylation has an important role in proviral silencing in somatic and germ-lineage cells(3-5), an additional DNA-methylation-independent pathway also functions in embryonal carcinoma and embryonic stem (ES) cells to inhibit transcription of the exogenous gammaretrovirus murine leukaemia virus (MLV)(6-8). Notably, a recent genome-wide study revealed that ERVs are also marked by histone H3 lysine 9 trimethylation (H3K9me3) and H4K20me3 in ES cells but not in mouse embryonic fibroblasts(9). However, the role that these marks have in proviral silencing remains unexplored. Here we show that the H3K9 methyltransferase ESET (also called SETDB1 or KMT1E) and the Kruppel-associated box (KRAB)associated protein 1 (KAP1, also called TRIM28)(10,11) are required for H3K9me3 and silencing of endogenous and introduced retroviruses specifically in mouse ES cells. Furthermore, whereas ESET enzymatic activity is crucial for HP1 binding and efficient proviral silencing, the H4K20 methyltransferases Suv420h1 and Suv420h2 are dispensable for silencing. Notably, in DNA methyltransferase triple knockout (Dnmt1(-/-) Dnmt3a(-/-) Dnmt3b(-/-)) mouse ES cells, ESET and KAP1 binding and ESET-mediated H3K9me3 are maintained and ERVs are minimally derepressed. We propose that a DNA-methylation-independent pathway involving KAP1 and ESET/ESET-mediated H3K9me3 is required for proviral silencing during the period early in embryogenesis when DNA methylation is dynamically reprogrammed.","Matsui, Toshiyuki; Leung, Danny; Miyashita, Hiroki; Maksakova, Irina A.; Miyachi, Hitoshi; Kimura, Hiroshi; Tachibana, Makoto; Lorincz, Matthew C.; Shinkai, Yoichi","Matsui, T; Leung, D; Miyashita, H; Maksakova, IA; Miyachi, H; Kimura, H; Tachibana, M; Lorincz, MC; Shinkai, Y",927.0,"[Matsui, Toshiyuki; Miyashita, Hiroki; Miyachi, Hitoshi; Tachibana, Makoto; Shinkai, Yoichi] Kyoto Univ, Inst Virus Res, Expt Res Ctr Infect Dis, Sakyo Ku, Kyoto 6068507, Japan; [Matsui, Toshiyuki; Miyashita, Hiroki; Tachibana, Makoto; Shinkai, Yoichi] Kyoto Univ, Grad Sch Biostudies, Sakyo Ku, Kyoto 6068507, Japan; [Leung, Danny; Maksakova, Irina A.; Lorincz, Matthew C.] Univ British Columbia, Dept Med Genet, Inst Life Sci, Vancouver, BC V6T 1Z3, Canada; [Kimura, Hiroshi] Osaka Univ, Grad Sch Frontier Biosci, Suita, Osaka 5650871, Japan",,,11/20/17,,10.1038/nature08858,Article,,mlorincz@interchange.ubc.ca; yshinkai@virus.kyoto-u.ac.jp,U149,"Ministry of Education, Culture, Sports, Science and Technology (MEXT) of Japan; CIHR [77805, 92090]","We thank M. Okano for Dnmt1<SUP>-/-</SUP> Dnmt3a<SUP>-/-</SUP> Dnmt3b<SUP>-/-</SUP> ES cells; T. Jenuwein and P. Singh for Suv39h1<SUP>-/-</SUP> Suv39h2<SUP>-/-</SUP> ES cells; T. Jenuwein and G. Schotta for Suv420h1<SUP>-/-</SUP> Suv420h2<SUP>-/-</SUP> ES cells; K. Hata for Dnmt3l knockout mice testes; M. Hijikata for the large-T antigen expression vector; S. Kuramochi-Miyagawa for IAP and LINE-1 probes; S. Smale for HP1 alpha antiserum; and L. Gaudreau for H2AZ antiserum. We are also grateful to P. Goyal and members of the Shinkai laboratory for technical support and D. Mager for critically reading the manuscript. This work was supported in part by the Genome Network Project from the Ministry of Education, Culture, Sports, Science and Technology (MEXT) of Japan, Grants-in-aid from MEXT to Y.S. and CIHR grants 77805 and 92090 to M. C. L. M. C. L. is a Scholar of the Michael Smith Foundation for Health Research.",579TM,,,ZINC-FINGER PROTEINS; MURINE LEUKEMIA-VIRUS; DNA METHYLATION; BINDING-SITE; CYTOSINE METHYLATION; HP1 PROTEINS; MOUSE; HETEROCHROMATIN; COMPLEXES; CHROMATIN,7290.0,NATURE,Nature,English,35.0,No,"Shinkai, Yoichi/0000-0002-6051-2484","MACMILLAN BUILDING, 4 CRINAN ST, LONDON N1 9XW, ENGLAND",8-Apr,6.0,LONDON,20164836.0,J,NATURE PUBLISHING GROUP,2010.0,"Shinkai, Yoichi/N-3909-2014","Shinkai, Y (reprint author), Kyoto Univ, Inst Virus Res, Expt Res Ctr Infect Dis, Sakyo Ku, 53 Shogoin,Kawara Cho, Kyoto 6068507, Japan.",Science & Technology - Other Topics,0028-0836,NATURE,278.0,Proviral silencing in embryonic stem cells requires the histone methyltransferase ESET,2.0,20.0,WOS:000276397300045,256.0,464,Multidisciplinary Sciences,283,yoichi,shinkai,54.0,4,male,1.0,NzBrF-kAAAAJ,1,"[0, 1474]",na,0,na,0,na,na,0,0
2,46,202.0,"Somatic alterations in cellular DNA underlie almost all human cancers(1). The prospect of targeted therapies(2) and the development of high-resolution, genome-wide approaches(3-8) are now spurring systematic efforts to characterize cancer genomes. Here we report a large-scale project to characterize copy-number alterations in primary lung adenocarcinomas. By analysis of a large collection of tumours ( n = 371) using dense single nucleotide polymorphism arrays, we identify a total of 57 significantly recurrent events. We find that 26 of 39 autosomal chromosome arms show consistent large-scale copy-number gain or loss, of which only a handful have been linked to a specific gene. We also identify 31 recurrent focal events, including 24 amplifications and 7 homozygous deletions. Only six of these focal events are currently associated with known mutations in lung carcinomas. The most common event, amplification of chromosome 14q13.3, is found in similar to 12% of samples. On the basis of genomic and functional analyses, we identify NKX2-1 ( NK2 homeobox 1, also called TITF1), which lies in the minimal 14q13.3 amplification interval and encodes a lineage-specific transcription factor, as a novel candidate proto-oncogene involved in a significant fraction of lung adenocarcinomas. More generally, our results indicate that many of the genes that are involved in lung adenocarcinoma remain to be discovered.","Weir, Barbara A.; Woo, Michele S.; Getz, Gad; Perner, Sven; Ding, Li; Beroukhim, Rameen; Lin, William M.; Province, Michael A.; Kraja, Aldi; Johnson, Laura A.; Shah, Kinjal; Sato, Mitsuo; Thomas, Roman K.; Barletta, Justine A.; Borecki, Ingrid B.; Broderick, Stephen; Chang, Andrew C.; Chiang, Derek Y.; Chirieac, Lucian R.; Cho, Jeonghee; Fujii, Yoshitaka; Gazdar, Adi F.; Giordano, Thomas; Greulich, Heidi; Hanna, Megan; Johnson, Bruce E.; Kris, Mark G.; Lash, Alex; Lin, Ling; Lindeman, Neal; Mardis, Elaine R.; McPherson, John D.; Minna, John D.; Morgan, Margaret B.; Nadel, Mark; Orringer, Mark B.; Osborne, John R.; Ozenberger, Brad; Ramos, Alex H.; Robinson, James; Roth, Jack A.; Rusch, Valerie; Sasaki, Hidefumi; Shepherd, Frances; Sougnez, Carrie; Spitz, Margaret R.; Tsao, Ming-Sound; Twomey, David; Verhaak, Roel G. W.; Weinstock, George M.; Wheeler, David A.; Winckler, Wendy; Yoshizawa, Akihiko; Yu, Soyoung; Zakowski, Maureen F.; Zhang, Qunyuan; Beer, David G.; Wistuba, Ignacio I.; Watson, Mark A.; Garraway, Levi A.; Ladanyi, Marc; Travis, William D.; Pao, William; Rubin, Mark A.; Gabriel, Stacey B.; Gibbs, Richard A.; Varmus, Harold E.; Wilson, Richard K.; Lander, Eric S.; Meyerson, Matthew","Weir, BA; Woo, MS; Getz, G; Perner, S; Ding, L; Beroukhim, R; Lin, WM; Province, MA; Kraja, A; Johnson, LA; Shah, K; Sato, M; Thomas, RK; Barletta, JA; Borecki, IB; Broderick, S; Chang, AC; Chiang, DY; Chirieac, LR; Cho, J; Fujii, Y; Gazdar, AF; Giordano, T; Greulich, H; Hanna, M; Johnson, BE; Kris, MG; Lash, A; Lin, L; Lindeman, N; Mardis, ER; McPherson, JD; Minna, JD; Morgan, MB; Nadel, M; Orringer, MB; Osborne, JR; Ozenberger, B; Ramos, AH; Robinson, J; Roth, JA; Rusch, V; Sasaki, H; Shepherd, F; Sougnez, C; Spitz, MR; Tsao, MS; Twomey, D; Verhaak, RGW; Weinstock, GM; Wheeler, DA; Winckler, W; Yoshizawa, A; Yu, SY; Zakowski, MF; Zhang, QY; Beer, DG; Wistuba, II; Watson, MA; Garraway, LA; Ladanyi, M; Travis, WD; Pao, W; Rubin, MA; Gabriel, SB; Gibbs, RA; Varmus, HE; Wilson, RK; Lander, ES; Meyerson, M",893.0,"Dana Farber Canc Inst, Dept Med Oncol, Boston, MA 02115 USA; Dana Farber Canc Inst, Ctr Canc Genome Discovery, Boston, MA 02115 USA; Harvard Univ, Canc Program, Broad Inst, Cambridge, MA 02142 USA; Harvard Univ, Genome Biol Program, Broad Inst, Cambridge, MA 02142 USA; MIT, Cambridge, MA 02142 USA; Brigham & Womens Hosp, Dept Pathol, Boston, MA 02115 USA; Univ Ulm, Inst Pathol, D-89081 Ulm, Germany; Washington Univ, Genome Sequencing Ctr, St Louis, MO 63130 USA; Washington Univ, Div Stat Genom, St Louis, MO 63130 USA; Washington Univ, Dept Pathol & Immunol, St Louis, MO 63130 USA; Univ Texas SW Med Ctr Dallas, Dallas, TX 75390 USA; Univ Cologne, Max Planck Inst Neurol Res, Klaus Joachim Zulch Labs, Max Planck Soc, D-50931 Cologne, Germany; Univ Cologne, Fac Med, D-50931 Cologne, Germany; Univ Cologne, Ctr Integrated Oncol, D-50931 Cologne, Germany; Univ Cologne, Dept Internal Med 1, D-50931 Cologne, Germany; Mem Sloan Kettering Canc Ctr, Dept Med, New York, NY 10065 USA; Mem Sloan Kettering Canc Ctr, Dept Surg, New York, NY 10065 USA; Mem Sloan Kettering Canc Ctr, Dept Pathol, New York, NY 10065 USA; Mem Sloan Kettering Canc Ctr, Dept Computat Biol, New York, NY 10065 USA; Mem Sloan Kettering Canc Ctr, Human Oncol & Pathogenesis Program, New York, NY 10065 USA; Mem Sloan Kettering Canc Ctr, Canc Biol & Genet Program, New York, NY 10065 USA; Univ Michigan, Thorac Surg Sect, Dept Surg, Ann Arbor, MI 48109 USA; Univ Michigan, Dept Pathol, Ann Arbor, MI 48109 USA; Harvard Univ, Sch Med, Dept Pathol, Boston, MA 02115 USA; Harvard Univ, Sch Med, Dept Syst Biol, Boston, MA 02115 USA; Nagoya City Univ, Sch Med, Dept Surg, Nagoya, Aichi 4678602, Japan; Baylor Coll Med, Human Genome Sequencing Ctr, Houston, TX 77030 USA; NHGRI, NIH, Bethesda, MD 20892 USA; Univ Texas Houston, MD Anderson Canc Ctr, Dept Pathol, Houston, TX 77030 USA; Univ Texas Houston, MD Anderson Canc Ctr, Dept Thorac Head & Neck Med Oncol, Houston, TX 77030 USA; Univ Hlth Network, Toronto, ON M5G 2C4, Canada; Princess Margaret Hosp, Toronto, ON M5G 2C4, Canada; MIT, Dept Biol, Cambridge, MA 02142 USA",,,11/20/17,,10.1038/nature06358,Article,,matthew_meyerson@dfci.harvard.edu,U22,"NCI NIH HHS [F32 CA113126-01A1, F32 CA113126-02, K08 CA122833-01A1, P50 CA070907]",,237RU,Y,N,HIGH-RESOLUTION ANALYSIS; TRANSCRIPTION FACTOR-I; COPY-NUMBER; HOMOZYGOUS DELETIONS; LENTIVIRAL VECTOR; SOMATIC MUTATIONS; FREQUENT TARGET; GENE DELIVERY; WIDE ANALYSIS; ARRAY CGH,7171.0,NATURE,Nature,English,40.0,No,"Sato, MITSUO/0000-0001-5458-9576; Kris, Mark/0000-0002-7317-5341; Lash, Alex/0000-0003-3787-1590; Giordano, Thomas/0000-0003-0641-8873; McPherson, John/0000-0001-8049-9347; Rubin, Mark/0000-0002-8321-9950; Chang, Andrew/0000-0001-9506-0425","MACMILLAN BUILDING, 4 CRINAN ST, LONDON N1 9XW, ENGLAND",6-Dec,9.0,LONDON,17982442.0,J,NATURE PUBLISHING GROUP,2007.0,"Meyerson, Matthew/E-7123-2012; Sato, MITSUO/I-7280-2014; Tsao, Ming-Sound/M-3503-2017","Meyerson, M (reprint author), Dana Farber Canc Inst, Dept Med Oncol, Boston, MA 02115 USA.",Science & Technology - Other Topics,0028-0836,NATURE,693.0,Characterizing the cancer genome in lung adenocarcinoma,2.0,44.0,WOS:000251394900059,202.0,450,Multidisciplinary Sciences,712,matthew,meyerson,67.0,3338,male,1.0,OOyBQU0AAAAJ,1,"[0, 1474]",na,0,na,0,na,na,0,0
3,121,153.0,"Understanding the dynamics of correlated many-body quantum systems is a challenge for modern physics. Owing to the simplicity of theirHamiltonians, He-4 (bosons) and He-3 (fermions) have served as model systems for strongly interacting quantum fluids, with substantial efforts devoted to their understanding. An important milestone was the direct observation of the collective phonon-roton mode in liquid He-4 by neutron scattering, verifying Landau's prediction(1) and his fruitful concept of elementary excitations. In a Fermi system, collective density fluctuations (known as 'zero-sound' in He-3, and 'plasmons' in charged systems) and incoherent particle-hole excitations are observed. At small wavevectors and energies, both types of excitation are described by Landau's theory of Fermi liquids(2,3). At higher wavevectors, the collectivemode enters the particle-hole band, where it is strongly damped. The dynamics of Fermi liquids at high wavevectors was thus believed to be essentially incoherent. Here we report inelastic neutron scattering measurements of a monolayer of liquid He-3, observing a roton-like excitation. We find that the collective density mode reappears as a well defined excitation atmomentum transfers larger than twice the Fermi momentum. We thus observe unexpected collective behaviour of a Fermi many-body system in the regime beyond the scope of Landau's theory. A satisfactory interpretation of the measured spectra is obtained using a dynamic many-body theory(4).","Godfrin, Henri; Meschke, Matthias; Lauter, Hans-Jochen; Sultan, Ahmad; Boehm, Helga M.; Krotscheck, Eckhard; Panholzer, Martin","Godfrin, H; Meschke, M; Lauter, HJ; Sultan, A; Bohm, HM; Krotscheck, E; Panholzer, M",576.0,"[Godfrin, Henri; Meschke, Matthias; Sultan, Ahmad] CNRS, Inst Neel, F-38042 Grenoble 9, France; [Godfrin, Henri; Meschke, Matthias; Sultan, Ahmad] Univ Grenoble 1, F-38042 Grenoble 9, France; [Meschke, Matthias] Aalto Univ, Low Temp Lab, Aalto 00076, Finland; [Lauter, Hans-Jochen] Inst Laue Langevin, F-38042 Grenoble 9, France; [Lauter, Hans-Jochen] Oak Ridge Natl Lab, Oak Ridge, TN 37831 USA; [Boehm, Helga M.; Krotscheck, Eckhard; Panholzer, Martin] Johannes Kepler Univ Linz, Inst Theoret Phys, A-4040 Linz, Austria; [Krotscheck, Eckhard] SUNY Buffalo, Dept Phys, Buffalo, NY 14260 USA",,,11/20/17,,10.1038/nature10919,Article,,henri.godfrin@grenoble.cnrs.fr,579,Austrian Fonds zur Forderung der wissenschaftlichen Forschung (FWF) [P21264]; French Agence Nationale de la Recherche [ANR-2010-INTB-403-01]; EU [228464],"We are grateful to the Austrian-French programme Amadeus for providing initial support; to the Austrian Fonds zur Forderung der wissenschaftlichen Forschung (FWF grant P21264), the French Agence Nationale de la Recherche (project ANR-2010-INTB-403-01) and the EU FRP7 low-temperature infrastructure grant Microkelvin (project number 228464) for funding this research; and to the Institut Laue-Langevin for use of the facility.",915EF,,,ELEMENTARY EXCITATIONS; EFFECTIVE-MASS; NEUTRON-SCATTERING; SPIN FLUCTUATIONS; ZERO SOUND; HE-3; FILMS; PLASMONS; GRAPHITE; DYNAMICS,7391.0,NATURE,Nature,English,31.0,No,,"MACMILLAN BUILDING, 4 CRINAN ST, LONDON N1 9XW, ENGLAND",29-Mar,4.0,LONDON,22460903.0,J,NATURE PUBLISHING GROUP,2012.0,"Meschke, Matthias/G-5166-2012","Godfrin, H (reprint author), CNRS, Inst Neel, BP 166, F-38042 Grenoble 9, France.",Science & Technology - Other Topics,0028-0836,NATURE,17.0,Observation of a roton collective mode in a two-dimensional Fermi liquid,5.0,40.0,WOS:000302006100034,153.0,483,Multidisciplinary Sciences,17,martin,panholzer,118.0,3568,male,1.0,oDRnEUgAAAAJ,1,"[0, 1474]",143848,1,143848,1,List of suicides,List of suicides,0,0
4,120,131.0,"In most eukaryotes, the progressive loss of chromosome-terminal DNA sequences is counteracted by the enzyme telomerase, a reverse transcriptase that uses part of an RNA subunit as template to synthesize telomeric repeats. Many cancer cells express high telomerase activity, and mutations in telomerase subunits are associated with degenerative syndromes including dyskeratosis congenita and aplastic anaemia. The therapeutic value of altering telomerase activity thus provides ample impetus to study the biogenesis and regulation of this enzyme in human cells and model systems. We have previously identified a precursor of the fission yeast telomerase RNA subunit (TER1)(1) and demonstrated that the mature 3'-end is generated by the spliceosome in a single cleavage reaction akin to the first step of splicing(2). Directly upstream and partly overlapping with the spliceosomal cleavage site is a putative binding site for Sm proteins. Sm and like-Sm (LSm) proteins belong to an ancient family of RNA-binding proteins represented in all three domains of life(3). Members of this family form ring complexes on specific sets of target RNAs and have critical roles in their biogenesis, function and turnover. Here we demonstrate that the canonical Sm ring and the Lsm2-8 complex sequentially associate with fission yeast TER1. The Sm ring binds to the TER1 precursor, stimulates spliceosomal cleavage and promotes the hypermethylation of the 5'-cap by Tgs1. Sm proteins are then replaced by the Lsm2-8 complex, which promotes the association with the catalytic subunit and protects the mature 3'-end of TER1 from exonucleolytic degradation. Our findings define the sequence of events that occur during telomerase biogenesis and characterize roles for Sm and Lsm complexes as well as for the methylase Tgs1.","Tang, Wen; Kannan, Ram; Blanchette, Marco; Baumann, Peter","Tang, W; Kannan, R; Blanchette, M; Baumann, P",260.0,"[Tang, Wen; Kannan, Ram; Baumann, Peter] Howard Hughes Med Inst, Kansas City, MO 64110 USA; [Tang, Wen; Kannan, Ram; Blanchette, Marco; Baumann, Peter] Stowers Inst Med Res, Kansas City, MO 64110 USA; [Tang, Wen; Kannan, Ram; Baumann, Peter] Univ Kansas, Med Ctr, Dept Mol & Integrat Physiol, Kansas City, KS 66160 USA; [Blanchette, Marco] Univ Kansas, Med Ctr, Dept Pathol & Lab Med, Kansas City, KS 66160 USA",,,11/20/17,,10.1038/nature10924,Article,,peb@stowers.org,U152,Stowers Institute for Medical Research; American Heart Association,"We thank S. Shuman for the tgs1 Delta strain, J. A. Box, J. T. Bunch, S. Hartnett and R. M. Helston for technical assistance, the Molecular Biology Core Facility for site-directed mutagenesis and sequencing, D. P. Baumann and R. M. Helston for proofreading the manuscript, and all members of the Baumann laboratory for discussions. This work was funded in part by the Stowers Institute for Medical Research. R. K. is supported by an award from the American Heart Association, and P. B. is an Early Career Scientist with the Howard Hughes Medical Institute.",930OV,,,NUCLEAR RIBONUCLEOPROTEIN PARTICLE; SCHIZOSACCHAROMYCES-POMBE; IN-VITRO; YEAST TELOMERASE; U6 SNRNA; PROTEIN; HYPERMETHYLATION; IDENTIFICATION; ASSOCIATION; LENGTH,7393.0,NATURE,Nature,English,33.0,No,"Baumann, Peter/0000-0003-4892-1485","MACMILLAN BUILDING, 4 CRINAN ST, LONDON N1 9XW, ENGLAND",12-Apr,6.0,LONDON,22446625.0,J,NATURE PUBLISHING GROUP,2012.0,,"Baumann, P (reprint author), Howard Hughes Med Inst, Kansas City, MO 64110 USA.",Science & Technology - Other Topics,0028-0836,NATURE,36.0,Telomerase RNA biogenesis involves sequential binding by Sm and Lsm complexes,1.0,22.0,WOS:000303149900039,131.0,484,Multidisciplinary Sciences,37,peter,baumann,112.0,4373,male,1.0,QuX8rrcAAAAJ,1,"[0, 1474]",1252101,1,1252101,1,Peter Baumann,Peter Baumann,1,1
